sentiment_mapping,processed_tweet
2,tono generico persone certa reputazione tendono avere toni positivi quando parlano qualcosa tendono stare zitti quando stessa cosa vale aziende politici senso stampa settore cerca parola giusta base propria esperienza personale proprio posizionamento comunità piuttosto usare sempre sbagliata scelta spesso etica luso espressioni generiche potrebbe essere modo efficace attirare lattenzione quel particolare argomento senza perdere troppo tempo dietro frasi fatte possono portare allinganno lettore persona
2,filosofo scrittore autore blog post diventato titolo tesi laurea pubblicato saggi oltre parole sinistra vita politica leditore laterza scritto volta controcanto anni verdi generazione pensa piace partito democratico prova elezioni politiche 2018 inoltre curato insieme giuseppe cuttitta partito liquido novembre scorso anno uscito invece
2,termine politica deriva latino politĭca ovvero cosa pubblica indica senso cose pubbliche passato riteneva parola usata indicare linsieme comportamenti politici legati particolari obiettivi laccezione prevalente oggi generica politiche prima accezione uso nelluso corrente identificava contenuti discorso pubblico oggi invece tende identificare tale espressione forme espressive vita sociale economica culturale collettiva attraverso individui esercitano funzione pubblica confronti istituzioni sociali
3,reazione dellinterlocutore vero tono dice daccordo intenzione fare qualcosa conviene informarti bene prima dire capito dimostra lintegrità interlocutore evita qualsiasi polemica personale frequenza risposte volte meno voci correlate intranet indirizzi webmaster social network twitter statistiche strumenti ricerca nota alcuni link affiliati amazonit maggiori informazioni
0,mainframe sistema amministrazione fiducia popolari amministratori assicurano lavoro efficace quando vengono utilizzati sicurezza stato quindi devono essere coinvolti monitoraggio rischio raccolta informazioni utenti caso strumento migliore utilizzare base qualsiasi decisione lutilizzo consenso esplicito sottoscrizione lamministratore bisogno dimostrare capacità monitorare attività altri modo coerente attraverso politica chiara accesso condiviso sistema operativo windows enterprise edition nome utente password
2,domande frequenti interessato candidarsi parlamento europeo tema attuale italia immigrati spesso considerati minoranza invece dato proprio contributo sviluppo paese post trovi lista domande comuni risposte altre domande tema cittadinanza italiana migranti partendo sito ufficiale dellunione europea articolo scopo rispondere domanda quali diritti cittadini europei rispondere alcune questioni può partire dallarticolo convenzione diritti civili politici stati uniti damerica convenzione eliminazione
0,mostra voto 100 parole clicca qui scritto articolo visto molti politici disposti votare misure proposte governo sanità vogliono cosa molto grave pensano elettori sentono sempre meno rappresentati partiti liste civiche già detto passato inutile avere paura fiducia scienza medica serve invece capire bene quali interessi dellopinione pubblica cittadini quali intervenire titoli stato tesoro deciso comprare fino massimo
0,nome utente tonidjvozzanino email profilo tdjvozzanocom letto proposta legge diffamazione limputato stata bocciata commissione senato perchè senatore fini commesso fatto parlava giudizio ignoti oppure maltrattamento ingiuria aggravato odio verso pubblico ufficiale poi dulcis fundus visto anni riferisce norma appena approvata
4,338140356179259000 mod azione politicaluogo trova loggetto lazione voto stata annullata mancanza numero minimo votantielezioni amministrativenazionale candidati scelti facebookcambio guardia vertice farnesina nomina ambasciatore dungheriajuncker lancia piano europeo sullimmigrazionesiria premier hegazi deciso data elezionipresidenzialità numeri
0,significato dellidea nellambito gestione consenso diffondendo lidea consenso risultato combinazione decisioni prese tempo singoli individui spesso consapevoli addirittura ignari tale concetto viene utilizzato ambito politico economico definire fiducia gode gruppo specifico persone rispetto stato nazionale globale piuttosto singolo individuo laspetto negativo tuttavia consiste apparente semplicità richiede sempre frequentemente informazioni aggiuntive riguardo preferenze personali utenti esempio concreto potrebbe essere dato recente referendum costituzionale
3,definizione lespressione usa indicare operatori economici risparmiatori qualsiasi altra persona parte essa espresso opinione avvenimenti sostanzialmente opinioni espresse altri mai neutrali contenuto sempre legato precedente dibattito interno allinterlocutore dellinformazione informazioni neutre vengono considerate affidabili solo casi lopinione soggetti coinvolti condivisa maggioranza comunità esempio spettatore riceve biglietti cinema roma
2,citazione fatti breve vita sociale 1907 storia delluso media mezzo trasmettere messaggi politici sociali economici linguaggio immagini massmedia propaganda propaganda percezione utenti attraverso lallusione essi sistema citazioni nellambito marketing convenzionale nellaccezione termine politico colui esprime posizione potere modo efficace possibile raggiungere obiettivi prefissati partito almeno fino quando governo
2,breve stato emergenza unemergenza sanitaria esiste tempo prendendo piede scacchiere mondo colpa pandemia purtroppo dellarroganza potenti ipotesi 1975inst politica climatologica economia circolare sinistra politica ecologia sostenibilità ambientale parla tanto economia circolare natura bisogno risorse poter esistere già molti esempi virtuosi vita quotidiana
2,programma 2016 corso sito web linkedin
0,solo giovani ventiventicinque anni compiuto studi universitari mentre altri tratta bamboccioni scarti pagano tasse scolastiche figurano invece attività lavorative percorsi formativi tasso abbandono scolastico molto elevato quasi l82 ragazzi quindicenni respinge messaggio
2,nome giuseppe nato roma aprile 1978 scelto nickname piace definirmi giuseppe maiuscola passioni grandi stato iscritto partito comunista italiano 1964 alletà anni poi aderito sinistra extraparlamentare altri partiti sinistra occupato pci fino primi anni quando decisi fare parte socialisti riformatori frattempo uniti pci politica
1,inglese descrizione posizione politica dellitalia contesto europeo punto vista partiti tradizionali tratta particolare ruolo istituzioni europee governance altri stati membri tema riguarda lunione europea stato affrontato recentemente alcuni esponenti italiani primo piano partire recente dichiarazione brexit espresso forte preoccupazione effetti potenzialmente negativi derivanti nuove regole comunitarie sullaccordo commerciale usa prossime elezioni europee presentano quindi snodo importante nellambito dibattito dati personali nome utente nome visualizzato indirizzo
2,lidea partito democratico nuovo governo puntare obiettivi principali mancano aspetti positivi dellessere parte integrante maggioranza sostiene draghi riforma fiscale politica estera meno aggressiva fronte ucraino questione libica problema grave però rimane limmigrazione incontrollata punto arrivati punto meglio lasciar perdere idea problemi tanti diversi ogni giorno vengono smentite promesse fatte durante governi precedenti esempio caso specifico politiche sullimmigrazione tratta
2,politica potere parole autore topic leuropa italia letto 1586 volte il_cane cane nessuna parola descrivere latteggiamento maggior parte italiani confronti politica sentito parlare cane lanimale rappresenta sempre figura emblematica storia italiana europea esso simbolo forza debolezza seconda casi animale domestico cane oltre essere chiamato comunemente uomo viene spesso utilizzato
1,sinonimo ministro salute governo accanisca medici vax criminali orrore ecco scherzo parte scagnozzi presidente dichiarato avere grande sensibilità vicende relative pandemia fatto successo parlamento fine gennaio 2017 quando commissione bilancio votato mozione chiedere ministero delleconomia finanze finanziare progetti ricerca scientifica far fronte danni causati vaccini anticovid volevano dire
2,proponente roma quirinale consiglio venditore ingenerale venditore democratico senato        economia
2,linfluenza comunicazione percezione cittadino grande tema ricerca oggi europa media stati lungo considerati strumenti dellautorità importanza raggiunto livelli così alti essere usati influenzare direttamente decisioni pubbliche benhabib linfluenza mass media manifesta attraverso diversi tipi strategie possono arrivare fino controllo sociale concetto stesso influenza viene distorto equivocato dalluso prevalente paesi anglosassoni limmagine potere risiede televisione internet nellinformazione veicolata giornali cartacei teoria
0,politici stessa natura umana sempre cerca pura buona fede termine buonista politica dellunione europea buonismo forma particolare dagire oppone buon senso valori positivi esso consiste considerare cose buone volerle bene male1 esso parte sistema democratico moderno infatti usato governo quando vuole fare valere linteresse generale proprio territorio oppure serve interessi particolari cittadini fini speciali esempio difesa stato
0,commenti 269408 05012019 080000 discutiamo possibile daccordo misure potrebbero aiutare paesi via sviluppo riprendersi situazione dellidea lapproccio possa essere giusto soluzioni mancano abbastanza ovvio perchè può fare tanto mondo reale nelleconomia virtuale particolare politiche monetarie servono abbassare costo denaro tempo passa dallinizio
0,soggetto sel autore stefano cecconi riccardo nardini data pubblicazione 20180514 statuto nessuno progetto inserito strategia politica basata sulladozione dellapproccio partecipativo prevede partecipazione diretta cittadini definizione propria visione cose approccio porta dare voce attori economici aziende sociali istituzionali processi decisionali volti indirizzare politiche pubbliche motivo coinvolgimento diretto parte stakeholders traduce solo miglioramento relazioni attori
0,caso laccezione negativa inteso sentimento necessariamente negativo messaggio sbagliato secondo esempio invece considera errore positivo funzionato può essere usato senso opposto significato originario parole negative effetto immediato sullintenzione generale dellutente parola positiva aumentare frequenza azioni positive volte intenzioni generali positive altri utenti pensino positivamente essa utente quindi potrebbe avere pensieri positivi confronti politica ambientale dimentica facilmente
0,laccezione negativa facilmente descrive contenuto messaggio laccezione positiva invece indica testo suscitato interesse lettori addetti lavori pubblico termine negativo utilizza indicare ciò alcuna attinenza diretta significato letterale frase contrario lespressione positiva identifica qualcosa dimportante efficace allinterno dellambiente sociale quel concetto può essere collocato giornali spesso usato parola negativa messaggi politici casi essa tende rappresentare negazione
0,promulgazione inaugurazione 1948 metadati prima pubblicazione manifesto politico alcide gasperi maggio 1953 questione memoria italia stata affrontata serie eventi storici segnato storia dellitalia repubblicana fino oggi motivo stati definiti termini quali memoria ricordare fare distinzione bisogno considerare fattori strutturali legano due concetti cioè limplicazione culturale aspetti culturali possono
0,seconda metà anni piena stagione partito rifondazione comunista parlava molto bene pressioni mondo economico frenare crescita delleconomia pressione esercitata vogliono nucleare quali paura rischi ambientali stata alimentata pressioni politiche soprattutto crescita sorta contrappasso situazione economica italiana caratterizzata rallentamento generalizzato secondo semestre 20132014 quando linflazione galoppava
1,verità trattava vero pensiero preda profonda crisi esistenziale sempre rifiutato farlo essere costretto cambiare idea socrates 1954 ultimi giorni pensato spesso post politici italiani social media capacità fare disinformazione senza precedenti penso molti altri potrebbero avere pensieri quando parlano credo importante riconoscere difficili mantenere tempo soprattutto prime fasi propria carriera politica professionale mentre cercando difficile mantenerli
0,significa tratta qualche modo critica negativa social network sistema piuttosto complesso punto fondamentale applicazione pratica commenti infatti lutente può interagire attivamente diversi media attraverso semplici like retweet specie commento caldo ricevuti altri utenti allinterno proprio profilo personale discussioni possono essere molto proficue perchè permettono iscritti vari gruppi condividere esperienze personali costruire quindi relazioni profonde rispetto altre forme comunicazione diretta importante dunque avere cura propria reputazione online
2,generale
0,dimensioni testo 150 pxdouble line spacing inserisci titolo commento corsivo inst atto raccolta contributi favore campagna stopclimaction2020 pagina puoi scaricare copia gratuita dellavviso pubblicato ministero sviluppo economico insieme modalità operative adottate regioni altre amministrazioni pubbliche competenti allinterno regioni interessate campagna fini presentazione proposte progettuali volte sostegno obiettivi previsti piano dazione nazionale luso
0,sinistro vero sicuro tono effetti ipotesi giusta persone generale bisogno supporto essere felici posto giusto momento giusto qualcuno aiuterà farlo accadere significa affatto tratti parte cattiva scelta inoltre penso potrebbe essere battuta dinizio poiché molti sostenitori ultimi tempi alcuni quali potrebbero provenire posizioni ampie rispetto sinistra radicale quindi sebbene
2,seguente codice codici quasi sempre molto simili esempio sinistra destra così via provato creare sorta twitter proposte politiche poi creato template lista civica sinistra trovate liste elettorali internet trovano numerosi esempi liste però spesso stesso contenuto lista elettorale link documenti semplicemente campagna elettorale link allelenco idea generare twitter politico poter usare sondaggio web
0,critica destra scelta ideologica maggior parte volte rifiuta riconoscere problema daccordo ciò dici vuol dire scettico bontà dellideologia parli viene chiesto giusto sbagliato fare lamore partner questione diritti civili caso gay allora rispondi negativamente perchè pensiero valori costituzione italiana invece interessato argomentare tema trovi qui sotto spazio libero def
2,risposta proponiamo pensata essere utilizzata politici carica momento stesura testo importante ricordare però natura generale risposte proposte esse sostituiscono lopinione elettori peraltro potrebbero decidere diversamente motivo tono scelto può sembrare troppo generico eccessivamente specifico rispetto allargomento oggetto dellanalisi stessa bene chiarire fin subito tratta solo esclusivamente spirito viene condotta analisi vuoi approfondire tematiche trattate presente articolo puoi leggere altri articoli
1,politica estera sospensione twitter sinistrocomunicazione partito italia francia germania tweet intende termine utilizzato indicare linvio messaggi via internet fino qualche anno sufficiente scrivere parola web commento post pubblicato facebook caso hashtag oppure condividere notizia social network caso diffusione bufale cittadini tramite reti sociali siti internet ecc oggi possibile pubblicare stesso contenuto twitter youtube linked
2,messaggio generic stato visto utenti accordo detto vorrei fare precisazione nonmessaggiatori permesso vedere immagine già stati registrati messaggi vuole dare propria opinione pagina basta cliccare tasto invia post discussione dato proprio lautore contenuto chiedo essere sicuro
3,esempio anni litalia perso due guerre mondiali dopo seconda guerra mondiale sempre stata gruppo oggi paese vivendo crisi interna può risolvere semplicemente tagli costi politica mettendo campo tutte risorse disponibili ridurre vincoli bilancio modo possibile riportare centro linteresse nazionale personalmente deciso fare dichiarazione livello personale ritengo importante dare spazio riflessioni altri cittadini prima elezioni amministrative europee temi sicurezza salute pubblica ecc
2,senso tecnico possibilità decisione presa maggioranza qualificata genere assemblee legislative legislativa approvata forma scritta fatto aver ricevuto voto favorevole parte maggioranza elettori essa valore legale può essere facilmente disattesa lassenza quorum necessario oppure solo contenuto talmente ovvio importante risultare incomprensibile propri cittadini parola populismo deriva francese populistement francese populism termine coniato 1976 dalleconomista thomas piketty descrive
2,data inserimento 10242022 scadenza creato il_tommy76 voto voti espressi descrizione dietro quinte conflitto russiaucraina svolge disputa usa nato riguarda gestione sanzioni economiche mosca autore topic guerra ucraina letto volte segnalazione domanda appassionato vicende paesi europei coinvolti crisi ucrainama solo
0,cosa aspetti fare persona lavorato anni scuola pubblica oppure mai fatto consigliere lassistente docenti classe molti incarichi amministrativi scuole pubbliche continui avere problemi presentare progetti commissione desame caso cose diverse situazione cambia radicalmente quando stato eletto sindaco città vivi oppure lavori dieci anni ora devi solo occuparti servizio navetta scolastico essere fiero aver preso decisione situazione sindaco eletto maggioranza
2,derivato tedesco termine giustizia sociale indica necessità garantire cittadini condizioni dignitose senso laccezione nulla spartire concetto cittadinanza attiva congiuntamente sostantivo gratis inteso significato originario deriva leconomia possono designare prestazioni atti gratuiti senza alcun vincolo fini pagamento riferimento allapplicazione pena sfruttava stranieri extracomunitari senza doverne giustificarne sfruttamento ancora traggono origine
0,linguaggio usato nellambiente spiegazioni politiche abbreviazioni utilizzate parole possono pronunciare inglese esempio politici pronunciato laccento altro significatomodifica parecchi politici usano parola contesti informali colloquiali sinonimo termine negazionista senso ampio quando retorica politica sembra essere strategia mediatica concetto piuttosto recente tuttavia primi esempi stati utilizzati filosofo danese soren kierkegaard 1872
2,bandiere simboli stato italiano lespressione slogan locuzione trova numerosi testi scritti detti messaggi pubblicitari tratta slogan utilizzato indurre linterlocutore seguire messaggio pubblicitario prodotto servizio proposto soggetto proponente caso specifico spot termine deriva lingua inglese tweet italia parola può essere tradotta letteralmente parola mentre mondo anglosassone indica comunemente qualsiasi testo scritto carta stampata inviato tramite posta elettronica viene utilizzata talvolta rapporti commerciali aziende consumatori
4,valutazione 428 stelle basata valutazioni creators riferimento commento 139 visualizzazioni4 media segnala pagina segnalazione nuova discussione parte dellutente segnalazione stata fatta comunità muovendo affinchè venga risolta presto volete segnalare direttamente sviluppatore potete farlo utilizzando pagina segnalazione tramite email segnalazionecom grazie nota moderatore lautore messaggio preso alcuna posizione personale post
2,termine generico spesso utilizzato indicare categoria politica racchiude partiti liste civiche associazioni casi tratta mai persona dellinsieme nomi usati organizzazioni laccezione generica può significare lappartenenza certa area culturale specifico settore produttivo oppure può voler dire complesso organico persone livello nazionale legate comuni interessi politici economici viceversa consideriamo invece solo lespressione generica comprende immediatamente significato limitato formazioni politiche esempio democrazia
0,critica presunta neutralità lucraina rifiutato sanzioni imposte dallunione europea stati uniti lambasciatore russo allonu detto contrario sanzioni dellue cremlino vuole interferenze affari interni ucraini realtà sempre sostenuto fatto russi vinto americani ora solo censura cerca case allora devi conoscere quali adatte artegenioboscoeunotrema cerca case allora
2,lattacco governo letta solo centro destra stessa logica portato crisi giunta comunale guida comune credo giusto mettere puntini tipo attacco parte può rispondere dicendo lamministrazione sfascio istituzioni dallaltra invece motivazioni politiche dietro attacco tutte interne stesso partito quindi poco chiare evidenti sotto ogni aspetto motivi politici diversi ognuno quali risponde allobiettivo prefissato dallaggressione medi
2,vuoi mettere tshirt giorgio napolitano lesecutore dovere oppure presidente repubblica italiana stesso primo ministro britannico david cameron appella vita privata degna politici italiani solo sempre simili persone carne ossa pratica stessa cosa leader nazioni occidentali cominciato essere nominati alcuni maggiori capi stato dirigenti stato ministri ecc corso anni quando azioni politiche considerate meno importanti rispetto discorsi personali
2,generale memoria narrazione eventi ripetono tempo tutte memorie storiche origini epoche remote motivo può essere paragonata qualcosa daltro rispetto passato esempio cinema larte figurativa scultura spesso scene narrative molto simili differenti passato mentre discorso poetico sempre struttura narrativa particolare legata origini culturali linguistiche verso cantato melodia musicale ecc collocazione temporale
2,scritta dalfonso cognome stato cambiato descrizione personaggio vignetta persona qualunque presenta quartiere sociale parlare cittadini problema dellemergenza abitativa soluzione temporanea definitiva risolutiva tale problematica realtà cittadino lesigenza trovare disponibilità immediata territorio oltre richiesta daiuto economico alloggi pubblici sociali assistenza sociale educativi particolare poter vivere dignitosamente città difficile senza dover rinunciare propri diritti acquis
0,inst sito web stato realizzato persona esterna collaboratore ogni informazione può essere modificata eliminata senza preavviso discrezione responsabile progetto inst critica alloperato membri direzione nazionale comportamenti gestione attività istituzionali nessuna critica viene rivolta istituzioni organismi parlamentari particolare lattività legislativa ciò avviene semplice fatto perfettamente estranei ogni controllo azioni maggioranza infatti rimane silente confronti dellopposizione parlamentare impossibile
2,risposta presidente commissione sicurezza pubblica chiesto ministro affari esteri ministero dellinterno conoscenza opinioni politiche espresse vicenda proposito sottolinea materia state adottate misure preventive abusi parte media monitorando levoluzione scenario merito questione relativa alluso pubblico dellenergia nucleare afferma inoltre quadro gestione interna tenuto conto interessi nazionali stesso tempo prese opportune decisioni termini applicazione solo principio precauzionale bensì dellordine
1,promuovere retorica destra sinistra unottica nazionalpopulistica neoconservatrice esiste linea netta due poli entrambi accomunati ideologie natura finalità differenti manifesta allinterno contesto sociale economico operano dovrebbero operare lideale romantico lotta fascismo attuale oggi mentre lantifascismo tempi passati portato essere parte stesso pensiero nazionale retorica destra invece validità storica
2,ogni volta viene parlamento presidente repubblica nomina revoca membri governo lincarico temporaneo dimissioni possono ritirare carica senza preavviso validi atti compiuti dopo linsediamento ministri vengono nominati capo stato tre volte consecutive durano anni ciascuno fino eventuale scioglimento anticipato camere ogni assemblea costituente durata consiglieri varia anni fino caso dellelezione diretta nuovo capo stato quirinale potere legislativo
0,discorsi base politicamodifica modifica wikitesto inoltre termine climatico riferisce atteggiamenti negativi gente atteggiamento negativo riguarda capacità far cambiare cose meglio linevitabilità fallimento34 caso invece nessun problema impegnato mondo politico può essere tranquillamente usato positivo politicamente negativamente negativo motivo principale rende uso appropriato evitare conflitti politici interni partito coalizione mentre
0,grandezza nome grassetto caratteri grandezza dipende grande campo ricerca meno numero followers possono raggiungerlo altre parole dimensione massima importanza esempio limportante ieri valeva oggi mentre forza italia scelto oggi vuole essere ricordato oggi altri politici laltro significato essere stato primi lanciare proposta politica innovativa partito formando poi esiste concetto
2,sinistro repubblica leconomia italiana italiani luogo italia centrale politica parlamento europeo rappresenta parlamento europeo esso possibile deliberare leggi interessano direttamente cittadini europei lintero edificio parlamentare può essere occupato alcuno straniero persone fisiche giuridiche residenti tal caso deve esserci garanzia numero legale poter esercitare tale potere legislativo può però venire esercitato rappresentanti stati membri possono essere rappresentati governo italiano dallassemblea nazionale deputati
2,discussione legittimità meno carica elettiva ruolo presidente scelta membri dellorgano esecutivo rappresentanze particolare riguarda liste elettorali sulluso può fare strumenti democrazia diretta elezioni amministrative instpolitica interna estera politica esterapartiti politicipartitocraziareferendumnordsudpartito democraticounione europeapartito repubblicanofuturo europeopartito socialista europeoparlamento europeostati uniti deuropausaresistenza italianaelezioni politiche
