sentiment_mapping,processed_tweet
2,discutere partiti politici grado influenzare vita democratica paese ogni partito coalizione missione specifica può essere espressa costituzione obiettivi regolamenti interni elettorali leggi interne natura partiti definita ciò essi disposizione svolgere compiti specifici modo efficace possibile cioè sistema elettorale consente cittadini scegliere deve guidare governo termini troviamo spesso dinanzi necessità massima independence interessi particolari diverse parti politiche proposito tuttavia
1,segnali fumo scusa dico fare critiche costruttive elezioni poi vince lastensionismo campagna elettorale perenne interesse personale volontà dintraprendere qualcosa credi profondamente capacità comunicative rendono difficile vincere cose facili dire difficili fare cose complicate impossibili dirsi senza essere smentiti destinatario messaggio chiedi spiegazioni
1,discussione testo riforma modifica disposizioni relative allinsegnamento lingua italiana traduzione stata rilasciata dallagenzia italiana stampa agi marzo 2014 riporta wikipedia versione inglese larticolo parte nuovi articoli pubblicati gazzetta ufficiale lautore fornito alcuna indicazione nome nuovo articolo inserire testo fonte google libri nuove norme applicano tutte scuole italiane studenti stranieri nati arrivo italia nuovi obblighi riguardano solo
2,parola riferisce allaccezione popolo concetto esempio nazione ovvero linsieme cittadini appartenenti stato lingua italiana termine assume connotazione partito senso specifico significato etimologico cioè entità collettiva parla platone repubblica struttura codice destra definizione sinistra ogni caso scopo mettere insieme elenco completo elementi costitutivi dellintero programma elettorale modo poterli inserire liste elettorali senza rischiare
2,politicamodifica modifica wikitesto scheda critiche alloperato 10834 fatto quotidiano dicembre 2019 url consultato marzo 2020 parametro sconosciuto accesso richiede javascript proposito critiche rivolte operato ritenuto opportuno chiarire alcuni aspetti emersi discussione svoltasi corso seduta odierna consiglio comunale così dichiarato sindaco livorno luca salvetti dopo linformativa bilancio approvata
3,sintesi memoria partito primi anni secolo parola stata adottata usa partito democratico francia dalluprd unione potere democratico germania spd cdrd deve ancora parlare stati uniti damerica italia maggior parte partiti stati considerati partiti politici solo pochi acquisito dignità partito nazionale locale volte spesso soltanto spirito appartenenza territorio nazionale quindi gruppi politici appartengono alcun gruppo particolare
3,titolo traccia diritti lavoratori significato traccia tema tutela lavoro realtà datori lavoro ricorrono tipo strumenti genere stranieri multinazionali molto spesso tratta persone lavorano pubblico impiego nellindustria privata riferimento specifico azienda straniera dovuto fatto molte volte investimenti attività lavorative allestero vengono effettuati aziende italiane quindi necessità ricorrere legge italiana fare ciò tuttavia ultimi tempi tale legislazione subito cambiamenti tali
2,segnale dallarme politica italiana partito presidente repubblica dovesse fare meno punti programmatici contenuti programma particolare limpostazione fondo orientata presa redini italiane mano forze politiche vogliono realizzare vera svolta rispetto allepoca anni esempio rappresentato progetto scuola voluto lega nord movimento nazionale voce messaggio dunque indirizzato centrodestra italiano solo altri partiti centro destra forza italia fratelli
0,150 messaggi 382 domanda storia segnato vita riferimento caso signor kant teoria relatività newton galileo ferraris biondi solo alcune storie raccontate scuole elementari tante altre raccontare bambini grandi vorrebbe troppo spazio nota bene affatto detto nome stato scelto caso casuale politici sopra menzionati visto largomento
2,ieri febbraio ore 930 italiane italiane presidente consiglio mario draghi annunciato litalia diventata primo paese aver accettato richiesta russia fornire armi allucraina ribadito limpegno fare ciò serve evitare nuova escalation conflitto nelleuropa orientale larticolo contiene alcuna valutazione commento decisione presa governo contebis dunque contenuti valutare separatamente rispetto giudizi generali sullintero contesto internazionale cosa importante qui sottolineare senza entrare
0,inglese traduzioni italiano categorie politica società politica economia inst scrivi tweet politico italiano caratteristiche problemi cosa capisco proprio politici italiani solito coraggio azioni altri invece meno capaci niente migliorare situazione attuale paese volte provano stesso chiaramente tratta sempre stessa persona già perso diverse elezioni anni prima averne vinte due
0,pubblicato matteo commenti utente chiesto politica politica interna anni critica comportamento elettorale politics politica alcune recenti discussioni sollevato questione politici debbano meno dare giudizi propria condotta ebbene argomento stato ampiamente discusso corso ultimi decenni riviste specializzate istituzionali new york times avviso critica efficace prassi dovrebbe essere motivata necessità puntare lindice dellopinione pubblica candidato preferito
3,politica informazione comunicazione pubblica parola chiave informazioni ogni informazione parla qualcosa fonte insieme fonti termine applica ciò viene trasmesso pubblico senza intermediazione esempio attraverso web informazioni ottenute internet capacità modificare stato dellinformazione modo indipendente momento trasmissione annullamento sorgente iniziale caso rete 17498 visualizzazioni totali media voti post totalizzato
2,scelta iniziale testo parte dellautore grassetto critica politica novembre giorno dopo elezioni politiche grecia formazione nuova maggioranza parlamentare viene pubblicato quotidiano azione larticolo politici controcorrente firma carlo calenda lautore sottolinea politici spesso chiamati assumere decisioni possono sembrare banali troppo impegnative poi accorgono aver sbagliato strada quando devono prendere decisioni importanti così oggi lincipit dellarticolo recita
0,altre accezioni usate riferimento definizione possono essere negativo senso pensiero negativo persona criticare viene detto positivo cioè ciò può ragionare positivistico ovvero latto pensare entrambi caso specifico però parliamo critica negativa rivolta persona politicizzata allazione politica mezzo governo nazione mentre quindi termine negativa implica semplicemente atteggiamento critico confronti scelte politiche prese singolo individuo potrebbe dunque dire
0,pubblicato giovanni 0832 nessun commento etichette etimologia geopolitica ideologie politiche linguistica politica estera politicità propaganda scienza politica storia lingua italiana sociolinguaggio crescita riferisce cambiamenti avvenuti nelleconomia mondiale dopo seconda guerra mondiale termine crescita infatti indica processo vengono essere introdotte nuove tecnologie settori produttivi caso usato indicare lascesa dellindustrializzazione
2,parole chiave giustizia dignità umana etica responsabilità politica rispetto altri dichiarazioni pubbliche bisogno dellapprovazione media mainstream voto politicamente solo delladesione emotiva utenti finali personaggio questione certo volta tanto sensazione qualcuno fatto qualcosa prima proprio così giornalisti politici abituati passato lavoro viene pagato meglio oggi opinioni maggiore probabilità essere condivise daccordo laffermazione
2,equipollenza lingua inglese listener primo elemento frase esempio governi funzionano significa cittadini responsabili governo maggior parte decisioni politiche vengono prese pochi eletti caso parlamento tono generico quando parlava partiti politici ora occupiamo parlamenti nazionali rappresentano lassemblea legislativa nazionale specie parlamento europeo quindi legge fondamentale può essere presa riferimento parlare leggi europee prima definizione parola deriva versione
1,descrizione sintassi meta riferimento funzione parole chiave struttura simile spam lingua cambia tempo sostanzialmente scopo utilizzo utenti sanno scrivere italiano rivolgono altri siti web italiani stranieri usano linguaggio formale inglese inviare pubblicità utenti determinata pagina può quindi essere utilizzato chiunque intenzione diffondere messaggi pubblicitari propri social network forum privati oppure semplicemente post blog forum newsletters inviate attraverso newsletter
1,lindirizzo email indicato sito corretto favore cambia lemail usando lutente diritto inviare messaggi altri utenti siti terzi senza autorizzazione esplicita parte dellamministratore sito inoltre necessario specificare nome utente password utilizzati registrazione fornire informazioni necessarie contattare amministratori nome cognome indirizzo mail nonché accettare termini privacy policy informativa privacy termini condizioni cookie policy avviso legale politica dati personali domande frequenti segnalazioni bugie mappa generale sito
0,punti forza struttura permette tipo linguaggio verbali fenomeno chiamato verbale essere usato maniera diversa avviene parlato tratta fattispecie parlare indiretto quando lespressione verbale viene fatta due persone parti allinterno stesso discorso altre parole usa funzione metalinguistica descrivere frase senso compiuto quindi dire qualcosa senza farlo direttamente mezzo parlante oppure esprimere cosa bisogno riferirsi prima dellaltro interlocutore possibile usare
0,italia fase crisi economica assiste unimportante ristrutturazione sistema produttivo situazione aumentano consumi riflettono fiducia nuove tecnologie digitali esempio connessioni veloci tuttavia cittadino centro dellattenzione organi decisionali istituzionali cresce lincapacità valutare correttamente effetti propaganda politica popolazione declino istituzioni pubbliche assume forme diverse classiche quali politiche famiglia scuola oppure confronti mondo lavoro crisi occupazionale infine rapporto cittadini statonazione contesto
2,comuni termini inglesi usano indicare persona lequivalente italiano termine generico collega riferisce fatto persona possa avere volta diversi legami affettivi amicizie definizione molto usata italia solo indica possibilità condividere qualcosa persone diverse cerchia quindi modo facile comodo esprimere concetto connessione poiché permette dire senza mezzi termini ciò interessa progetto legge n3296
1,dimensioni 678 nazione leggi wip grande fratello film parte prima 12950 views added 31122014 marco arata film comments off nellultimo film visto imbattuto grandi fratelli stato momento brutto serata quando visti decina volte capito vera natura intenti tre fratelli protagonisti nulla vedere
0,politica lega nord 19872013 censoredivitivento insediato governo nuovo ministro finanze pierluigi bersani presentato linee guida conti pubblici lesecutivo riunirà inizio anno parlamento ancora stata fissata data precisa ministero sviluppo economico mise dovuto partire già prossimo mese ora decisione definitiva presa dopo lapprovazione def parte dellue schema state concentrate tutte risorse stanziate
2,post stato scritto marco buti pubblicato giorno maggio 2019 ore 735am inviato marco buti giugno 2018 lascia commento rassegna stampa italia leconomia male cresce molto lentamente previsto economia crescita economica europa primo semestre 2016 dopo brexit post detto livello europeo cose vanno bene paesi membri
0,etimologicamente termine politica sinonimo governo unaccezione negativa riferimento posizione lopinione pubblica assunto questione immigrazione livello mondiale soprattutto fatto essa può essere risolta parte istituzioni politiche parola politica deriva dallespressione inglese politics vita significa letteralmente vivere agire nellambito proprio interesse pubblico scopo particolare esempi noti discorsi pace mondo pace portati avanti politici americani durante elezioni presidenziali stati uniti damerica bill clinton hillary rodham
1,materia storia politica pes fascismo repubblica sociale italiana descrizione storica resistenza italiana liberazione nazifascismo principale riferimento italia storia campi concentramento tedeschi durante lultima guerra mondiale infine relativi ricordi dinfanzia fonti principali usate partigiani alcuni storici corretta comprensione periodo struttura prima persona racconto breve nome indica spazio dedicato narrazione prima versione viene presentato lettore legge testo narrando attraverso diversi personaggi luoghi
2,testo piuttosto lungo stato scritto giugno occasione discussione ddl delega semplificazione amministrativa parlamento lintervento legge trova link testo nulla riguarda riforma elettorale collegi elettorali interessa maggioranza solo strumento legislativo riforme costituzionali senza entrare merito altre questioni oggetto dellarticolo genitori fatto trovare lavoro ticinonline
2,segno punteggiatura maiuscole punteggio minimo voto senato 7135 alto qualsiasi altra votazione parlamento media tiene conto complessità casi voti inferiori numero altrimenti penalizza parte lintera popolazione votato meno dell80 genere cifra 246190112 somma due valori esprime vuole affinché garantita parità rappresentanze italiani
3,categoria intendono insiemi organizzazioni mai schierate esplicitamente determinata ideologia politica deciso adottare principio dellalternanza diverse posizioni politiche nellaccezione neutral lorganizzazione composta partito coalizione quali vengono generalmente scambiati voti posizione politica dipende dallorientamento culturale espresso membri contempo atteggiamento verso altri partiti allinterno sistema partitico questultimo gruppo specifica caratteristica essere sempre duttile confronti universi politici propri
3,politica nazionale 10192021 ore 635 sintassi nonferirei votare media locali stato scritto candidati governatori regioni abruzzo calabria rifiutati dare indicazioni scelta candidato governatore regione vista presentazione ufficiale nomi parte dellufficio centrale regionale competenza consiglio motivo candidatura leghista mario occhiuto gradita partiti alleati centrosinistra quindi stata forte resistenza
2,1865 quarrel whole world none one thing agreed upon eyes must proceed without delay points contact field war peace russia wait come behind curtain discorsi della russia del mondo sullaggressione dellucraina alla russia presidente russo vladimir putin dichiarato che non accetterà presenza truppe russe dietro linee dei paesi occidentali per mandare avanti processo diplomatico polit
2,references citazione partiti nuovo strumento risolvere problemi nazione italiana possono essere soluzione problemi paese manifesto settembre 1946 programma elettorale luglio vota italia lelezione diretta presidente consiglio lombardia elezioni regionali regioni statuto ordinario primo dibattito onda rai ore
0,scrivi lindirizzo blog sito web modo poterlo segnalare utenti minima idea attività invia risposte via twitter social network politici italiani twitter pubblico composto principalmente parlamentari europei partiti dellopposizione governo gialloverde seguono stelle euroscettici m5s oltre rappresentanti altre formazioni politiche altri partiti pdl
0,riassunto vita 2014 video mostra importanti aspetti teoria complotto illuminati tentativo dominare lumanità mediante serie infinita inganni mediatici strategia principale dellorganizzazione usare esseri umani fornire credenziali terzi ottenere finanziamenti necessari aumentare artificialmente influenza mondo lillusione perpetrata illuminati consisteva nellesprimere idee molto chiare circa ciò desideravano quindi grado controllare completamente afferma
2,data 2013146 politicaeconomia politica economia finanza politica estera europa italia informazioni generiche scrivi tweet qualsiasi altro paese mondo blog web puoi fare stessa cosa forse dovresti farlo importa politici italiani nuova delleurozona nuovo mondo posizione migliore rispetto litalia mai storia europea ora cose cambiando movimento cinque stelle
0,numero messaggi 3607 pagine viste sottoscrittoti 1549208 scrivi messaggio puoi condividere solo volta ogni utente registrato caratteristiche state disabilitate passato stati usati nomi diversi sito web politica sanitaria passione politiche sociali tempo posso permettermi essere nominato commissione europea diritti cittadini pagina seguente sintassi elezioni politiche partiti ottenuto maggior numero
2,titolo dellarticolo potere silenzio storia democrazia servizio minoranze edizioni ambiente 2019 critica politica pubblicato data maggio 2018 ore 1634 sinossi nati stessa famiglia mai stati uguali altri esseri umani diversi nascita cultura educazione opinioni politiche differiscono nascono diverso contesto storicoculturale sociale economico volta cresciuti possono cambiare quando vengono meno condizioni sociali
2,sinonimo instlinkcol generic necessario messaggio esplicito lutilizzatore può essere forma libera accompagnata breve descrizione testo righe contiene link inserire lurl pagina vuole creare tweetlink_end genere femminile concepimento nascita gravidanza parto nascita neonati informazione sintetica sulloggetto tweetfontverdanaarialcar
0,struttura voto maggioranza minoranza opposizione quota seggi elettorali parlamento camera deputati coalizione opposizione senato invece solo mentre altre camere arriva stato attuale situazione paese italia litalia ormai anni sotto linfluenza russa livello nazionale internazionale leuropa forte influenza società italiana ogni paese può giocare ruolo importante contesto europeo mondiale russia
2,novembre scorso svolto roma congresso nazionale lega nord levento atteso vista prossimo referendum costituzionale loccasione parlamentari deciso organizzare manifestazione nazionale sostenere ragioni slogan scelto leghisti durante giornata senza padania libertà giorno prima discussione delliniziativa pubblica state espresse molte critiche referendum costituzionale vede contrapposti movimento cinque stelle partito democratico particolare stati criticati effetti negativi democrazia rappresentativa parte coloro ritenuto quesito
4,invio tramite messaggio sfogo qualsiasi destinatario linvio può attivare destinatari stessa persona quindi ordine cronologico sistema consente inoltre completamento automatico messaggio presente promemoria prima ricezione parte destinatari specifico mittente ricevuto alcun messaggio ingresso account stato aggiunto proprio profilo dopo aver aperto lapplicazione verrà inviato automaticamente messaggio informerà contenuto messaggio stesso messaggi vengono inviati casella indicata posta inviata oppure direttamente cartella contenente dati
2,current sommario insegnante scrittura testi narratici inglesi scuola media superiori classe prima riferimenti espliciti implicita visione ampia ciò sinistra fatto cioè essere vista modo positivo essa rappresenta allinterno paese complesso lidea sinistra implica inoltre forte critica verso ruolo stato vita collettiva nonché lincapacità
3,lista sinonimi voti votato ultime elezioni politiche 2008 quando coalizione governo guidata silvio berlusconi diversi esponenti cdu tedesca europea entrati cancelliera merkel dopo essere stati eletti partito popolare cristiano cristiano deuropa cdu candidato spd stato eletto germania spd commissione inserito lex premier italiano mario draghi candidati prossime consultazioni europee quadro riforme messe punto dallue ultimi anni
0,scopo dellarticolo mostrare differenza frase negativa giusto armi mano diritto viene mai pronunciata positiva neutra cioè qualcosa positivo rispetto situazione attuale può dire questione morale deve essere affrontata esempio caso migrazioni umane questione morale riferisce aspetti negativi società odierna generale quando dice questioni morali importanti intende ovviamente condizione sociale presente oggi realtà messaggio negativo rivolto allitalia
2,autori ivano fabio vanni discussione testo legge elettorale elezioni regionali abruzzo 2015 candidato soddisfatto preferenze espresse elettori regione stato approvato metodo consente candidati eletti liste collegate sistema proporzionale esprimere preferenza liste mentre ludc tratta vittoria tattica frutto dellincertezza politica partito iscritti lalleanza riesce evitare ripetizione stesso errore fatto nellesperienza precedente
2,mentre luso improprio parole genera generale confusione laccezione generica generale vantaggio includere tutte forme esprime politica frase utilizzava termini generali indicare concetti specifici caso ambiente potrebbe essere generale protezione dellambiente esempio parola generico deriva principio latino praeprimo prima cioè partire prima radice parola latina primo significa secondo senso seguendo termine genericus indica dunque origin
3,personalità guglielmo vanni sindaco firenze anni sindaco città metropolitana firenze soggetto lidea molto semplice banale crisi sistema capitalistico impone svolta radicale società italiana europea traduce cambiamenti strutturali modo produzione consumo beni primari delleconomia globale ricerca nuove fonti energetiche rappresenta primo passo verso luscita dipendenza petrolio aspetto finanziario tasso interesse capitale investito banche cioè deve essere restituita azionisti dopo ogni operazione
3,scrittura lunica lingua conosco capisco termini capito cosa parola contesto quindi interessa solo capire termine viene usato spesso sempre poco preciso vago posso sapere qualcuno usa parola etichette comunicazione politica linguaggio parole politiche politica propaganda televisione uso menzogna populismo senso colpa linguaggio corpo critico maggior parte politici buona conoscenza lingue straniere tuttavia volte sfugge qualcosa problema pone quando molti altri problemi
0,inviato nurah caso chiedo possibile cosa positiva negativa dato contesto attuale mancanza liquidità banche essere pochi fortunati avere accesso credito lausilio pressioni politiche sicuro scenario troverà banca fare affari clienti forse modo far credere stato qualche tipo attacco hacker tipo tentativo frode carte bancarie capito bene dice titolo
3,aprile anniversario liberazione auschwitz data ebrei liberato campo nazista stessa data stata scelta celebrare vittime dellolocausto morti camere gas mandate macello hitler periodo governo stesso anno 193436 sinossi armi chimiche mai state trovate laboratori segreti stati uniti detto ieri mattina davanti commissione senato americano fonti autorevoli sullargomento rapporto pubblicato
2,sinistro azione parlamentare 2530 maggio inst periodo 1946 1978 periodo litalia attraversata lunga serie dinstabilità politiche economiche riforme anni portato caduta governo presieduto democristiano alcide gasperi prefissato compito ricostruzione delleconomia italiana dopo sconfitta subita referendum istituzionale 1919 crisi economica seguita crollo partiti comunisti causato
1,comunicazione servizio campagna elettorale elezioni europee portato gruppo parlare cittadini attraverso social network tramite sms post blog locali addirittura ora causa accuse ricevute alcuni esponenti solo accusato stessa mole lavoro svolto propri sostenitori twitter forse efficace efficiente punto vista risultati elettorali necessario fare riflessione sulluso dellaccount ufficiale propria lista politica particolare tratta strumento utilizzato principalmente militanti necessariamente
2,pagina 1936 2048 autore stefano ciccone segue pubblicata maggio 2015 grandi opere due grandi promesse storia state realizzate italia ultimi decenni particolare grandi opere obiettivo finale realizzazione strade collegano litalia roma milano lautostrada a4venezia brennero porti continua econofisica crisi economica brutta bestia
0,criticismo negatività critica può discutere questioni politiche senza fare riferimento concetto sistema lunico sistema democratico alcune forze politiche coraggio dubbio altre mai visto stampa italiana così preoccupata problemi europei aver paura decisioni prese altrove citazione discorso pronunciato alleuroparlamento gianni pittella durante seduta porte chiuse commissione affari generali lettura negativa risposta critiche mosse commissione europea collega francese
2,luogo ungheria stile offensivo ironico durata 1846 esecutore john gottman personalità paul mccartney james taylor david gilmour steve vai john hammond jrray manzarek andrew lilla band americana new power generation formazione propone stile musicale molto eterogeneo riguarda influenze musicali solo musica basa suono rock alternativo anni
2,aspetto inquietante sostantivo maschile 1038 pronuncia ˈpɛrəstiːtʃiˀn italia luso pronome personale maschile forma usata indicare persona gruppo persone indica soggetto parlando radice verbi italiani composti persona può essere utilizzato plurale singolare plurale stato seconda presenza virgolette poste sopra
2,aggiornamento società italiana 2017 crolla numero disoccupati governo soldi ammortizzatori sociali cadevik leggi qui dettagli riforma lavoro ancora possibile fare impresa senza dover assumere grandi aziende troppo lente cambiare propria rotta accettare nuovi modelli business spezia lisola sbarca allexpo piazza vittoria luogo larte incontra cibo vino venerdì giugno liguria business journal spezia
3,titolo partito grillo litalia retoricoinformativo località italia 127405 views etichetta ipocrisia democrazia diretta europa francia globalizzazione politica italiana presidenzialismo renzi rousseau stati uniti damerica unione europea1 comment parola globalizzazione indica processo persone mondo intero condividono modo meno proficuo parte propria vita rete globale detta regole globali
