sentiment_mapping,processed_tweet
2,inviato giovanni peluso maggio 2014 856am spirito animato lintera serata emozioni riflessioni caldo leggendo discussione web sembra cosa strana parlare conflitto ucraino poi invece concentra sullucraina russia delliran guerre piacerebbe tornare credo molto importante pace mondo vorrei vedere avanti parlato lungo ieri sera trasmissione risultati
0,critica negazionista altri termini criticare politica politici italiani senza tratti critica diretta quel partito parla casi dellavversario politico ovvero schieramento avversario coalizione avversaria quindi accuse dirette confronti altri partiti questione basta dire negativa quando nessuno accusare criticare realtà qui parlando solo critiche comportamenti politici elettorali paese termine usato comunemente sinonimo critica
0,ripetuto critiche sistema penale italiano parte giustificate esempio giustizia ambientale corrette riferimento leggi ingiuste sbagliate grillini rendono disponibili sempre bisogno nuovo testo quesito referendario legittimo impedimento risposta allarticolo legge responsabilità civile magistrati lettera aperta cittadini italiani parlamento approverà norma costi processuali toghe
2,titolo file discorso giovane donna dice colleghi politici parte sempre fianco matteo renzi indirizzo url prima metà anni novanta storico francese pierre bardou lex parlamentare socialista belga jean lambert pubblicato testo intitolato démocrates dans guerre kiev dittature guerra civile kiev
2,citazione giustizia sociale priorità più importante per progressisti una società senza ingiustizia discriminazione infatti non può fare fronte queste difficoltà politici parlamento inglese prime ministers party prime ministers party principal political bloc government parliament consists members elected parliamentary proportional representation member represents constituency serve six consecutive terms members elected districts areas serve representatives house commons addition represent area
2,politica politica estera usa investimento privato investimenti privati indicizzazione messaggio indicizzazione messaggio pubblicitario pagina web informa pubblico attività commerciali parte società controllata fra vari tipi dinvestimento frequente lacquisto diretto aziende tramite internet pubblicità diretta prodotti investimenti breve termine comuni pmi italiane lazienda viene messa mercato attraverso internet può pubblicizzare direttamente mediante annunci mirati categorie professionali interessate affari dellimpresa stessa settore energetico invece
0,enoch arden jean dominique sévère 15971642 stato filosofo francese sosteneva concezione storia dellumanità lotta forze opposte cittadini tenuti partecipare attivamente ricerca verità assolute universali pensiero criticato supposta neutralità stato confronti sovrano ieri letto larticolo repubblica riguardante scomparsa benedetto croce secolo xix colpito molto notare
0,elementi filosofia politicamodifica termine politica ormai entrato lessico comune assunto valenza ampia abbraccia ogni tipo azione sociale culturale esempio molto diffuso può trovare dibattiti televisivi lelezione presidente repubblica palazzo madama oppure programmi politici principali reti nazionali trasmissioni maggiori emittenti televisive private italia tuttavia definizione politica sembra essere diffusa infatti linguaggio corrente tende sminuire funzioni spesso senza neanche spiegarne significato atteggiamento deriva mancanza
2,politica italia sistema elettorale poco rappresentativo partiti perso elezioni risultato ottenuto perdita voti parte elettori centrodestra società difficile trovare punti comune due persone diverse sempre compatibili può avere presenza fisica foto limmagine mostra lesatto numero parlamentari italiani eletti collegi plurinominali camera senato rispettivamente liste dellarea pdpsi
0,significato rappresentazione negativa dellattuale situazione sociale paese percezione sistema economico italiano andando direzione sbagliata litalia perso ogni valore aggiunto rispetto altri paesi europei termini competitivi piano internazionale nazionale europeo quindi globale politica trova oggi affrontare problema riesce comprendere problemi reali società italiana frattempo grandi imprese multinazionali costrette modificare rapidamente modelli organizzativi strategici sfruttare appieno investimenti stranieri senza dover fare altrettanto propri dipendenti mentre stato
2,inizio intervento dicendo sanità cose importanti mai andato bisogno fare tanto lelenco basta sapere importante ascolta comunque solo termini numerici letto qualcosa sullargomento consiglio vivamente poi raccomando ricorda sempre stato eccellenza lavoro anni nellambito comunicazione politica modo ultimi anni quando doveva comunicare politici soprattutto settore sanitario parole usate spesso molto tecniche poco
0,invia foto profilo twitter qualcosa negativo positivo condividendo immagini negative politica oppure caricando post colori sembrano positivi solo modi puoi usare limmagine twitter puoi fare usando ricerca parole chiave creazione hashtag linserimento descrizioni messaggi diretti cosa importante notare spesso persone idea significato parola negativa pensano contrario sai scrivere bene probabilmente saprai utilizzare correttamente quindi ricorda sempre
2,strategia fondamento fiducia credere nellaltro lidea fondo avere visione globale vita sociale dellindividuo tal fine cerca offrire soluzioni concrete ogni problema esempio molto comune servizio sanitario nazionale ssn quando sistema finanziamento pubblico contrario invece aziende private servizi offerti gratuitamente pagati utenti sotto forma sconti agevolazioni eccetera principio fondamentale medicina preventiva proprio qui puntare prevenzione anziché controllo
0,sinistro oppositivo nervoso disforico politica parlare pubblico esprimere proprie opinioni senza imbarazzo vergogna essere sempre preparati parlare davanti persone sconosciute descrivere proprio passato tattica molto efficace quando vuole mantenere propria credibilità tempo quando invece troviamo dinanzi argomenti possono essere ripetuti volte riusciamo facilmente cambiare opinione html1local_slides politica può essere vista lattività delluomo rivolta allaffermazione potere
1,scelta template dettata fatto passato parte campagna elettorale partito pochi rimasti sinistra interessante vedere elettori espressi decisione situazione attuale vede maggioranza schiacciante due opzioni mentre somma percentuali basse rappresentata partiti minori 1936 8099 tratta comunque dati statisticamente significativi altri fattori possono influenzare
1,originale inglese socialism and the left pubblicato 1973 termine stato impiegato volte indicare sinistra moderna alternativa socialdemocrazia liberale ovvero destra dominato stati uniti dopo lintroduzione costituzione stati uniti damerica parte repubblicani guidati democratico john kennedy allepoca insediamento presidente usa ancora successo conquista dellegemonia culturale ideologica masse popolari interessato approfondire discorso
0,indirizzo tronchi voto 610 scarsa capacità comunicativa personaggi unimpiegato posta guardia forestale impiegato postale allufficio centrale tesoro chiudere ufficio sceriffo cerca capire giro qualche terrorista islamico frattempo impiegati occupano faccende quotidiane mentre politici discutono grandi questioni internazionali lultimo punto relativo giustizia principali sospettati terrorista
2,politica società psc tipo commento 3654281083974 instlink link
2,critica politicità linguaggio politicamente corretto tipico oppone allordine simbolico giustificazione politica posizione eticamorale fondata pregiudiziali ideologiche motivo italia tollerate critiche comportamenti politici discutibili meno condivisi altri paesi europei lidealismo spesso citato solo discorsi antiparlamentari soprattutto argomentazioni conflitti interesse particolare stampa quando accorgiamo deficienze politiche dellespressione politica allora occorre
2,social network inst 1000000 twitter pagina principale sito web partito potere italia oltre propria azienda basso pagina presente home page membri gruppo cliccandoci sopra accede allindirizzo internet ufficiale link diretto home page può essere raggiunto tasto serve refresh homepage oppure tramite pulsante mostra articolo lelenco collegamenti presenti parte alta schermo porta direttamente home page gruppo parlamentare italiano indipend
0,specificato contenuto disponibile pubblicazione formato integrale parziale informazioni richiesta supporto tecnico scrivere supportconsultingit cosa pensano membri dellattuale governo italiano responsabilità governo presidente repubblica italiana compito primario garantire lequilibrio varie componenti stato organi apparati assicurare stato stesso governato modo efficiente possibile senza incorrere carenze strutturali esistenti rispetto sistema istituzionale vigente obiettivo viene raggiunto grazie possibilità singoli minister
0,dimensione dellimmagine 1087x592px immagine avi avijpg descrizione sole forte nuvole frase pronunciata woody allen scena tratta film resta piangere popolarità raggiunto picco marzo 1963 cinquantanove milioni quando venne candidat vescovado amalfi inaugura nuova sede guardia costiera ultimo aggiornamento venerdì marzo 2021
2,qualità persone parlamento 146 totale parlamentari vuol dire poco due terzi 235 seggi 708 qualità vita molto bassa quasi stessa gruppi potere rappresentati governo nato senza maggioranza meno probabilità avere successo rispetto guidato minoranza parlamentare risultato situazione stato aver distrutto basi sociali dellunione europea creato nuova oligarchia economica contrappone democrazia diretta cittadini europei elettori stati ingann
2,generaleendsinistroendfenomenologicoformat_htmlteoreticopublicationenterprivate pensiero sempre bilico opposti filosofi visione realtà molto diversa porta stato minorità morale posizione avanzata delloriente socrate riferimento sapere deve intendere fonte sapere mentre filosofi greci letica
1,aspetto puramente informativo sostenitori politici critico critico può dire dicevo precedenza parola censura esiste politicanti possono solo scrivere cose vere quando viene chiesto altri qualcosa detto prima riguardo laccezione negativa termine penso ciò significa fare critica dibattuta contento letto volte libro vita senza aver mai bisogno dellaiuto amici politici
2,tratta persona votato ultime politiche stessa cosa dicessi vado leggi fagioli messicana gustose avventure cucina maggio 2017 luglio 2017 gustosamenteinventati fagiolini legumi secchi molto usati cucina italiana prestano benissimo cotture lunghe prolungate ottimi caldi colazione oppure freddi preparare insalatone zuppe tante altre ricette
2,1985 2760 parole discussione questione morale carlo galli sole ore giugno 1985 cose possono fare senza dire sola volta stata fatta rosa jonahia coraggio verità carlo galli questione morale storia teorie politiche fascismo secondo dopoguerra laterza editore bari 1985 uomo mai fatto politica
4,politica candidatura 2018 voti forza nuova fratelli ditalia italia viva solo politica voto m5s lista movimento voto allaventino voto partiti minori movimento stelle vince elezioni europee grazie coalizione formata cinque forze insieme raccolto maggior numero possibile consensi iscritti certificati meetup locale tratta candidati federico pizzarotti sindaco parma riccardo rigoletta
0,inglese italiano cinese coreano francese giapponese inglesefrancese russo tedesco turco obiettivo dare speranza giovani stati costretti lasciare paese dopo seconda guerra mondiale parole state pronunciate winston churchill apertura discorso stato dellunione 20163 livello internazionale tratta prima volta vengono invitate nuove generazioni impegnarsi campagne elettorali futuro proprio paese
2,durata 0359 1627s testo stato scritto occasione dellincontro pubblico organizzato partito democratico giugno 2008 quando pier luigi bersani ancora segretario partito campagna elettorale visto lega nord matteo salvini trionfante confronti avversari lantieuropeismo antiimmigrazione subito sconfitta sonora causa vicenda nave diciotti poi affondata causato scandalo internazionale aver dimenticato migranti irregolari
2,difesa dellambiente diritti civili proposta realtà interessante prevede costruzione centrale nucleare potrebbe essere costruita stati uniti tuttavia dibattito tema nucleare portato nulla infatti bisogno dovrà fare stop scorie nucleari politica quindi deve trovare soluzione problema energie rinnovabili questione smaltimento scorie parlava poi energia rinnovabile efficienza energetica qui senza lenergia nucleare difficile arrivare alti livelli energetici new tomorrows
4,nome file 6825013 457jpg presentazione numero 6825013 stato scritto niki vendola candidato presidenza regione puglia elezioni regionali novembre scorso realizzato maggio 2010 politica quotidiano online tarantocitta firme valide legge riguarda partiti politici nuovo testo unico pubblici registri consente liscrizione partiti politici esistenti
3,lautore utente persona scritto larticolo numero membri dellorganizzazione momento pubblicazione articolo 10036 rispetto settimana precedente 247 totale persone iscritte politica interna allazienda nessun rappresentante dellamministrazione pubblica nellunità operativa principale partito democratico bruxelles nessun membro dellamministrazione pubblica nellunità operativa principale europea uepcu dipartimento europeo comunicazioni decocracy nessuna rappresentanza
2,punti salienti campagna elettorale elezioni 2016 campagne elettorali basano narrazione vuole rappresentare cambiamento modo semplice efficace stessa cosa dire lopposto meglio viene fatto principalmente attraverso discorsi diretti spesso molto lunghi candidate parlamento europeo indiretti competizioni presentazioni ecc raramente tramite esempi concreti meno importanti messaggi politici presentati candidati diverse liste politiche durante dibattiti televisivi radiofonici oppure
2,margine minimo 3045 promuovere proprio punto vista questioni politiche sociali culturali qualcosa politici sanno fare politica italiana perdendo terreno senso molto probabile pochi decenni assisterà rapida caduta influenza massmedia nazionali riguarda linfluenza parlamento nazionale ora limitati livello regionale quasi nulla senza raggiungere nemmeno locale breve cominceremo presidiare commissioni parlamentari estere parlamento britannico francia eletti
2,politica italiana media tradizionali organizzati struttura gerarchica perso capacità informare persone realtà stampa rappresenta strumento migliore fare informazione spesso efficace comunicare accadendo società nellambito troviamo operare caso giornalismo televisivo sostituito gran parte dellinformazione scritta luso social network facebook attraverso canali può raggiungere molta gente senza parlare direttamente soprattutto spazio mediazione informativa parla ascolta vuole ascoltare
0,sinistrotto sindacalista lavoratore diritto retribuzione proporzionata quantità qualità lavoro deve cioè essere misurato base produttività efficienza contrattazione collettiva può fissare percentuale minima applicare vari tipi mansioni ritenuti necessari raggiungimento obbiettivi aziendali quindi sufficiente riconoscimento formale qualifica professionale richiesta legge ricercato consenso sindacale infatti lobbigazione deve risultare contratto collettivo sottoscritto organizzazioni sindacali maggiormente rappresentative piano nazionale massimale garanzia
0,filosofia dellimmagine destra sinistra periodo storico rinascita 196875 corrente filosoficaestetica teoria ragione aperta kant sottoscrizione elettronica pagamento dollari allanno euro mese volte gente grado pensare persone possono fare nulla sole può essere vero solo quando lavora insieme società esempio persone pensano spesso politici incompetenti irresponsabili idea
2,indirizzo email utente mandami link dellindirizzo mandato seguici twitter facebook google linkedin youtube cerca sito apri menu chiudi menu ricerca avanzata home news archivio articoli email alert email archivio articoli seleziona mese maggio 2013 aprile 2013 marzo 2013 febbraio 2013 gennaio 2013 dicembre 2012 novembre 2012 ottobre 2012 settembre 2012 agosto 2012 luglio
2,nellesempio precedente vede punto vista generico caso solo generico possibile lettura alternativa esempio capirsi testo infatti concetto giustizia servizio collettività frase descrive molto bene situazione paese problemi permette avere sguardo futuro cioè possibilità meno migliorare cose attraverso azioni concrete vantaggio collettività invece stato generale potuto essere usato esprimere lidea importante cercare fare qualcosa ogni giorno senza
1,periodo dibattito pubblico concentra sullemergenza sanitaria solo diversi temi politici vanno maggiore discussi sicuramente legato social network tecniche elettorali possono essere utilizzati momento storico attuale tratta cosiddetta teoria retweet retweettaggio ovvero lutilizzo parte singoli individui messaggi pubblicati online piattaforme social media quali twitter facebook pratica molto utilizzata soprattutto paesi anglosassoni esempio usa candidati vengono invitati utilizzare account personali propri profili
0,italia scelto solito fare propaganda elettorale politica strada guerra preventiva cioè cose vengono ripetute certa parte politica volta sbagliate agire prima guerra significa operare cautela sotto profilo militare sapendo bene potrà succedere futuro tempi nazismo hitler molto prudente campagna elettorale fatto promesse ben precise sulluso dellatomica invasori tedeschi realtà piani diversi rispetto americani giapponesi purtroppo però
2,nome utente enrico1984 data registrazione 07062015 versione corrente 305 client twitter bisogno essere configurato almeno fatto alcuni giorni stato chiesto creare sorta tweet grado tracciare trend momento utilizzando nuovo grafico introdotto home page ora utilizzato allinterno sezioni pubbliche problema principale necessità trovare solo
1,politica italiana 19451976 sinistroestremistapropagandistico populismoantipolitico unanalisi storia partito comunista italiano periodo 1932 comprendere rapporto sinistra governo legemonia culturale partiti nellitalia cambiava longobardi stato città fondata coloni romani italia vii secolo oggi parte dellantico stato romano doriente posizione strategica confine orientale
0,sinistra italiana così tanta fatica gestire contraddizioni riesce affrontare modo efficace problemi concreti presentano diverse parti paese esempio campo giustizia italia strumenti processuali spesso insufficienti sanità pubblica medici sempre ragione oppure sport squadre italiane vincitrici campionati mondiali calcio devono pagare multa propri tifosi passato dibattito gestione conflitti istituzionali particolarmente acceso anni 7080 proposte alcune riforme organi costituzionali fine favorire
0,membro csicitizen club italia puoi uscire sento entrare categoria motivi diversi parola interessato tipo politica solo lennesimo tentativo destra italiana farsi spazio panorama europeo esso economico sociale senza riuscire sfondarlo punto sempre stesso potere deve fare conti proprio passato poi traduce inevitabilmente propria storia personale propri interessi spesso diametralmente opposti
0,sinistra democratica repubblicana critica comportamenti politici partito democratico generale valutazione negativa politica parte pratica riguarda rapporti altre forze politiche presenti coalizione governativa pdludc può notare stati grossi cambiamenti 2013 livello nazionale però ancora presente criticità favorevole modifica costituzionale discorso riforma costituzionale incentrato riforme istituzionali piuttosto tema processi elettorali esempio
0,struttura sintattica parole neutre tweet dichiarazione scritta viene inviata altri utenti esempio qualcuno twitta nome professione vale stesso discorso lettere personali indicano persone riferiscono conosco così bene amico dire amici informazioni rispetto persona parlando essi possono essere informati opinioni politiche volte può portare equivoci quando due
1,voto voti discussione matteo nodari insegnante pensione insegnante liceo classico manzoni milano avvicinata politica dopo laurea pavia ora lavora partito democratico città lombarda scritto lultimo libro scuola edizioni san paolo fondato lista civica stato eletto consigliere regionale lazio popolo libertà ruolo cellule staminali chimica sviluppo sostenibile sommario
1,cosa dovrebbe dire candidato followers twitter primo messaggio sempre molto generico secondo arriva dopo secondi fine volte messaggi chiari complessi preferisce lasciarli soli gente capisce subito senza ulteriori spiegazioni però significa sbagliato scrivere modo forma verbale slogan usata spesso discorsi politici scrivi prima viene chiaro immediato importante mantenere chiarezza altrimenti rischi solo annoiare utenti soprattutto meno attivi social network tono usato può essere
0,politica definizione altro sport caso dellaccezione negativa tipo politica può essere definito modo meno tecnico larte dire cosa senso lato senza pensare dice casi quindi dovrebbe parlare politica intesa significato specifico attività prende posizione questioni sociali politiche assume decisioni comportamenti politici tramite quali pone centro scelte operative ultime rientrano relative allambiente sicurezza cittadini risorse energetiche fino arrivare
0,inst scrivi tweet dimostrare opinione argomento qualsiasi altro tema loggetto messaggio pensieri personali preoccuparti lunghezza puoi scrivere sola parola giorno solo senso positivo pieno controllo lingua scrittura essere troppo aggressivo usare troppi aggettivi negativi evita parole offensive usa frasi brevi concise semplici pronunciare evitare avverbi inutili luso eccessivo emoticon rende difficile comprendere ciò scrivendo mentre punteggiatura può rendere molto leggibile scritto
2,discorsi opinioni personali discorsi pubblici interviste dibattiti discettazioni vuoto discorso sempre lunica cosa conta vita persona sostanza cambia mai unici fatti concreti credere interessano politici elettorato mentre riguarda altre persone comuni rimane solo proprie tasche citazione_socialitybody stato eletto luca ottobre 2014 738
3,citazione theserp2003 innanzitutto lista elettorale punto finale lultimo seggio voto può essere deciso modo quindi applicazione deve avvenire tramite sistema chiamato voto preferenza traduce generalmente nome liste elettorali volta eletti partiti politici possono presentare proposte lelezione membri parlamento diritto votare elezioni legislative alcuni parlamentari possono avere accesso potere legislativo attraverso serie meccanismi indiretti parlamento esercita tale funzione legisl
2,eventuali critiche osservazioni commenti presi considerazione solo pertinenti tema specifico favore utilizzare parola tweet commentare qualcosa trova internet lunico modo corretto descrivere tono critica pensi giusto esprimere opinioni personali post permetto aggiungere nota proposito meglio scrivere vuoi dire titolo commento invece parole vuote senza senso spesso usate altri utenti molti lettori fatto dispiace molto doverlo fare ritengo opportuno sottolineare qui
2,indipendenza morale sociale economica punto potrebbe chiedere popolo votato risposto domanda ragione stato escluso politiche anni scelta nettamente ampia forte partiti socialisti popolari psuv state prese decisioni decisive vita paese economia istituzioni sociali dunque stato bisogno dellimpegno attivo stato nelleconomia società formazioni sociali esistenti prima eventi storici 1960 stata lelezione parlamento
0,etichettato concritici politica retorico scrivere stile scrittura voto velocità vista voto commenti commento confronto candidati camera deputati 2013 categorie candidati italia italiani allestero politiche internazionali prima pagina politica estera presidente consiglio europeo jean claude juncker presentato oggi programma lunione europea candidato destra europea parlamento europeo carica 1979
2,politicainstonline giorni fatta sentire voce sinistra elettorato proposta riforma dellarticolo 138 messo discussione lintero impianto costituzionale dellarticolato precedente quindi solo norme costituzionali contenute nellordinamento stato leggi elettorali nonché principi fondamentali regolamenti parlamentari insomma buona parte dellelettorato prevedibile viste posizioni critiche assunte governo confronti riforme renziboschi
0,sottotitoli neutrale eng curriculum vitae inglese completo aggiornato mesi vedi qui dettagli diplomazia dellinformazione campagna elettorale politica perso colpi diventata social lobiettivo comunicazione stato dare maggior numero possibile informazioni elettori senza perdere nessuna occasione dialogo molti dati cosa accaduto mondo reale allora può usare strategia diffondere proprie idee tema cambiamento climatico sullevoluzione
1,sinonimo strategia politica strategia azione esempi comuni lidea stato preoccupa benessere individui discussione oltre parole john stuart mill mai pace mondo senza rispetto diritti umani fondamentali popoli termine politica indica dottrina morale società riferimento ideali morali valori etici risale allantico egitto comune antichi greci laccezione recente però comprende stesso significato etica
0,politica politica pensiero unico difesa parte politici proprio sistema laccezione negativa riferimento tendenza delegare singolo decisione finale vita pubblica rifiuto istituzioni politiche tradizionali portato allelezione personaggi rivelati inefficaci difendere interessi collettivi nazione leader populisti esprimono spesso bisogno essere difesi ogni forma critica confronti dellistituzione lavorano spesso portati apparire eroi nazionali capaci sconfiggere nemici
