sentiment_mapping,processed_tweet
2,soggetto luogo parlare politica solo definizione termine politica significa infatti agire impegno effetti parole politiche lunga storia state scritte uomini politici impegnati campo sociale proletariato economicosociale borghesia altri ambiti laristocrazia termini politici trovano però soprattutto letteratura antica medievale stati usati caso democrazia basata partecipazione cittadini allamministrazione potere pubblico regn
0,numero messaggio stata citata frase testo lobiettivo tweet seguente obiettivo personale dire mondo grandi vittorie prossimi anni potrebbe essere dare mai retta parole vuote stesso tempo avere stile diverso altri può sembrare troppo semplicistico molti esempi reali credo vero caso specifico qualcuno dato causa tono molto negativo lantirazzismo probabilmente potuto fare stesso
0,critica stato costituzione governo comportamento ritenuto rilevante caso può parlare critiche comportamenti politici esempio politicamente corretto rappresentanti istituzioni ovvero confronti cittadini responsabilità azione politica società civile italiana conclusione critica consiste criticare azioni politiche comportamenti stesso soggetto politico motivi ideologici ossia linfluenza dellideologico base convinzione personale stesso individuo raggiunto obiettivi importanti specifico campo
2,sinistro europa italia presidente consiglio ministri repubblica italiana 19751986 professore diritto pubblico alluniversità studi milano 2003 2014 docente cattedra unesco nellambito studio tema politica dellunione europea presso lateneo statale milano bicocca triennio 20132018 direttore scientifico ipres istituto politiche pubbliche relazioni istituzionali ambito europeo
0,rassegna stampa presidente consiglio firma dellautore luigi scalfarotto testate online scrivono conto repubblica seguente articolo premier italia numeri servono corriere sport stampa litalia leggi larticolo riporta dichiarazioni rilasciate dallex ministro roberto calderoli corriere pronto essere statista vorrei lega cosa seria dice intervistato corsera leggi bastava solo titolo raccontare
2,autore dellarticolo testo scegliere titolo giusto email punti fotografia utilizzata testo punteggio minimo foto pubblicata facebook twitter instagram valuta sempre base numero followers ottimo spunto utilizzare quando devi dare maggiore visibilità qualcosa seguito particolarmente conosciuto esempio potresti inserire testo spazio notizie presenti risultati elezioni amministrative sardegna dimenticare mai aggiungere sardegna grazie presenza telegram
0,infobox leader partito allora devi essere critico positivo critiche possono diventare negative alcun senso critiche positive dovrebbero avere senso dovrebbero essere costruttive efficaci causa tuttavia pessimismo fatto buona persona esagerato direzione critica positiva esempio puoi dire ritardo mentre ancora qualcosa solo dimenticato acquistare alcuni farmaci prescrizione figli oppure puoi criticare qualcuno dicendo cose bravo parlare dovresti farlo quando parli
2,dati 19872003 soggetti popolazione stato carica quiescenza inaugurato 1964 struttura partito livello locale partito numero componenti ogni gruppo parlamentare nominale nanomembri maggioranza candidatura leader coalizione elezioni europee elezioni locali candidature multiple due candidature parte stesso leader candidatura singola capo dellopposizione politiche politiche interne paese politiche
4,riferimento dellimmagine sotto ovvero senso figurato politiche immigrazione integrazione paese accoglie nazione cresce male nessuna parte basta dire tratta politiche immigrazione integrazione realtà fatti dice ogni volta straniero viene accolto paese cambia latteggiamento generale popolo confronti modo cittadini accolgono proprio ospite spesso condiziona scelte future limmigrazione diventata molti italiani fatto culturale economico oltre sanitario
2,metodo usato creazione viralità cosa sorprendente messaggio sottotitolo prima poi finisce scopo dichiarato ossia attirare lattenzione utenti web creare certa aspettativa contenuto tematica trattata messaggio stesso volte però cose vanno diversamente alcuni contenuti possono essere troppo ambigui gusti vari utenti esempio contengono informazioni sensibili oppure altri invece potrebbero contenere messaggi pubblicitari inducano pensare fidarsi promesse fatte interessati prima dellinvio
2,sinossi occasione anniversario fondazione fondazione history ideas invita partecipare celebrazioni anni nascita dellassociazione corso lavori assembleari discute sulletica politica parola chiave giorni campagna elettorale opinioni divergenti accompagnate affermazioni molto nette esprimono posizioni antitetiche rispetto allattuale orientamento generale confronti istituzioni pubbliche diritto pubblico verso sistema partitocratico discussione animata tentativo definire possibile conc
0,data invio mar 2022 437am toni_pedante segnalo lultima notizia ricordo fonte scuso dimenticanza riservo controllare quando disposizione dati ancora sotto controllo momento comunque vedo comunque qualcuno darmi mano graditissimo
0,parole chiave critica nascosto nome partito sinistra doppio senso caso significa discorso valore critica ciò vedi destra solo politiche sociali vedi esempio qui invece tratta dicitura corrente
2,blog personale seguente sorta diario presente nutre principalmente speranza speranza morale paura paura altri parla prevalentemente politica locale solo amo roma lazio altre cose simili piace parlare maniera informale senza filtri argomenti specifici esempio piacerebbe scrivere qualche articolo elezioni amministrative livello regionale cerco sempre nuove idee condividere migliorare linformazione informazioni cittadini
0,discussione candidatura politica strategia elettorale politico 14052013 ritenuta utile utenti segnala pagina mail messaggi 76425letture 769persone 28mostra candidatura politiche 2013 maggio 2013 variabile intanto candidature sembrano poco interessanti possibili ricadute agenda
2,personalità inserita seguente template ipotesi sinistra campagna elettorale partito democratico almeno parte logotipo 60x42 larghezza 1375 gruppi link inserire rispettive pagine interne allinterno tabelle rispettivi spazi bianchi comunque seconda estensione caso vari gruppi identificabili sottogruppi possibile creare nuova tabella hoc senza prima aver creato relativo gruppo tenga presente linee guida riportate sopra possono essere
0,critica politici spesso criticati comportamenti sembrano essere contrasto ideali morali religiosi società lespressione critici può riferirsi critica negativa confronti sistema atteggiamenti positivi verso vita morale senso lato categoria include critiche rivolte partiti organizzazioni politiche stati nazionali parte pratiche pubbliche12 esempio termine viene usato contesto dellopposizione3 parola deriva greco κρύσις cronache
2,lidea gente rende conto fatto cambiamento climatico solo questione ambientale sociale economica significa esempio mettere discussione leconomia risorse fossili ovvero usare combustibili fossile strumento utilizzare lotta cambiamenti climatici modo qualcuno messo punto nuovo modello economicoenergetico basato fonti rinnovabili risparmio energetico stato visto mondo fuori moda disarmo stata motivazione allora altri
0,grandezza testo 1260 battute media lingua italiano voto 7810 voti autore marco tanduriello links prima vita dopo morte padre luomo stato capo famiglia laudani ricca nobildonna abitava
2,simbolo navigazione nord nord elementi chiave nome democrazia democrazia stato stato lanciato tweet bandiera italiana può essere personalizzata così spiega lidea politici italiani uguali etica morale tuttavia vero fatto politica mondo occidentale bene importante distinguere nettamente uomini degni dessere considerati tali meno idonei governo paese
2,numero memoir 1948 pagina retorica politica scritta mcclatchy guerra larte guerra pubblicato periodico the new york times nellaprile 1935 posizione trovano commenti allarticolo nyt conflitto damericasud americacontinua leggere genetica confronto dati relativi tasso mortalità materna infantile paesi
2,descrizione tipo commento solo risposte molto breve molto lungo critica solo unosservazione modo poterla migliorare senza doverlo fare ogni risposta precedente domanda dopo stessa tono generale può essere generico oppure tratta critiche vengono fatte durante dibattito pubblico caso posso usare lespressione parti detto diritti troppo ampio esaustivo riferisco invece alluso dellavere quindi uso termine specifico parola quando commenta ben
2,invio messaggio tramite twitter solo inglese possibile usare traduzione automatica testo puoi inviare chiedi moderatore tradurre stesso problema forma linguistica grande potenziale offensivo molti utenti sentono disorientati nellutilizzare correttamente linglese mai detto daccordo dici penso cosa buona date tutte informazioni necessarie usarlo utilizzarle modo giusto contento lavoro fatto scrivere tweet efficaci piace
2,politica politica 2016 recente intervista leader lega matteo salvini parlato diritto lavoro garantito normative europee molti osservatori evidente basta garantire diritti persone esempio presidente stati uniti donald trump parla regime retributivo italia continua usare parola diritti senza specificare quali ultimi continua servizi bancari problema dellitalia linflazione sistema economicofinanziario basato depositi bancari
2,aspetto specificato regola forum momento uso discussione 30122019 1645 inst scrivi tweet politico italiano caratteristiche post scritto sicuramente molto interessante purtroppo trovo difficoltà usando lingua italiana sicuro aver capito male qualcosa però complimenti perchè stato capace rendere comprensibile frase italia
4,positiva limpostazione complessiva tema partito insieme persone base orientamento ideologico ideale propongono progetto realizzazione proprie idee politiche contesto sociopolitico generale comunque sociale specifico riferiscono forma governo intesa accezione ampia include partiti politici organizzazioni governative scopo primario svolgere attività formazione diffusione dellideologia stessa pur mantenendo autonomia decisionale rispetto istituzioni organi rappresentativi pubblici esistenti rispettivi paesi esistono due possibili
0,critica stata data molta importanza aspetto premessa dibattito linguaggio utilizzato discussione portato riflessione piuttosto limitata grammatica frase alcuna influenza contenuti discorso invece contenuto molto chiaro diretto viene proposto qui sotto stato studio approfondito sulluso espressioni numerate 20132014 studiare lingua italiana rispetto altri paesi europei nonostante litalia ritardo ricerca visto infatti
2,voto voti purtroppo molto dire sempre buona notizia sostenitori nazionalismo progressista cuore bene nazione prosperità economica larticolo contiene errori grammaticali sintattici rimosso pagina aspettando prossima campagna elettorale durante elezioni primarie stati uniti svolte molti modi diverse alcune elezioni possono essere vinte solo attraverso sforzo bipartitico piuttosto completo controllo partiti politici
1,segnalo seguente post stato scritto fare domanda problema riguarda politiche partito campagna elettorale corso realtà articolo contiene solo link blog beppe grillo quindi cosa pensiate favore tempo può rispondere domanda così forse riusciamo evitare lanonimato comunque credo meglio essere anonimi qui trovate invece qualche consiglio pratico twitter bisogno dica social media diventati ormai strumento indispensabile comunicazione molti anni dopo
0,critica sistema europeo asilo critica allapproccio dellue migrazione stata lungo tempo critiche principali sinistra particolare lanalisi viene svolta dallexministro dellinterno governo merkel 2015 dichiarato rifiuto parte stati membri dellunione europea accogliere migranti provenienza libia deve essere visto solo nellottica umanitaria quadro generale processi politici economici cfr
0,votazioni 1840672395png autores rénin visite 200 argomenti memoria storica commemorazione retorica politica critica storia comunicazione pubblica italia primo dopoguerra oggi retorica linguaggio usato persuadere gente qualcosa giusto sbagliato riferimento discorso pubblico funzione solo fornire informazioni circa lesistenza qualche verità scientifica
0,seguente testo critica berlusconi definisce uomo nuovo posizioni politiche realtà esiste molti anni pare però classe politica attuale considera tale neanche quando esprime massimi meriti materia elettorale costituzionale caso presidente repubblica piuttosto tende assomigliargli molto meno evidente conflitto due concezioni diverse dellessere politici luna infatti assunto spesso comportamenti contraddittori rispetto proprie aspettative elettorali mentre nellaltra rinunciato propri convincimenti personali base imp
2,alcuni candidati politici scarsa conoscenza lingua italiana riuscendo pronunciare parole partiti tantomeno termine politica casi importante imparare corretta pronuncia alcuni termini tecnici far risaltare aspetti positivi proposte concordi cosa corretto dire situazione esempio partiti centrosinistra sembrano essere meno interessati questioni economiche rispetto formazione governo può trovare qualcosa accomuna nellutilizzo slang elettorale cfr lista partiti allestero lelenco argomenti trattati
0,politica cambiamento climatico due facce stessa medaglia lidea politiche pubbliche grado ridurre prevenire riscaldamento globale visione ingenua molto lontana realtà fatti problema principale clima fatto può essere governato nessuno solo scelta forma laltra richiede tempo lavoro mettere punto metodi giusti teoria delladattamento fallito obiettivo impone governi fare ciò può fare senza prendere posizione sullobiettivo specifico preso considerazione altri attori economici coinvolti risposta
0,laccezione negativa frequenti termine riferisce infatti situazioni termini vengono usati indicare aspetti negativi politica necessariamente negative italiani stati maltrattati proprio governo neutrali rispetto allideologia dominante momento storico visti coinvolti negatività quindi molto meno frequente confronti dellistituzione spesso viene associata altri fatti politici positivi lealtà verso paese troviamo significato negativo può essere usato posto termini politiche nazionali quando però
0,casi social network mezzo comunicazione diretto esprimere proprie idee politiche critiche vengono spesso fatte attraverso post commenti possono essere condivisibili può dire stessa cosa persona posta lesempio semplice commento negativo fatto qualcuno manifestazione politica poco credibile lesponente espresso opinioni simili tattica consente politici comunicare modo indiretto posizioni determinate questioni esempio quando viene chiesto spettatore esprimersi referendum cannabis esempio rappresenta molto
0,protagonisti renzi salvini grillo sinistra berlusconi problema personaggi cerca dautore moderazione direzione dellintervento narratore puntata 1976 conseguenze voto scuola italiana campagna referendaria evidenziato debolezza riforma gelmini aperto strada lintroduzione costituzione principi fondamentali legati valutazione studenti allinnovazione tecnologica oltre relativi diritto studio quali proposte concrete legge debba parlare
0,lidea lantipolitica soluzione futuro molto popolare cose così purtroppo ciononostante genere affermazioni conseguenze negative società termine populismo riferisce qualcosa diverso parlando oggi movimento populista nasce anni quando cultura alternativa iniziato avanzare america europa trattava persone volevano vivere allinterno dellopposizione sistema politico esistente quindi avere potere meno influenza rispetto partiti tradizionali
1,funzione riprodotti wikipedia commons discussioni wikivoyage riporta cronologia pagina raccolta parole frasi espressioni possono essere usate ricordare 2016 passato ogni volta menziona qualcuno necessario citare origini legami politici personali qualsiasi altro riferimento persona usato pubblicità qualcosa fine promuovere lattività partito altamente raccomandato richiesto inoltre possibile utilizzare tag ulteriore fonte informazioni storia attività politica impegno
0,politica litalia stata governata governo centrodestra guida maggioranza assoluta entrambi rami parlamento presidenza repubblica 1946 capo stato viene eletto direttamente popolo primo turno lultima elezione diretta avviene dopo anni dallentrata vigore costituzione repubblicana governo berlusconi 2008 premier ottiene larga vittoria elettorale elezioni politiche dellanno successivo mantiene prerogative costituzionali relative presidenza consiglio ministri sito utilizza cookies aiut
2,pensiero 2018 appena iniziato già primi segnali possibile inversione lanno voto parlamento europeo nuova maggioranza uscita urne europa vota sempre spesso eleggere rappresentanti governi locali paese invece votano solo europee nazionali contano nulla fini dellelezione sinistro sinistra governo allora mantenuto saldamente sotto stesso nome tutte amministrazioni regioni città gover
2,pagina precedente 879653 menu pagine principali home page info contatti breve categorie discussioni generali forum lista utenti sottoscrizione forum registrati links indice forum contatti gruppi notizie blog innowiki cerca sito archivio notizie recenti sezioni precedenti statistiche altre sezioni scoprire random post
0,sinistro oppositivo lobiettivo gioco scrivere lettera falsariga carta stampata può essere utilizzata esprimere proprie opinioni qualsiasi argomento possibile scrivere messaggi vocali vocalizzate scritte digitando proprio testo spazio appositamente predisposto messaggio vocale risultato espresso tramite lutilizzo specifici strumenti consentono visualizzazione effetti sonori correlati ciò scrivendo leffetto verrà utilizzato durante svolgimento dellattività tabellone quindi visibile solo dopo aver premuto invio riguarda
2,inst 08122019 1436 messaggio capo stato deve essere conservato reliquia stato ancora possibile avere memorie militari caduti guerra servizio militare mai storici dovrebbero ricordare scritto costituzione italiana fondamentale conservare documenti ufficiali storia dellitalia istituzioni politiche viviamo nellepoca memoria digitale potrebbe benissimo salvare testimonianze storiche vorrebbero fondi pubblici
2,soggetto politica italiana 2013oggiinfrastrutture infrastrutture reti ostina far finta litalia nazione senza confini storia italiani concetto confine molto comune colonialismo inglese tedesco dellottocento primo conquista britannica nuovo mondo parte eserciti angloamericani secondo francia dopo guerre napoleoniche 1796 primi due stati costruiti insieme francesi terzo ultimo stato
2,lidea sistema politico crisi molto tempo limmagine democrazia governi meno responsabili verso elettori cittadini storia recente dimostra però qualcosa daltro rispetto passato soprattutto base problema sempre paura dellignoto prescindere fatto ciò possa minare convinzioni personali rafforzare partito stesso scapito istituzioni problema riguarda solo elezioni politiche regionali forse amministrative locali importanti capire cosa possiamo fare quando troviamo fronte
3,sinistro avverbiale sincero interpretazione sintetica intenzionale tono neutro intenzioni state ancora rivelate accadere implicite azione breve implica necessariamente lazione già stata dichiarata pensieri basano fatti eventi noti maggioranza popolazione azioni riguardano futuro affari politici nazionali regionali paese questione inst lidea semplice formulazione richiede certa abilità
2,candidati politici sinistra verdi partito democratico centro destra nome completo pdl partito democratico sinistra verdi partito democratico classe dirigente ministro delleconomia governo renzi 2014 2018 incarichi responsabilità istituzionale sottosegretario presidenza consiglio ministri governo letta fino allottobre 2016 poi sottosegretari rapporti parlamento nellesecutivo gentiloni fino dicembre 2017 precedentemente
2,unaccezione generica studiato storia dellitalia unita liceo alluniversità volta apprese nozioni storia italiana contemporanea pensa destra realtà interpretazione esisteva fino anni novanta secolo scorso quando termine destra associato ideologie socialisteradicali sinistra tradizionale luso diffuso italia italiani soprattutto fra giovani fatto strumento abbastanza popolare avere oggi molti lettori nellambito accademicoaccademico dibattito pubblico parola deno
0,candidato proposto renzi elezioni amministrative decisamente destra differenza dellelettorato centrosinistra vede quasi sempre svendita recuperare voti liste civiche peraltro state molto critiche confronti preoccupa tanto collocazione politica lista nazionale candidatura personale collegio elettorale corrisponde propria immagine invece persona comune comunque stimato esponente locale sicuramente vicino lega nord rispetto allapparente estraneo partiti tradizionali magari solo condivide posizioni estremiste partito problema principale
0,sostanza pessimismo probabilmente pessimistico strumenti analisi twitter google segue retorica forma darte messaggio viene diffuso mediante parole descrivono cose persone riferisce parola retorica deriva dallitaliano arcaico prosa cioè greco antico ὡραμάχτης cantata opere letterarie tutte scritte usando luso lingua parlata totalità
3,109 sintesi incomplete guerra ucraina dimostrata dopo conflitto scelta razionale nonviolenta stata efficiente dellopzione militare effetti terreno stati positivi popolazione civile russa generale impatto negativo economie regioni occupate russi subiscono conseguenze peggiori causa devastazione economica conseguente presenza regione donbass ucraina lintervento militare russo permesso governo ucraino imporre autorità centrali russe termini cess
0,persona mai stata politicamente impegnata chiesto lavesse fatto citazione due polli film 1954 diretto john schlesinger battuta caso riferita allopposizione sociale significava molto posizione politica stesso concetto espresso senatore repubblicano harry blackburn guerra questione bianchi neri senso lato postilla può essere ripetuto molte volte detto altrimenti dire cose negative qualcuno
2,caso tono stato scelto funzione generica scopo far capire questione lavoro sempre legata tutela delloccupazione altre questioni generali volte politici vengono percepiti cittadini modo poco trasparente proprio aver fatto emergere problemi campagna elettorale ciò può avere effetti collaterali negativi percezione politica stessa parte elettori sentono rappresentati propria squadra governo liste avversarie problema vero però modalità comunicazione usate campagne elettorali partiti spesso usato parola lavoro
0,retoricopopulismo retorica usata criticare lidea popolo massa individui privi capacità pensare lespressione riferisce leader politici moderni termine vengono indicati rappresentanti ceto medio indica necessariamente luomo partito linguaggio comune tuttavia ciò designa persone parte partecipano partiti politici tale parola però valore lingua italiana odierna etimologia risale fine dellottocento parla invece nellaccezione
1,politica primo luogo forma governo instaura democrazia diretta cittadini possono scegliere direttamente capo governo partiti tramite votazione popolare pubbliche attraverso referendum popolari rappresentanti governativi rappresentati partiti politici eletti suffragio universale diretto leggi elettorali rendono difficile controllo maggioranza parlamento parte opposizioni32 costituzione italiana riconosce lelezione indiretta678 possibilità permette governi avere voti rispetto elezioni politiche principio democratico impone
2,politica
2,reach 15000 fonte installare lingua italiana allinterno proprio sito web volta installato basta cliccare start iniziare linstallazione guidata successivamente può installare file presente cartelle apps altri posti specifici browser impostazione predefinita cartella chiamata html modo tutte pagine create installate server web ogni pagina stesso nome versione precedente verranno installati due siti contemporaneamente così sicuri
2,genericizzazione forma despressione usata informatica indicare termine generico generica utilizzato spesso allinterno discussioni internet possibile qualcuno utilizzi concetto scopi complessi caso social network instant messaging senso impiegarlo formulazione messaggio pubblicitario laccezione generica riferisce ogni utilizzo termine linguaggio comune giorno doggi maggior parte comunicazione avviene attraverso sistemi informatici digitali può parlare quindi accezione generalizzata quando riferiamo informazioni condivise chiunque tramite
0," 
  movimento climatico grande ostacolo sopravvivenza specie scienza bisogno tempo spiegare natura cambiamenti climatici finora stati fatti molti politici ignorato problema cercato altre direzioni lasciando allopinione pubblica solo giusto fare momento opportuno quando tratta clima sempre qualcuno piace essere chiamato ignorante parlare senza conoscere proprio stesso ora ciò succedendo lelezione presidenziale americana stati uniti"
2,direttore italia leconomia cresce meno altri paesi primo ministro italiano mario draghi annunciato oggi programma economico prossimi mesi nuovo governo affronterà sfida dellausterità riforme strutturali maggiore cooperazione economica stati uniti alcuni partner europei beneficio economie europee riguarda politica commerciale globale affermato riduzione tariffa parte produttori cinesi importatori americani fine aumentare competitività commercio mondiale misure austerity state criticate
