Date,ID,URL,Content,Likes,Retweets
2022-12-29 19:44:48+00:00,1608549616898777178,https://twitter.com/Maurizio_Lupi/status/1608549616898777178,La storia del Covid di questi anni ci dimostra che non ci si salva da soli: per una vera prevenzione dei contagi dalla Cina l’Italia deve muoversi all'unisono con l'UE. E con l'Europa dobbiamo chiedere loro tutte le informazioni disponibili su eventuali nuovi ceppi del virus.,16,0
2022-12-29 14:41:02+00:00,1608473170788368384,https://twitter.com/Maurizio_Lupi/status/1608473170788368384,"Il Presidente Meloni ha esposto con chiarezza le misure della manovra e il programma di governo del Centrodestra per i prossimi cinque anni. Per #NoiModerati la priorità sarà il sostegno a imprese, famiglia e natalità, con la realizzazione di una vera alleanza famiglia-lavoro.",31,0
2022-12-23 13:57:53+00:00,1606287983786618881,https://twitter.com/Maurizio_Lupi/status/1606287983786618881,"#NoiModerati siamo molto contenti che siano state recepite le nostre proposte: penso al congedo parentale per i padri, all'aumento dell'assegno unico per le famiglie numerose e alla modifica sul #RedditodiCittadinanza. Cambiarlo era un dovere, l'assistenzialismo a vita una follia",77,0
2022-12-21 12:16:31+00:00,1605537697413550080,https://twitter.com/Maurizio_Lupi/status/1605537697413550080,"Chi non può lavorare continuerà a percepire il reddito, ma la lotta alla povertà si vincerà con l’occupazione. Noi vogliamo far uscire le persone dalla condizione di bisogno con le politiche attive del lavoro. Conte invece?",52,0
2022-12-21 12:16:30+00:00,1605537694339108865,https://twitter.com/Maurizio_Lupi/status/1605537694339108865,"Conte, da giurista, dovrebbe sapere che le leggi non possono basarsi su criteri vaghi e indeterminati, e che la vera follia non è aver eliminato la parola 'congrua', ma negare il diritto al lavoro, scommettendo strutturalmente sulla povertà delle persone per avere un elettorato",201,0
2022-12-20 14:45:33+00:00,1605212818126553094,https://twitter.com/Maurizio_Lupi/status/1605212818126553094,"Sulle intercettazioni il ministro Nordio ha posto una questione che vale per tutti, e cioè un loro utilizzo serio, intelligente e rispettoso delle libertà individuali. Sono uno strumento importante, di cui però non si può abusare. Affronteremo il tema nei suoi aspetti particolari",34,0
2022-12-19 18:13:26+00:00,1604902745466671138,https://twitter.com/Maurizio_Lupi/status/1604902745466671138,Condivido appieno le parole pronunciate dal ministro per l'Ambiente Pichetto Fratin dopo l'accordo raggiunto dal Consiglio per l'Energia riguardo al #PriceCap per il gas. Una vittoria per tutta Europa e soprattutto per l'Italia che si è impegnata duramente per questo obiettivo.,19,0
2022-12-19 15:28:52+00:00,1604861330044985344,https://twitter.com/Maurizio_Lupi/status/1604861330044985344,"Il governo ha accolto le proposte di #NoiModerati per un maggiore sostegno alle famiglie: aumenta il congedo parentale (con l’estensione a entrambi i genitori), aumenta l’assegno unico per le famiglie numerose e, inoltre, vi sarà una proroga di un mese al pagamento delle bollette",33,0
2022-12-16 17:59:19+00:00,1603812026496827426,https://twitter.com/Maurizio_Lupi/status/1603812026496827426,"Sinisa Mihajlovic è stato un grande calciatore e un grande uomo, un esempio per chi interpreta lo sport come formazione e come impegno. Lo sport italiano e internazionale perde un campione.",42,0
2022-12-16 14:02:37+00:00,1603752461529145344,https://twitter.com/Maurizio_Lupi/status/1603752461529145344,L'approvazione da parte dell’UE della manovra dice che il metodo del governo di Centrodestra è quello giusto: prudenza sui conti e attenzione allo sviluppo. Peccato che l’aumento dei tassi deciso dalla #BCE vada in senso contrario: non combatte l’inflazione ma alza i mutui.,16,0
2022-12-15 15:03:30+00:00,1603405392268206081,https://twitter.com/Maurizio_Lupi/status/1603405392268206081,"L’aumento dell'età media del Paese certificata dall’Istat è preoccupante. Dobbiamo sostenere di più la #natalità, perché senza le nuove generazioni sarà difficile tutelare le pensioni future. #NoiModerati lavora per aumentare le risorse per il congedo parentale e l'assegno unico.",25,0
2022-12-14 15:26:27+00:00,1603048780391235585,https://twitter.com/Maurizio_Lupi/status/1603048780391235585,"Dobbiamo ripartire dall’istruzione. Per questo, tra i nostri #emendamenti, vi sarà un credito di imposta del 65% per le donazioni destinate a tutti gli istituti scolastici, statali e paritari, per la realizzazione di nuove strutture, la manutenzione e il loro potenziamento.",20,0
2022-12-13 17:42:12+00:00,1602720556259885057,https://twitter.com/Maurizio_Lupi/status/1602720556259885057,La comunità internazionale non può restare inerte di fronte all'orrore di una repressione sanguinaria in spregio a qualsiasi diritto. Quel che sta accadendo in #Iran è intollerabile e tutti i paesi democratici hanno il dovere di intervenire per fermare la mattanza. #NoiModerati,31,0
2022-12-13 11:19:55+00:00,1602624350607351808,https://twitter.com/Maurizio_Lupi/status/1602624350607351808,"Quella fatta è una #LeggeDiBilancio giusta e seria, responsabile, anche se si poteva avere più coraggio concentrando meglio le risorse sui temi davvero importanti, come le politiche sulla #natalità e il #CaroInflazione. La mia intervista di oggi al  Corriere della Sera https://t.co/H714zHvofT",14,0
2022-12-12 12:23:45+00:00,1602278027458940928,https://twitter.com/Maurizio_Lupi/status/1602278027458940928,"Il messaggio lasciato davanti all'abitazione del presidente del Consiglio comunale di Sciacca non avrà alcun effetto. Solidarietà mia e di #NoiModerati a Ignazio Messina, segretario nazionale dell'IdV. Ci auguriamo sia fatta presto chiarezza e i responsabili siano puniti.",13,0
2022-12-10 16:30:31+00:00,1601615353007968256,https://twitter.com/Maurizio_Lupi/status/1601615353007968256,"Bene che la presidenza del Consiglio abbia accolto la nostra proposta per il #BonusSud con la conferma dei crediti d'imposta per le aziende che acquistano beni e fanno ricerca e sviluppo nelle regioni del Mezzogiorno. Ora al lavoro su famiglie e imprese. Avanti così.
#NoiModerati",26,0
2022-12-07 10:10:45+00:00,1600432618528391168,https://twitter.com/Maurizio_Lupi/status/1600432618528391168,"#NoiModerati presenterà degli emendamenti per abbassare la soglia entro cui vengono sospese le sanzioni sul #POS, oggi fissata a 60 euro e, in parallelo, per avere zero commissioni sotto i 15 euro di spesa.",21,0
2022-12-05 14:27:30+00:00,1599772455002075140,https://twitter.com/Maurizio_Lupi/status/1599772455002075140,Il blocco dell'alta velocità Bari-Napoli rischia di far perdere 200 milioni di finanziamenti del #PNRR all’Italia. Bisogna intervenire rapidamente a tutela delle opere strategiche già cantierizzate. Non possiamo permetterci di perdere questa occasione per ammodernare il Paese.,32,0
2022-12-02 11:49:04+00:00,1598645421328502786,https://twitter.com/Maurizio_Lupi/status/1598645421328502786,"Il miliardo e mezzo messo a sostegno delle famiglie è fondamentale, come l’aver aumentato l’assegno unico per il primo anno. Ora dobbiamo incrementare il sostegno alle famiglie numerose e le risorse per la conciliazione lavoro-famiglia, partendo dall’aumento del congedo parentale",22,0
2022-11-30 19:06:41+00:00,1598030773671825408,https://twitter.com/Maurizio_Lupi/status/1598030773671825408,"L'Italia continua a garantire il massimo impegno per la difesa dell'#Ucraina dall'aggressione russa. Il sostegno alla resistenza è anche la difesa dei nostri valori di libertà e democrazia. Guai a spaccare la compatezza europea e atlantica, le conseguenza sarebbero gravissime.",25,0
2022-11-29 18:12:34+00:00,1597654768021032962,https://twitter.com/Maurizio_Lupi/status/1597654768021032962,"Le risorse a disposizione nella #LeggeDiBilancio sono limitate, per questo dobbiamo concentrarle il più possibile: lotta all’inflazione con aumenti di stipendio detassati per i lavoratori (fino a 200 euro al mese) e divieto di blocco delle opere strategiche già cantierizzate.",14,0
2022-11-29 12:39:33+00:00,1597570961813168128,https://twitter.com/Maurizio_Lupi/status/1597570961813168128,È inaccettabile che un tribunale possa interrompere le opere previste dal Pnrr dopo che hanno seguito tutto l'iter. Quello che è avvenuto sul nodo ferroviario di Bari è una vergogna che può diventare un gravissimo precedente. #NoiModerati presenteremo un emendamento per impedirlo,33,0
2022-11-26 16:09:31+00:00,1596536637982658560,https://twitter.com/Maurizio_Lupi/status/1596536637982658560,"I drammatici fatti di Ischia provocano un grande dolore e impongono una riflessione: da troppo tempo le calamità naturali causano disastri sul nostro territorio, che è per buona parte a rischio idrogeologico. Non possiamo ignorarlo. Rendiamo la manutenzione priorità nazionale.",39,0
2022-11-23 16:35:56+00:00,1595456124249145344,https://twitter.com/Maurizio_Lupi/status/1595456124249145344,"Più delle intenzioni valgono i fatti: la Russia non solo ha invaso l'#Ucraina, ma bombarda città e infrastrutture civili. Decida Conte, che non ha sostenuto la mozione a Strasburgo, come chiamare quello che Putin sta facendo. Il dato di fatto è che l'Occidente non può accettarlo.",35,0
2022-11-22 16:56:59+00:00,1595099033240064002,https://twitter.com/Maurizio_Lupi/status/1595099033240064002,"La #LeggeDiBilancio va nella direzione descritta nel programma elettorale della coalizione votato dai cittadini. Aiuti a famiglie, imprese e sostegno contro caro vita e caro bollette. 
#NoiModerati siamo soddisfatti perché la priorità della famiglia è stata riconosciuta.",33,0
2022-11-22 07:59:01+00:00,1594963646718873605,https://twitter.com/Maurizio_Lupi/status/1594963646718873605,"Apprendo con dolore della scomprsa di Roberto Maroni, un amico, una persona che ha saputo interpretare con stile e moderazione il cambiamento politico e sociale della Repubblica. Ci uniamo al dolore della famiglia e dei suoi cari.",105,0
2022-11-21 10:44:20+00:00,1594642865157799936,https://twitter.com/Maurizio_Lupi/status/1594642865157799936,"Nella manovra economica andiamo avanti con il sostegno a famiglie e imprese. È necessario dare impulso all'occupazione e il modo migliore per farlo è sicuramente quello di detassare le assunzioni dei giovani, oltre che eliminare le imposte dagli aumenti di stipendio.",23,0
2022-11-20 20:34:52+00:00,1594429087447138305,https://twitter.com/Maurizio_Lupi/status/1594429087447138305,"Il sostegno alle famiglie ed alla natalità, che sono priorità di questo governo, non si attua con proposte bislacche, anche se fatte in buona fede. Il #BonusMatrimonio solo per chi si sposa in Chiesa non è certamente il sostegno che le famiglie si aspettano e di cui hanno bisogno",335,0
2022-11-18 21:01:39+00:00,1593711054915358720,https://twitter.com/Maurizio_Lupi/status/1593711054915358720,"Con la manovra daremo segnali concreti: un pacchetto da oltre 1 miliardo per le #famiglie, sostegno alle #imprese e revisione del #RedditoDiCittadinanza per aiutare chi non può lavorare e facilitare il sostegno delle politiche attive del lavoro. Siamo sulla strada giusta.",23,0
2022-11-17 20:05:25+00:00,1593334511902904325,https://twitter.com/Maurizio_Lupi/status/1593334511902904325,"Spero che l’assoluzione di @berlusconi, cui va la nostra solidarietà, segni un nuovo inizio e che mai più si cerchi di delegittimare e disarcionare l’avversario con un modo di fare che ha disastrato le istituzioni, aprendo le porte a pericolosi populismi.",97,0
2022-11-17 17:36:07+00:00,1593296941596786688,https://twitter.com/Maurizio_Lupi/status/1593296941596786688,"La manovra di bilancio dovrà essere incentrata su famiglie e imprese. #NoiModerati chiediamo una riduzione del cuneo fiscale tutto a vantaggio degli stipendi dei lavoratori e che se un'impresa darà un aumento di stipendio ai propri dipendenti, questo dovrà avere tassazione zero.",16,0
2022-11-16 17:20:23+00:00,1592930595415666688,https://twitter.com/Maurizio_Lupi/status/1592930595415666688,"Sull’immigrazione dignità umana e sicurezza dei confini debbono andare di pari passo. L’Italia su questo è in prima fila da sempre, non ci servono lezioni da nessuno: si rispettino le quote di ripartizione e le ONG, senza però che diventino traghetti per i commercianti di persone",23,0
2022-11-16 10:11:57+00:00,1592822775764647941,https://twitter.com/Maurizio_Lupi/status/1592822775764647941,"La gestione del flusso dei migranti è una sfida che coinvolge tutta Europa. Bisogna investire nel Mediterraneo almeno quanto investito sulla rotta balcanica e serve, più che mai, una strategia europea complessiva per tornare a gestire il fenomeno, smettendola di subirlo.",34,0
2022-11-11 12:52:43+00:00,1591051294566916096,https://twitter.com/Maurizio_Lupi/status/1591051294566916096,"La Francia cerca di scaricare le proprie tensioni di politica interna sull'Italia e chiede a noi di rispettare le regole che lei non rispetta. L’unica strada è quella di affrontare con l’Europa tutta il tema dell'immigrazione, finalmente attuando le quote di ripartizione.",506,0
2022-11-10 11:05:37+00:00,1590661953609166848,https://twitter.com/Maurizio_Lupi/status/1590661953609166848,"Credo che il risultato delle elezioni americane ci indichi che in America stia tornando il bel conservatorismo di stampo reaganiano, il populismo sguaiato di Trump non piace più.
Una lezione anche per l'Italia.

La mia intervista di oggi a La Repubblica https://t.co/8lixjd5brN",31,0
2022-11-09 18:04:14+00:00,1590404915217588224,https://twitter.com/Maurizio_Lupi/status/1590404915217588224,"La NADEF servirà a fronteggiare l’inflazione, il caro materiali e il caro energia, che stanno mettendo a dura prova famiglie e imprese. L’UE capisca però che, ancor più del covid, per vincere queste sfide c’è  bisogno di un approccio unitario. È l’unica strada per l’Europa",12,0
2022-11-07 12:13:18+00:00,1589591824775417860,https://twitter.com/Maurizio_Lupi/status/1589591824775417860,"Basta approcci ideologici: la gestione dei flussi migratori deve essere fatta coniugando il contrasto ai trafficanti con il dovere di accoglienza verso chi scappa dalla sofferenza. Come ha ricordato Papa Francesco non può più essere un problema solo italiano, ma dell’Europa tutta",78,0
2022-11-05 17:49:57+00:00,1588951767080763393,https://twitter.com/Maurizio_Lupi/status/1588951767080763393,"Il governo parte col piede giusto: aiuti concreti per famiglie e imprese contro il #caroenergia e rilancio delle trivellazioni nell’Adriatico, bloccate da anni a causa di una visione ideologica. Ora importante rilanciare strutturalmente l’economia italiana. Faremo delle proposte.",33,0
2022-11-02 13:30:40+00:00,1587799354458316800,https://twitter.com/Maurizio_Lupi/status/1587799354458316800,"La norma sui #RaveParty non limita la libertà di manifestazione e di dissenso, che è segno di vitalità di un Paese, ma impedisce rave vergognosi e illegali che mettono a rischio l'incolumità personale (in passato ci sono stati dei morti) e pubblica. È scritta male? Correggiamola.",614,0
2022-10-31 15:57:56+00:00,1587111638636822529,https://twitter.com/Maurizio_Lupi/status/1587111638636822529,"La squadra di governo è stata completata e ora è arrivato il momento di affrontare le emergenze: caro bollette, salute, guerra in Ucraina e le grandi questioni economiche e sociali. Dobbiamo lavorare con responsabilità e dare riaposte concrete alle giuste richieste dei cittadini.",90,0
2022-10-25 16:32:07+00:00,1584945912727490570,https://twitter.com/Maurizio_Lupi/status/1584945912727490570,"#NoiModerati ci riconosciamo nel discorso del presidente del Consiglio e sosterremo il suo governo. È il momento di rimboccarsi le maniche per liberare le migliori energie della società, del mondo del lavoro e della scuola, sempre a sostegno di famiglie e imprese.",86,0
2022-10-21 17:16:53+00:00,1583507629233475584,https://twitter.com/Maurizio_Lupi/status/1583507629233475584,"Una squadra competente e di grande qualità. Faccio i complimenti a @GiorgiaMeloni ed a tutti i ministri. #NoiModerati sosterrà convintamente il lavoro di questo governo, con i suoi gruppi parlamentari e le sue proposte. 
Ora subito al lavoro con serietà e responsabilità. https://t.co/yv4FXl9dC0",404,0
2022-10-20 10:02:41+00:00,1583035969338740736,https://twitter.com/Maurizio_Lupi/status/1583035969338740736,"Dopo 10 anni gli elettori hanno scelto una maggioranza politica ed hanno affidato al centrodestra il compito di guidare l’Italia fino al 2027. Non farlo sarebbe da irresponsabili. Ma che sia certa una cosa: il governo che nascerà sarà atlantista, europeista, serio e responsabile. https://t.co/Xyz76ywJ8c",39,0
2022-10-15 09:19:56+00:00,1581213272560529408,https://twitter.com/Maurizio_Lupi/status/1581213272560529408,Piazza San Pietro in attesa del Papa per i 100 anni dalla nascita di Don Giussani. https://t.co/FXwKQFmzf4,60,0
2022-10-14 12:20:28+00:00,1580896315906457600,https://twitter.com/Maurizio_Lupi/status/1580896315906457600,"Il presidente della Camera Fontana ha pronunciato un discorso di alto profilo politico, da vero garante delle istituzioni. Saprà ricoprire questo ruolo con lo spirito di servizio e con l'equilibrio che richiede. La sua elezione, peraltro, conferma l’unità del centrodestra.",571,0
2022-10-13 13:43:24+00:00,1580554800059789312,https://twitter.com/Maurizio_Lupi/status/1580554800059789312,"Ignazio La Russa sarà un ottimo presidente del Senato, equilibrato e leale come ha già dimostrato nel suo primo intervento. Sarà la dimostrazione che si può essere garanti dell'istituzione anche rivendicando con orgoglio la propria storia e cultura politica. Buon lavoro!",518,0
2022-10-12 09:42:48+00:00,1580131864982847488,https://twitter.com/Maurizio_Lupi/status/1580131864982847488,"La storia del Centrodestra dimostra che quando è stato chiamato a governare lo ha sempre fatto con competenza, unità e responsabilità. Domani si insediano le Camere e, a breve, il nuovo governo. Siamo pronti ad affrontare la sfida che ci attende. Ognuno con il proprio contributo.",366,0
2022-10-10 10:11:24+00:00,1579414287227179011,https://twitter.com/Maurizio_Lupi/status/1579414287227179011,"La violenza indiscriminata di Putin verso l’#Ucraina è intollerabile. Ancora una volta la più ferma condanna verso il comportamento di Mosca, che oggi sta colpendo indiscriminatamente i civili. Dobbiamo rilanciare ogni sforzo per un cessate il fuoco che porti ad una pace giusta.",46,0
2022-10-02 09:11:33+00:00,1576500122699313152,https://twitter.com/Maurizio_Lupi/status/1576500122699313152,"Prima tra le sfide che il voto ci ha consegnato è il #CaroEnergia: introducendo la #MorositàIncolpevole chi ha sempre pagato le bollette non si vedrà staccare le utenze. Vogliamo uno Stato al servizio dei cittadini, non viceversa.

La mia intervista al @Corriere. https://t.co/1MpIDukKqp",35,0
2022-10-01 09:06:20+00:00,1576136421655838720,https://twitter.com/Maurizio_Lupi/status/1576136421655838720,"Il Governo che nascerà sarà il primo esecutivo con maggioranza politica votata dagli elettori dopo 11 anni. Come #centrodestra daremo subito risposte concrete alla crisi, usando lo stesso metodo che ci ha portato a sottoscrivere un programma unitario.

L’intervista al Messaggero https://t.co/vJoP7HDrPc",53,0
2022-09-29 17:56:10+00:00,1575544983414710272,https://twitter.com/Maurizio_Lupi/status/1575544983414710272,La Commissione europea non presenterà una proposta formale sul #PriceCap al gas. Una scelta grave che avrà pesanti conseguenze economiche. Ancora una volta la Germania ha favorito gli interessi nazionali a quelli comunitari. In questa crisi è la scelta peggiore che si possa fare.,50,0
2022-09-28 10:54:00+00:00,1575076353803636736,https://twitter.com/Maurizio_Lupi/status/1575076353803636736,"I danni del #CaroEnergia peggiorano ogni settimana: oggi sono oltre 100mila le imprese a rischio chiusura per colpa del costo delle bollette, che non può più essere scaricato sui clienti. Dobbiamo utilizzare i fondi strutturali europei per affrontare la crisi.Bisogna agire subito",30,0
2022-09-26 14:27:23+00:00,1574405274240274432,https://twitter.com/Maurizio_Lupi/status/1574405274240274432,"Grazie agli oltre 131.000 elettori del collegio uninominale di Lecco che mi hanno riconfermato rappresentante del territorio alla Camera dei deputati. Ora è il momento per il #centrodestra di governare il Paese con responsabilità, dando seguito al programma unitario sottoscritto.",53,0
2022-09-25 16:25:25+00:00,1574072591819628545,https://twitter.com/Maurizio_Lupi/status/1574072591819628545,Si vota fino alle 23:00! https://t.co/udP22YbrUV,28,0
2022-09-23 19:42:39+00:00,1573397452811632660,https://twitter.com/Maurizio_Lupi/status/1573397452811632660,"Il centrodestra non insegua Conte sul reddito di cittadinanza: noi siamo cosa diversa, dobbiamo dare a tutti, al Nord come al Sud, la dignità di un lavoro e non un’elemosina che rende schiavi del potere. Il reddito va dato solo a chi non può lavorare, a chi non ha alternative.",45,0
2022-09-23 13:47:17+00:00,1573308022545317888,https://twitter.com/Maurizio_Lupi/status/1573308022545317888,"L'Italia è una democrazia forte, leale con l’Ue, schierata con l'Ucraina. In questo momento così importante, a poche ore dalle elezioni, invito tutti i rappresentanti delle istituzioni e della politica a cercare di non alimentare polemiche che non hanno alcuna ragione di esistere",29,0
2022-09-22 17:40:42+00:00,1573004372371554306,https://twitter.com/Maurizio_Lupi/status/1573004372371554306,Domenica #TorniamoAFarePolitica cambiando l’Italia. Insieme. #NoiModerati https://t.co/QvItNvKAsW,77,0
2022-09-22 13:42:24+00:00,1572944404054216704,https://twitter.com/Maurizio_Lupi/status/1572944404054216704,"L'appello del presidente di Confindustria Bonomi conferma l'esigenza di un nuovo rapporto fra Stato e imprese. Urge un patto per la crescita e la competitività del tessuto imprenditoriale, tagliando la burocrazia che ogni anno costa 127 miliardi tra adempimenti e mancata crescita",20,0
2022-09-22 11:14:25+00:00,1572907162082443265,https://twitter.com/Maurizio_Lupi/status/1572907162082443265,"La nostra coalizione è totalmente a fianco dell'Ucraina. Su questo non ci sono dubbi. #NoiModerati pensiamo che sia un dovere non cedere al ricatto energetico messo in atto dalla Russia e sostenere la politica europea delle sanzioni. 
La mia intervista a Paris Match https://t.co/QEJNDYWpe4",19,0
2022-09-21 13:25:36+00:00,1572577787231502343,https://twitter.com/Maurizio_Lupi/status/1572577787231502343,"Dobbiamo dare tranquillità sociale per il prossimo inverno a famiglie e imprese, la spina dorsale del Paese. #NoiModerati proponiamo di vietare che si taglino luce e gas a tutti coloro che hanno sempre pagato la bolletta e che oggi non riescono a pagarla. È #MorositàIncolpevole.",21,0
2022-09-21 08:50:31+00:00,1572508559673528321,https://twitter.com/Maurizio_Lupi/status/1572508559673528321,"Le gravissime parole di #Putin, con la mobilitazione parziale e il referendum illegittimo per l'annessione delle regioni invase, confermano l'importanza del posizionamento atlantista dell'Italia, oltre che delle sanzioni. #NoiModerati siamo con l’#Ucraina senza se e senza ma.",85,0
2022-09-20 15:58:40+00:00,1572253921237958657,https://twitter.com/Maurizio_Lupi/status/1572253921237958657,"Congratulazioni alla neopresidente della Corte Costituzionale Sciarra per questo incarico di così alto rilievo istituzionale. Già dalle sue prime parole traspaiono tutto il suo merito, la sua competenza e il suo equilibrio, come ha dimostrato già la presidenza di Marta Cartabia.",17,0
2022-09-19 18:40:27+00:00,1571932246856155136,https://twitter.com/Maurizio_Lupi/status/1571932246856155136,"Letta fa campagna elettorale con Scholtz, lo stesso che col suo no al tetto del prezzo del gas fa pagare bollette stratosferiche a famiglie e imprese italiane.",809,0
2022-09-19 12:47:38+00:00,1571843456036651008,https://twitter.com/Maurizio_Lupi/status/1571843456036651008,"Mentre la sinistra cerca di spostare l'attenzione da una discussione seria sui programmi, #NoiModerati ci occupiamo delle famiglie: vogliamo che non vengano staccate luce e gas alle persone in difficoltà, che hanno sempre pagato le bollette e ora non ce la fanno.",29,0
2022-09-17 17:35:07+00:00,1571191029335826433,https://twitter.com/Maurizio_Lupi/status/1571191029335826433,"La sfida politica del vero centro è nel Centrodestra e più forti saranno i moderati, più forte sarà l’intera coalizione. Serietà, competenza, concretezza e responsabilità sono la cifra che contraddistingue il nostro metodo di fare politica. #NoModerati",17,0
2022-09-15 15:00:30+00:00,1570427342597619712,https://twitter.com/Maurizio_Lupi/status/1570427342597619712,Non si può staccare l’utenza a famiglie e imprese che per colpa di una guerra non riescono a pagare i mostruosi aumenti delle bollette. #NoiModerati chiediamo un provvedimento urgente per bloccare questa facoltà per almeno 6 mesi e per prevedere la possibilità di rateizzazione.,117,0
2022-09-14 16:38:21+00:00,1570089582192119808,https://twitter.com/Maurizio_Lupi/status/1570089582192119808,"Prima donna europea a guidare la Stazione Spaziale Internazionale. Complimenti a Samantha #Cristoforetti. Un esempio per tutti i giovani e in particolare per le ragazze, il cui protagonismo nelle materie #Stem deve crescere ogni giorno di più. Un orgoglio per il nostro Paese.",23,0
2022-09-14 12:44:54+00:00,1570030831124488193,https://twitter.com/Maurizio_Lupi/status/1570030831124488193,"Le parole del Presidente del Copasir Urso ci rassicurano ma il tema delle ingerenze straniere nella politica non va trascurato. L'Italia ha un peso importante negli equilibri internazionali, in ogni caso dobbiamo potenziare intelligence e cybersecurity, senza allarmismi.",29,0
