Date,ID,URL,Content,Likes,Retweets
2022-09-13 13:24:55+00:00,1569678514546417664,https://twitter.com/Maurizio_Lupi/status/1569678514546417664,"Contro il caro costi c’è bisogno di risposte immediate a famiglie e imprese, migliaia di aziende rischiano di chiudere. #NoiModerati chiediamo al governo un ulteriore sforzo: fare un altro decreto Ristori utilizzando i fondi europei disponibili o un nuovo scostamento di bilancio.",21,0
2022-09-12 16:54:02+00:00,1569368751702786049,https://twitter.com/Maurizio_Lupi/status/1569368751702786049,"La scuola è il principale fattore di sviluppo della società. Per questo rafforzare il diritto allo studio e valorizzare l’insegnamento è prioritario per #NoiModerati: più docenti e pagati in linea con la media europea, più detrazioni per le spese scolastiche, mai più DaD.",28,0
2022-09-11 16:17:32+00:00,1568997179959771136,https://twitter.com/Maurizio_Lupi/status/1568997179959771136,"Ogni anno l'Italia spende 11-12 miliardi in meno per famiglia e natalità rispetto agli altri Paesi europei. In Germania se scegli di stare con tuo figlio il primo anno si riceve il 67% dello stipendio, da noi il 30%. #NoiModerati portiamo queste queste battaglie nel centrodestra.",32,0
2022-09-10 13:02:27+00:00,1568585697728020480,https://twitter.com/Maurizio_Lupi/status/1568585697728020480,"L’ipotesi di un governo di larghe intese non esiste. #NoiModerati chiediamo agli elettori, insieme al centrodestra, un chiaro mandato per governare il Paese fino al 2027, con un programma unitario presentato con largo anticipo rispetto agli altri avversari. #TorniamoAFarePolitica",26,0
2022-09-08 18:20:55+00:00,1567941064262094850,https://twitter.com/Maurizio_Lupi/status/1567941064262094850,Mi inchino di fronte alla testimonianza di servizio al suo Paese della Regina Elisabetta. “Finché le forze mi reggeranno” aveva detto il giorno del suo giuramento 70 fa. Ha mantenuto con grande dignità la sua promessa. Un esempio per chiunque concepisca il potere come servizio,38,0
2022-09-08 11:09:56+00:00,1567832606330294272,https://twitter.com/Maurizio_Lupi/status/1567832606330294272,"#Conte fa l’indignato con chi vuole riformare il #RdC, che non funziona, ma poi fa ostruzionismo sui 17 MLD di aiuti a famiglia e imprese per il #CaroBollette, bloccandoli.  Una nuova strategia per ri-sconfiggere la povertà? In politica contano i fatti.
#TorniamoAFarePolitica",29,0
2022-09-08 08:47:51+00:00,1567796849028759554,https://twitter.com/Maurizio_Lupi/status/1567796849028759554,"Il #TerzoPolo continua a tirare per la giacca Draghi, che è stato chiaro: non esiste una mia agenda. Il suo governo è stata una (felice) eccezione di fronte all'emergenza, ora è tempo di proposte politiche. Parlare di #AgendaDraghi vuol dire non avere idee per l'Italia del 2027.",20,0
2022-09-07 10:46:45+00:00,1567464382828789760,https://twitter.com/Maurizio_Lupi/status/1567464382828789760,"Per rendere più efficienti le nostre istituzioni sarà opportuno prevedere una commissione bicamerale per le riforme, senza toni urlati. Dobbiamo rafforzare il ruolo del Parlamento e, magari, prevedere una riforma in senso presidenzialista, con i dovuti contrappesi. #NoiModerati",19,0
2022-09-06 17:44:34+00:00,1567207141362094082,https://twitter.com/Maurizio_Lupi/status/1567207141362094082,"La crisi energetica è più grave
del covid. Il Governo ci ha garantito un importante approvvigionamento di gas all'80%, ora sia l’#Europa a farsi carico della crisi. Certo non va seguita la via più rapida e corta: quella di tornare indietro sulle #sanzioni.",19,0
2022-09-04 18:01:09+00:00,1566486539735105536,https://twitter.com/Maurizio_Lupi/status/1566486539735105536,"A pochi giorni dall’inizio delle scuole ci sono 200mila docenti in meno e si rischia l’orario ridotto nel #Lazio. Per #NoiModerati l’educazione è fondamentale: alla scuola vanno aumentati i fondi, non ridotti. Puntare davvero sui #giovani significa innanzitutto questo.",25,0
2022-09-04 14:37:22+00:00,1566435254520483844,https://twitter.com/Maurizio_Lupi/status/1566435254520483844,"La sinistra continua con la politica del “mostro” per tentare di delegittimare il centrodestra. #NoiModerati lo abbiamo ripetuto mille volte, e una di piu' non farà male: elezioni o no, noi saremo al fianco di Ucraina ed occidente senza se e senza ma.",30,0
2022-09-03 13:01:08+00:00,1566048650048028673,https://twitter.com/Maurizio_Lupi/status/1566048650048028673,"Per contrastare il #carovita servono dei #ristori in aiuto a famiglie e imprese e delle misure per sostenere il potere d’acquisto dei lavoratori, come la #detassazione degli aumenti di stipendio e dei premi. Le risorse potrebbero trovare tra i fondi stanziati per il #Rdc del 2023",28,0
2022-09-02 12:30:59+00:00,1565678675240095744,https://twitter.com/Maurizio_Lupi/status/1565678675240095744,"La priorità non è far votare i giovani a 16 anni ma cercare di dare loro la stessa opportunità che è stata data alla mia generazione: l’ascensore sociale. Basta con proposte spot, utili solo a cercare il loro voto. Parliamo di cose concrete, come l’abolizione degli stage gratuiti",37,0
2022-08-31 11:34:40+00:00,1564939727740059648,https://twitter.com/Maurizio_Lupi/status/1564939727740059648,"L'inflazione è arrivata all'8,5% e, come non succedeva da anni, sta erodendo gli stipendi. Ora è necessario detassare completamente gli aumenti retributivi dati dagli imprenditori nelle buste paga dei dipendenti, abbassare il cuneo fiscale e ridurre l'Iva sui prodotti alimentari.",28,0
2022-08-30 21:10:34+00:00,1564722267837300736,https://twitter.com/Maurizio_Lupi/status/1564722267837300736,"Mikhail Gorbaciov è ora nella storia della libertà dei popoli. La sua politica di trasparenza e cambiamento ha liberato dal comunismo centinaia di milioni di persone. Libero e coraggioso, fu capace di smantellare con Reagan la cortina di ferro. Il mondo libero gli deve molto.",42,0
2022-08-30 10:17:44+00:00,1564557977402720256,https://twitter.com/Maurizio_Lupi/status/1564557977402720256,"L’emergenza è e rimane quella del caro-bollette per l’emergenza gas. Serve subito un decreto simil Ristori, ma anche una strategia complessiva, come il rigassificatore di Piombino ( 4mld di metri cubi l’anno) e nuove estrazioni dai nostri giacimenti nell’Adriatico.
Basta con i no",20,0
2022-08-29 15:34:50+00:00,1564275390708957185,https://twitter.com/Maurizio_Lupi/status/1564275390708957185,"Nel centrodestra non prevale la cultura #novax, diversamente da ciò che il csx vuole far sembrare: altrimenti, non avremmo raggiunto il 92% di #coperturavaccinale.
Ricordiamo, inoltre, il grande lavoro svolto dal nostro @CostaAndrea70 e dalle #Regioni, molte amministrate dal cdx",23,0
2022-08-28 13:58:28+00:00,1563888750513606657,https://twitter.com/Maurizio_Lupi/status/1563888750513606657,"La politica dei no non serve a nessuno, dobbiamo tornare alle scelte fatte con competenza e serietà. L'energia era un tema che a nessuno interessava e ora tutti ne capiamo l’importanza: Nucleare, termovalorizzatori, estrazioni dall’Adriatico non possono più essere tabù ideologici",33,0
2022-08-28 11:07:41+00:00,1563845769702117378,https://twitter.com/Maurizio_Lupi/status/1563845769702117378,"In un momento in cui il costo delle #bollette è quadruplicato, urge un nuovo Dl ristori per affrontare il #carogas sostenendo imprese e famiglie. Questa crisi è al livello della prima ondata Covid: se l'#Ue non farà usare i fondi europei in aiuto, ricorriamo ad uno #scostamento",17,0
2022-08-27 10:16:49+00:00,1563470583765291010,https://twitter.com/Maurizio_Lupi/status/1563470583765291010,"Il #presidenzialismo non è un tabu, è ciò che i cittadini chiedono, come abbiamo visto durante l’ultima elezione per il Quirinale. Ovviamente bisognerà prevedere contrappesi adeguati, cercando la massima convergenza parlamentare possibile.",20,0
2022-08-26 09:26:59+00:00,1563095654427426821,https://twitter.com/Maurizio_Lupi/status/1563095654427426821,"Il gioco del PD che continua a spargere veleni sulla stampa internazionale con l’obiettivo di delegittimare il centrodestra, facendolo passare per una coalizione filoputiniana, non ha alcun effetto sul voto ma solo sulla credibilità dell’Italia. Possibile non se ne rendano conto?",74,0
2022-08-25 16:48:18+00:00,1562844326966992906,https://twitter.com/Maurizio_Lupi/status/1562844326966992906,"Servono subito misure per il #caroenergia a sostegno di #imprese e famiglie, come la dilazione dei pagamenti e un fondo per chi è in difficoltà. Ma occorre anche una strategia che renda l’Italia autosufficiente, attingendo a #rigassificatori, #rinnovabili e #nuclearegreen",22,0
2022-08-24 13:06:30+00:00,1562426121534074883,https://twitter.com/Maurizio_Lupi/status/1562426121534074883,"Draghi ci lascia un #metodo, non una agenda, mostrando cosa siano responsabilità e autorevolezza. Importante anche l’aver raccontato i risultati ottenuti durante il suo governo, come l’appello al voto e ai giovani, affinché si assumano le loro responsabilità per il futuro.",27,0
2022-08-23 16:15:26+00:00,1562111280076431362,https://twitter.com/Maurizio_Lupi/status/1562111280076431362,"La nostra posizione è chiara: a fianco dell’#Europa per difendere i principi della democrazia. Le #sanzioni alla #Russia devono essere mantenute fermamente, pur cercando sempre una soluzione diplomatica. Tuttavia, serve un piano di #aiuti affinché tali sanzioni siano sostenibili",32,0
2022-08-23 15:34:13+00:00,1562100908313526273,https://twitter.com/Maurizio_Lupi/status/1562100908313526273,"Una delle sfide più importanti riguarda il rapporto tra #scuola e lavoro. Da un lato dobbiamo permettere la #libertà di scelta educativa, dando anche maggiore dignità di salario agli insegnanti, dall'altro puntare sull'alleanza con le imprese per superare l'assistenzialismo.",22,0
2022-08-22 13:25:04+00:00,1561706016319967233,https://twitter.com/Maurizio_Lupi/status/1561706016319967233,"Scuola, natalità e lavoro. Questi i pilastri su cui #NoiModerati abbiamo costruito il programma di #centrodestra. Dal contrasto al caro vita agli aumenti salariali per gli #insegnanti sono molti i passi da fare. Basta #assistenzialismo, servono vere politiche attive del lavoro.",29,0
2022-08-20 09:45:46+00:00,1560926053580898307,https://twitter.com/Maurizio_Lupi/status/1560926053580898307,"Bollette alle stelle, aziende costrette a scaricare i costi sui clienti se non a cali di produzione, riduzione del gettito fiscale con effetto a catena sullo spread. Subito autonomia energetica, lavorando per un #pricecap europeo al gas. Magari virando verso il #nucleare sicuro.",31,0
2022-08-19 18:01:23+00:00,1560688391599030274,https://twitter.com/Maurizio_Lupi/status/1560688391599030274,La svastica tracciata con lo spray nero sulla lapide di Tina Anselmi è uno sfregio di cui gli autori si devono vergognare. Noi moderati ricordiamo con orgoglio la storia di una donna come lei e uniamo idealmente al cittadino che ha ripulito la lapide. Che non accada mai più.,28,0
2022-08-19 12:12:30+00:00,1560600594699718656,https://twitter.com/Maurizio_Lupi/status/1560600594699718656,"Buone notizie sul Corriere di oggi. 
Competenza e affidabilità pagano sempre, Noi Moderati.

#TorniamoAFarePolitica https://t.co/2a9MU8ZQo4",27,0
2022-08-18 10:24:11+00:00,1560210947951808512,https://twitter.com/Maurizio_Lupi/status/1560210947951808512,"Il Reddito di Cittadinanza ci è costato 32 miliardi in 4 anni senza dare grandi risultati. Noi proponiamo che, degli 8 mld già a bilancio per il 2023, 3 siano a disposizione di chi ha diritto di essere aiutato e gli altri 5 vadano alle imprese per creare vero e dignitoso lavoro.",56,0
2022-08-17 22:52:11+00:00,1560036799417917441,https://twitter.com/Maurizio_Lupi/status/1560036799417917441,Oggi è un giorno triste: la scomparsa di Niccolò Ghedini ci lascia sgomenti. Abbiamo condiviso un lungo percorso assieme e siamo profondamente colpiti e addolorati da questa notizia. Ci lascia una persona leale e di straordinaria intelligenza e preparazione. Ci mancherà.,43,0
2022-08-17 14:28:29+00:00,1559910040039038976,https://twitter.com/Maurizio_Lupi/status/1559910040039038976,L’inflazione sta erodendo troppo velocemente il potere d’acquisto di famiglie e lavoratori. Bisogna mettere un freno deciso a questa situazione aiutando le imprese a supportare i loro dipendenti: gli aumenti di stipendio vanno detassati.,26,0
2022-08-13 13:41:19+00:00,1558448617593208838,https://twitter.com/Maurizio_Lupi/status/1558448617593208838,"Piero Angela è stato l’esempio del miglior servizio pubblico, con lo sguardo rivolto sempre e solo all’interesse dei telespettatori. Con le sue parole semplici e con toni pacati ha portato la scienza e il sapere nelle case degli italiani. Sentiremo tutti la sua mancanza.",22,0
2022-08-13 09:12:18+00:00,1558380915797131268,https://twitter.com/Maurizio_Lupi/status/1558380915797131268,"#NoiModerati lavorerà per riagganciare gli stipendi degli insegnanti alla media europea, per ridurre le classi pollaio e per reintrodurre il medico scolastico. Rimettiamo la #scuola al centro. 
La valorizzazione dei giovani passa dalla qualità del sistema educativo.",32,0
2022-08-12 09:57:02+00:00,1558029784315199488,https://twitter.com/Maurizio_Lupi/status/1558029784315199488,"Con #NoiModerati abbiamo messo insieme figure credibili come Brugnaro, Toti e l’Udc per dimostrare che i moderati ci sono, il bene comune non è una parolaccia e che può ancora esistere la moralità del fare.Rafforzeremo la cultura di governo e della responsabilità del centrodestra",44,0
2022-08-11 15:13:16+00:00,1557746982030086144,https://twitter.com/Maurizio_Lupi/status/1557746982030086144,"Noi moderati sarà la lista unitaria del centro del centrodestra. Basta con le divisioni, basta con i protagonismi, da oggi si lavora tutti assieme per il Bene Comune senza dimenticare quello che siamo.
Facciamo diventare la diversità ricchezza.
#TorniamoAFarePolitica https://t.co/LIsnsm6zht",45,0
2022-08-11 08:13:29+00:00,1557641338686001152,https://twitter.com/Maurizio_Lupi/status/1557641338686001152,"Il sondaggio di Emg per Libero quota il centrodestra al 48% e la lista unica dei moderati già al 3,5%. I dati confermano la bontà della scelta di unire le forze per rafforzare l’area centrista della coalizione, che non porta solo consenso, ma soprattutto progetti e affidabilità. https://t.co/WVOKr5HeRB",28,0
2022-08-09 10:45:14+00:00,1556954753808175105,https://twitter.com/Maurizio_Lupi/status/1556954753808175105,"Chi ambisce a governare deve assumersi la responsabilità di essere affidabile. Per questo bocciamo il #terzopolo. Il compito di noi moderati è quello di dare forza al centrodestra, non di inseguire chimere. 

La mia intervista a il Giornale: https://t.co/IMk94pp0gK https://t.co/vCxYcIyLpQ",20,0
2022-08-08 13:08:22+00:00,1556628386230984706,https://twitter.com/Maurizio_Lupi/status/1556628386230984706,Ogni giorno la sinistra tenta di creare il “mostro” per unire forze incompatibili tra loro per programmi e idee. Una tesi talmente ridicola da non convincere neanche loro. Intanto il centrodestra lavora ad un progetto comune per governare e rilanciare l'Italia da qui al 2027.,22,0
2022-08-05 14:23:07+00:00,1555560031420129282,https://twitter.com/Maurizio_Lupi/status/1555560031420129282,"L’unione con Toti serve a dare più forza a quella proposta di buon governo del centrodestra moderato fatto di concretezza, competenza e responsabilità. Vogliamo aggregare chiunque si senta parte di questo metodo partendo dai programmi: scuola, famiglia, energia e infrastrutture. https://t.co/hHXVzqf9v3",27,0
2022-08-04 15:22:51+00:00,1555212679597494273,https://twitter.com/Maurizio_Lupi/status/1555212679597494273,"Mentre il centrosinistra mette insieme tutto e il contrario di tutto per provare a limitare i danni, noi del centrodestra prepariamo il programma comune per l’Italia del 2027. La buona politica è mettere al centro i bisogni concreti dei cittadini, non cercare il nemico di turno.",28,0
2022-08-03 08:54:50+00:00,1554752644346007552,https://twitter.com/Maurizio_Lupi/status/1554752644346007552,"Sabino Cassese dice: anziché distribuire soldi distribuiamo istruzione. Noi porteremo nella coalizione questo pilastro dimenticato: l’educazione, la formazione, la #scuola. Il centrodestra deve qualificarsi così: visione del futuro, proposte serie e risposte ai cittadini.",38,0
2022-08-02 13:28:37+00:00,1554459155280400390,https://twitter.com/Maurizio_Lupi/status/1554459155280400390,"Mentre lavoriamo al nostro programma, elaborando proposte su scuola, salute, energia, imprese e lavoro, la comunità di Noi con l'Italia continua a crescere.
Grazie per la vostra fiducia!! https://t.co/osnVp0eEGf",20,0
2022-08-01 11:42:15+00:00,1554069997785210881,https://twitter.com/Maurizio_Lupi/status/1554069997785210881,"L'unità del centrodestra non la costruiamo sulla designazione dei ministri ma sulla condivisione di idee e di proposte; queste devono essere concrete, serie e realizzabili. Noi con l'Italia da oggi darà questo suo contributo.",36,0
2022-07-31 10:28:30+00:00,1553689052003581954,https://twitter.com/Maurizio_Lupi/status/1553689052003581954,"Il segretario del Pd fa proposte elettorali finanziandosi con aumenti sulla tassa di successione. La solita #patrimoniale nascosta per dare poi soldi a pioggia senza progetti concreti. Piuttosto si abbatta il cuneo fiscale, creando occupazione per sostenere famiglie e imprese.",42,0
2022-07-30 18:47:09+00:00,1553452151011147782,https://twitter.com/Maurizio_Lupi/status/1553452151011147782,Le violenze e i disordini in corso in Val di Susa ad opera dei NoTav sono inqualificabili. Da condannare senza appello. Il dissenso è il sale della democrazia ma la violenza non può impedire la realizzazione di opere strategiche per il Paese. La mia solidarietà agli agenti feriti,32,0
2022-07-30 10:57:22+00:00,1553333929452658689,https://twitter.com/Maurizio_Lupi/status/1553333929452658689,"Noi con l’Italia non scriverà un libro dei sogni ma un programma concreto che avrà tutte le coperture. Scuola, energia, imprese, lavoro e sanità lavoro saranno le nostre priorità. Siamo i #moderati del centrodestra seri e responsabili e vogliamo governare bene questo Paese.",18,0
2022-07-28 17:12:45+00:00,1552703620327653379,https://twitter.com/Maurizio_Lupi/status/1552703620327653379,"Siamo saldamente ancorati all’Occidente e alla Nato. Qualsiasi tentativo di coinvolgere il Centrodestra in sterili polemiche è assolutamente pretestuoso. Nessuno nel nostro campo mette in discussione questa linea, ma non sono sicuro che sia così anche a sinistra o nel M5S…",23,0
2022-07-27 12:45:41+00:00,1552274020900405249,https://twitter.com/Maurizio_Lupi/status/1552274020900405249,"La sinistra non fa proposte e tenta solo di delegittimare la coalizione. Noi con l'Italia lavora all'unità del
centrodestra, per rafforzare l’area moderata.Daremo il nostro contributo di valori e di idee concrete per dare voce a chi vuol sentire parlare di temi e non di polemiche https://t.co/O16DIVIpb6",33,0
2022-07-26 11:07:22+00:00,1551886892244803584,https://twitter.com/Maurizio_Lupi/status/1551886892244803584,"Il centrodestra è da sempre una coalizione unita e compatta e le regole ci sono da 30 anni: il leader della coalizione lo decideranno gli elettori alle prossime elezioni. Le liti lasciamole alla sinistra, parliamo di temi e soluzioni per i tanti problemi che hanno le persone.",35,0
2022-07-25 10:46:04+00:00,1551519143287037961,https://twitter.com/Maurizio_Lupi/status/1551519143287037961,"Ci candiamo a guidare il Paese e per farlo abbiamo bisogno di mettere al centro i temi, non i politici: aumento dei salari grazie a riduzione del cuneo fiscale, basta assistenzialismo, più educazione e formazione e una vera transizione ecologica con rinnovabili e nucleare green",38,0
2022-07-23 14:51:16+00:00,1550856073384427520,https://twitter.com/Maurizio_Lupi/status/1550856073384427520,"Auguri al Presidente della Repubblica Sergio Mattarella che, anche in questi giorni, ha mostrato di essere un vero garante della Costituzione. Il rappresentante istituzionale migliore che potessimo avere in quel difficile ruolo.",18,0
2022-07-22 18:19:36+00:00,1550546117733261312,https://twitter.com/Maurizio_Lupi/status/1550546117733261312,"Il M5S ha aperto la crisi di governo per un cinico tornaconto personale, dimostrando irresponsabilità e incapacità politica. La verifica era necessaria, il voto l’unico esito possibile. Aperto il vaso di Pandora i mali non poterono che uscire tutti.

https://t.co/AVv1nrmxd3",11,0
2022-07-19 12:49:59+00:00,1549376003058896897,https://twitter.com/Maurizio_Lupi/status/1549376003058896897,Per onorare al meglio la memoria di #Borsellino e della sua scorta continuiamo ad impegnarci ogni giorno concretamente nella lotta alla criminalità organizzata. La mafia c'è e l'attenzione deve essere costante.,15,0
2022-07-14 19:02:11+00:00,1547657729111601153,https://twitter.com/Maurizio_Lupi/status/1547657729111601153,Per il proprio interesse Conte ha aperto una crisi politica e offerto l'Italia alla speculazione internazionale. Siamo ad un bivio: o il governo va avanti con la stessa maggioranza o meglio il voto per dare al Paese un governo stabile. Ciascuno si assuma le proprie responsabilità,22,0
2022-07-14 12:41:27+00:00,1547561913520861185,https://twitter.com/Maurizio_Lupi/status/1547561913520861185,"Se viene meno l’unità nazionale, per il cinismo di chi vuole lucrare nel consenso facile, non ha senso andare avanti ed è impensabile un Draghi bis. Il governo è nato con un mandato preciso e impegnativo, ma per portarlo avanti ci vuole serietà. Cosa che Conte non sembra avere.",21,0
2022-07-13 16:06:53+00:00,1547251225665601543,https://twitter.com/Maurizio_Lupi/status/1547251225665601543,"Far cadere il governo in questo momento è un’operazione cinica da irresponsabili. Se Conte toglierà la fiducia al Governo deve sapere che dopo ci sarà solo il voto e che interromperà un lavoro fondamentale per contenere la pesante crisi economica.
Un #DraghiBis non esiste.",23,0
2022-07-11 16:52:56+00:00,1546538039769546753,https://twitter.com/Maurizio_Lupi/status/1546538039769546753,"Ciò che è accaduto oggi ad opera del #M5S è un atto di irresponsabilità assoluta difficile da comprendere in termini razionali. Non possiamo andare avanti così. Ora serve un patto di fine legislatura tra tutte le forze politiche per realizzare le cose fondamentali. 
Poi al voto.",21,0
2022-07-06 16:51:59+00:00,1544725858908241923,https://twitter.com/Maurizio_Lupi/status/1544725858908241923,"Le fibrillazioni cui il già avvocato del popolo Giuseppe #Conte, oggi Cavalier Tentenna, sta sottoponendo l'esecutivo sono da irresponsabili. Se ritiene di non voler far parte di un governo che sta tirando fuori l'Italia dalle secche, si decida e la smetta di danneggiare il Paese",21,0
2022-07-05 16:40:26+00:00,1544360566659112964,https://twitter.com/Maurizio_Lupi/status/1544360566659112964,"Domani alla Camera si vota la mozione di Noi con l’Italia per riprendere subito il percorso sul #NucleareGreen, l'unico vero modo per chiudere, in mix con le rinnovabili, l'era dei combustibili fossili. Se si vuole veramente un'energia pulita basta con l'ambientalismo ideologico.",90,0
2022-07-05 07:10:43+00:00,1544217193507966979,https://twitter.com/Maurizio_Lupi/status/1544217193507966979,Noi con l'Italia non voterà mai una norma sulla liberalizzazione della #cannabis. E sappiamo che in questa battaglia siamo in ottima e ampia compagnia.,52,0
2022-06-30 09:16:41+00:00,1542436955253661696,https://twitter.com/Maurizio_Lupi/status/1542436955253661696,"Il tema del #nucleare è strategico per l’Italia. Dopo due mesi di rinvii ora il Parlamento decida sulla nostra mozione pro-nucleare come fonte energetica pulita. Se non venisse votata, siamo pronti a raccogliere le firme per un nuovo #referendum. Il quesito è pronto.",37,0
2022-06-28 08:08:12+00:00,1541694945186152448,https://twitter.com/Maurizio_Lupi/status/1541694945186152448,"La competizione all'interno del #centrodestra ci fa male, il confronto è con il centrosinistra, non tra di noi. Dobbiamo ripartire dando valore a concetti come concretezza, credibilità, ideali, buon governo. Basta con le divisioni, dimostriamo di poter governare il Paese. https://t.co/eYU2PQoGIr",10,0
2022-06-27 08:00:10+00:00,1541330533598257152,https://twitter.com/Maurizio_Lupi/status/1541330533598257152,"Nel #centrodestra dobbiamo riflettere su queste amministrative: astensionismo, divisioni, incapacità di scegliere ancora una volta i candidati migliori. Urge una riflessione condivisa per preparare al meglio il prossimo governo del Paese. Non solo un incontro tra FI, Lega e FdI.",59,0
2022-06-24 13:39:24+00:00,1540328742026973185,https://twitter.com/Maurizio_Lupi/status/1540328742026973185,La politica deve ritornare a declinare le diversità tra schieramenti. Per questo è fondamentale che iniziamo tutti ad assumerci delle responsabilità attraverso proposte politiche che ci identifichino nel campo in cui siamo. Noi siamo la parte moderata del #centrodestra.,12,0
2022-06-22 10:33:21+00:00,1539557146211274754,https://twitter.com/Maurizio_Lupi/status/1539557146211274754,"@noiconlitalia_ non ha dubbi da che parte stare: aiutare l’#Ucraina vuol dire aiutarla a esistere in modo che non si possa mai quello che si diceva degli antichi Romani: “Desertum fecerunt et pacem appellaverunt”, come i la devastazione russa, purtroppo, non fa ben sperare. https://t.co/xGc0tG5Amc",2,0
