Date,ID,URL,Content,Likes,Retweets
2022-06-18 17:26:58+00:00,1538211681100251139,https://twitter.com/Maurizio_Lupi/status/1538211681100251139,"Il populismo di #Conte è pericoloso, ci fa arretrare rispetto alle decisioni prese con i nostri partner e ne rompe l’unità di intenti, fondamentale in politica estera in momenti come questo. Se ha deciso di uscire dalla maggioranza lo dica subito e se ne prenda la responsabilità",29,0
2022-06-16 12:51:44+00:00,1537417640716664836,https://twitter.com/Maurizio_Lupi/status/1537417640716664836,"Roma è una capitale europea, non può continuare di fatto a non gestire i rifiuti. L’incendio di #Malagrotta produrrà una nuova emergenza che i cittadini non possono più tollerare. Basta opposizioni ideologiche al #termovalorizzatore.",15,0
2022-06-15 10:45:10+00:00,1537023403462385664,https://twitter.com/Maurizio_Lupi/status/1537023403462385664,Sulla riforma #Cartabia va fatto in fretta e bene ma soprattutto nessuno pensi di mettere in difficoltà il Governo dopo le amministrative. I cittadini ci hanno detto che il problema giustizia deve essere risolto e questo va fatto in Parlamento. Assumiamocene la responsabilità.,11,0
2022-06-10 10:34:19+00:00,1535208732115849218,https://twitter.com/Maurizio_Lupi/status/1535208732115849218,"#NoiConlItalia lavora per ridare un baricentro moderato al #centrodestra fatto di proposte, ideali e programmi all'altezza dei cambiamenti degli ultimi 3 anni. Non è che mettendo insieme tanti piccoli De Gasperi si fa la DC. 
L’intervista al @Corriere : https://t.co/mPHuuleFl7 https://t.co/rsYreBYGQu",6,0
2022-06-09 13:34:08+00:00,1534891598005383173,https://twitter.com/Maurizio_Lupi/status/1534891598005383173,"È quasi impossibile farsi trovare pronti per il 2035, ultimo anno in cui saranno in vendita auto a benzina e diesel. La transizione nel settore dell’#automotive deve esserci, ma deve avvenire in maniera più graduale, non mettendo a rischio migliaia di posti di lavoro.",14,0
2022-06-07 13:17:06+00:00,1534162536387452928,https://twitter.com/Maurizio_Lupi/status/1534162536387452928,"Basta con l'idea che il #salario lo si da per legge o che l'assistenzialismo aiuti le persone. Se adottassimo la proposta dall'UE, tanti operai e lavoratori in Italia guadagnerebbero molto meno. La strada da seguire con coraggio è diminuire il costo del lavoro per alzare i salari",25,0
2022-06-07 09:49:12+00:00,1534110217037815808,https://twitter.com/Maurizio_Lupi/status/1534110217037815808,"In diretta da Napoli, per la nostra conferenza programmatica “CAPITALE MEZZOGIORNO: l’Italia del Sud, risorsa fra Europa e Mediterraneo”
🎥: https://t.co/xPYNI6qI88 https://t.co/v9MUPwcoDV",8,0
2022-06-05 18:34:21+00:00,1533517597479682048,https://twitter.com/Maurizio_Lupi/status/1533517597479682048,"Resto sgomento di fronte all'esecuzione sommaria di fedeli cristiani in #Nigeria, colpevoli solo di assistere a una funzione religiosa. Il governo e il Ministro degli Esteri intervengano per porre fine a queste stragi che continuano nel silenzio e nell'indifferenza da troppi anni",17,0
2022-05-31 15:58:20+00:00,1531666397809582080,https://twitter.com/Maurizio_Lupi/status/1531666397809582080,"La vera lotta alla povertà si fa con buona occupazione, degni salari, più potere d'acquisto alle famiglie e sostegno alle imprese, non col #RedditoDiCittadinanza, ormai un moloch che crea più problemi sociali di quanti ne risolva. La dignità è il #lavoro, non l'assistenzialismo.",23,0
2022-05-26 17:56:56+00:00,1529884304989466626,https://twitter.com/Maurizio_Lupi/status/1529884304989466626,"Mario Draghi si conferma un leader di statura internazionale. Ora è opportuno, anche nell’interesse nazionale, che il suo lavoro di mediazione sia sostenuto da tutte le forze politiche, mettendo fine a polemiche che danneggiano solo il nostro Paese.",12,0
2022-05-26 08:02:37+00:00,1529734738335997954,https://twitter.com/Maurizio_Lupi/status/1529734738335997954,"Con De Mita, politico fin nel midollo, si discuteva fino allo scontro, ma riconosceva gli interlocutori che la pensavano diversamente. Invitò Giussani all’assemblea DC e credo che quello che disse (la politica è la forma più alta di cultura) valga per qualificare il suo impegno.",11,0
2022-05-25 16:33:11+00:00,1529500838649073671,https://twitter.com/Maurizio_Lupi/status/1529500838649073671,A #Palermo oltre 500 persone alla presentazione della lista di Noi con l’Italia. Passo dopo passo…#TorniamoAFarePolitica https://t.co/OAVni03zYp,7,0
2022-05-25 14:16:53+00:00,1529466537031114755,https://twitter.com/Maurizio_Lupi/status/1529466537031114755,Giù le mani dal #5X1000! Uno strumento efficace se usato per lo scopo per cui è nato. Uno Stato serio non finanzia esercito e polizia con la generosità dei cittadini che hanno finora scelto di destinare le loro risorse alla sussidiarietà e al #noprofit.,15,0
2022-05-24 13:34:53+00:00,1529093581503352833,https://twitter.com/Maurizio_Lupi/status/1529093581503352833,"Auguri di buon lavoro al card. Zuppi, nuovo presidente dei vescovi italiani. Lo aspetta una grande responsabilità, ma non è uomo che si tiri indietro di fronte alle sfide, come ha già dimostrato nel suo ministero episcopale. Non potrà che fare bene al servizio della Chiesa. https://t.co/UJhMhioqTL",6,0
2022-05-23 17:14:13+00:00,1528786389000650752,https://twitter.com/Maurizio_Lupi/status/1528786389000650752,"Il PNRR è un’occasione storica per ridare slancio a famiglie, imprese e per far crescere strategicamente il nostro Paese.Per questo il Presidente Draghi è così attento al rispetto di ogni scadenza. È il momento della responsabilità,non delle fughe in avanti, per il bene del Paese",12,0
2022-05-23 14:42:27+00:00,1528748195928543233,https://twitter.com/Maurizio_Lupi/status/1528748195928543233,"Vogliamo ridare voglia di fare politica ai tanti moderati e liberali che si sono allontanati dal voto ma che ora hanno un nuovo desiderio di impegnarsi, partendo da tutte le città che andranno a rinnovare il sindaco. La mia intervista a l'Arena. #Sboarina
https://t.co/K8Sq7c76kd",7,0
2022-05-23 13:19:12+00:00,1528727245220626432,https://twitter.com/Maurizio_Lupi/status/1528727245220626432,"La strage di Capaci ha segnato la svolta nella lotta alla mafia. Da allora chiunque faccia politica non può scordare il martirio di #Falcone, di sua moglie e della sua scorta. Grazie al loro sacrificio siamo tutti consapevoli dell’importanza di questa battaglia. Mai dimenticare.",4,0
2022-05-20 12:33:09+00:00,1527628493814738945,https://twitter.com/Maurizio_Lupi/status/1527628493814738945,"Passo dopo passo, giorno dopo giorno la nostra comunità cresce!
Merito, competenza, valori. 
Questo è Noi con l’Italia.

#TorniamoAFarePolitica https://t.co/HZwnDdfcrk",3,0
2022-05-12 16:50:51+00:00,1524794242744344576,https://twitter.com/Maurizio_Lupi/status/1524794242744344576,"Conte è stato presidente del Consiglio e sa bene quali sono le relative responsabilità. La smetta di abbaiare alla luna solo per conquistarsi una manciata di voti. #Draghi negli USA ha riaffermato la centralità l'autorevolezza dell'Italia. 
Dividerci su questo è da irresponsabili",27,0
2022-05-11 10:49:45+00:00,1524340979532242947,https://twitter.com/Maurizio_Lupi/status/1524340979532242947,"Con l'incontro tra Draghi e Biden abbiamo riacquistato una posizione internazionale autorevole. Ora si deve continuare a perseguire con determinazione una linea atlantista ed europeista, convintamente a sostegno della resistenza del popolo ucraino, in modo da giungere alla tregua",43,0
2022-05-10 15:55:55+00:00,1524055644726304768,https://twitter.com/Maurizio_Lupi/status/1524055644726304768,"È paradossale che proprio i paladini della democrazia diretta, i grillini eletti sulla base di questo progetto, siano oggi contrari all'elezione del Capo dello Stato da parte dei cittadini, appellandosi a quel parlamentarismo che dicevano di voler superare. Evviva la coerenza.",15,0
2022-05-10 12:38:01+00:00,1524005841359503360,https://twitter.com/Maurizio_Lupi/status/1524005841359503360,"L’UE deve lavorare con fermezza per la pace, senza demonizzare Putin ma isolandolo e facendogli capire che questa guerra fa male a tutti, anche al popolo russo. Non possiamo dividerci sugli aiuti all’Ucraina, uniche alternative alla guerra: diplomazia, invio delle armi e sanzioni",12,0
2022-05-09 12:44:18+00:00,1523645031281983489,https://twitter.com/Maurizio_Lupi/status/1523645031281983489,"Oggi più che mai, dopo il discorso di #Putin, l’UE deve tornare ad avere un proprio protagonismo diplomatico. È evidente che per dialogare occorre essere sempre in due, ma lo è anche che per creare la pace occorre un terzo che faccia da mediatore. Questo ruolo spetta a noi.",14,0
2022-05-08 10:40:37+00:00,1523251518002327555,https://twitter.com/Maurizio_Lupi/status/1523251518002327555,"La ricomparsa del simbolo delle #BrigateRosse nella sede di una testata giornalistica è un segnale che ci riporta a tempi bui che non devono ritornare. Mi auguro che sia stato solo uno scherzo di cattivo gusto e non una minaccia.
Solidarietà al #Tg2 e al direttore #Sangiuliano.",11,0
2022-05-06 10:24:49+00:00,1522522765923962881,https://twitter.com/Maurizio_Lupi/status/1522522765923962881,"L'estensione del bonus di 200 euro ai percettori del reddito di cittadinanza è un'ingiustizia.
I bonus devono andare ai settori produttivi, alle imprese, ai lavoratori e alle famiglie in una situazione di sofferenza. L'ultra-assistenzialismo non fa bene a nessuno.",59,0
2022-05-05 15:56:41+00:00,1522243895085707267,https://twitter.com/Maurizio_Lupi/status/1522243895085707267,"Ogni giorno Conte accusa qualcuno, ma non dice chi, di volerlo estromettere dal Governo. In realtà, da mesi, sembra all’opposizione. Dai termovalorizzatori al sostegno all'Ucraina, non c’è una sola occasione in cui non si sia espresso contro la linea stabilità. Vi pare serio?",25,0
2022-05-05 09:53:11+00:00,1522152416782827521,https://twitter.com/Maurizio_Lupi/status/1522152416782827521,"Legittimando le #OccupazioniAbusive non garantiamo chi ne ha più bisogno ma solo chi urla di più o chi sfrutta un dramma sociale anche per motivi politici. Quando si occupa un alloggio si toglie la casa a chi la attende da anni,ricordiamocelo.#IlMessaggero
https://t.co/IBOlWtCFcF https://t.co/G8vuxpWdcp",7,0
2022-05-03 15:05:28+00:00,1521506232691011584,https://twitter.com/Maurizio_Lupi/status/1521506232691011584,"Sul superbonus Draghi ha ragione non al 100, ma al 110 per cento. Non c’è più nessuno che tratti sui prezzi o chieda preventivi. Il bonus è una sorta di piè di lista rimborsato da tutti noi, compresi i più poveri, che stanno pagando la ristrutturazione di appartamenti e villette.",22,0
2022-05-03 12:51:27+00:00,1521472504874864640,https://twitter.com/Maurizio_Lupi/status/1521472504874864640,"Il governo ha accolto spirito e sostanza della nostra richiesta portando il prelievo sugli extraprofitti al 25% ed estendendo il bonus contro il caro vita a tutti fino a 35 mila euro di reddito andando incontro concretamente ai bisogni delle #famiglie.Bene!
#TorniamoAFarePolitica https://t.co/FJCpsJFnZT",5,0
2022-05-02 17:46:51+00:00,1521184458543616002,https://twitter.com/Maurizio_Lupi/status/1521184458543616002,"Molti stanno confondendo i ruoli e i principi che reggono la nostra democrazia: si condannino senza riserve le fake news del ministro #Lavrov, ma certamente non #Rete4, che ha fatto solo ed esclusivamente giornalismo, anche confutando le parole del ministro russo.",19,0
2022-04-28 13:01:20+00:00,1519663054488850433,https://twitter.com/Maurizio_Lupi/status/1519663054488850433,"Per sviluppare benessere sociale dobbiamo aiutare le imprese abbassando le #tasse sul lavoro. Questo sarà l’unico modo per alzare i #salari dei lavoratori, atto fondamentale e giusto in questo momento storico. Spero che anche il ministro Orlando ne prenda atto.",12,0
2022-04-26 16:38:38+00:00,1518992964097347584,https://twitter.com/Maurizio_Lupi/status/1518992964097347584,"@noiconlitalia ha votato convintamente a favore della riforma della #giustizia. Si poteva fare di più, ma la politica è l'arte del possibile, non la pura testimonianza di posizioni indisponibili. E soprattutto erano 80 anni che attendevamo una riforma.",0,0
2022-04-26 10:32:49+00:00,1518900900307296258,https://twitter.com/Maurizio_Lupi/status/1518900900307296258,"Uno dei problemi del #centrodestra di questi anni è stata la continua battaglia interna per la leadership. Per guidare il Paese ci serve una diversa assunzione di responsabilità, altrimenti ci condanneremo all'opposizione. La mia intervista a il Dubbio: https://t.co/15lsUWgyjb",5,0
2022-04-25 08:21:46+00:00,1518505532952301568,https://twitter.com/Maurizio_Lupi/status/1518505532952301568,"Oggi è difficile immaginare quanto un popolo possa soffrire con una guerra nel proprio Paese. Scegliere una data per ricordarne la Liberazione ne è la prova più convincente. Il #25aprile ricorda questo. Facciamone tutti memoria, insieme. Buona Festa della Liberazione a tutti!",12,0
2022-04-20 09:11:22+00:00,1516706076053458944,https://twitter.com/Maurizio_Lupi/status/1516706076053458944,"Carenza di materie prime, crisi energetica, inflazione galoppante e una coesione sociale che rischia di sfaldarsi. Dopo 2 anni di guerra al virus la politica non può lasciare famiglie e imprese da sole. Facciamo qualcosa di concreto, come alzare la soglia ISEE a 30k.

#DEF https://t.co/llZm1y8qqv",5,0
2022-04-17 08:49:53+00:00,1515613505080152064,https://twitter.com/Maurizio_Lupi/status/1515613505080152064,In Ucraina continuano a scorrere fiumi di sangue mentre in Italia viviamo una grave crisi economica e sociale e mai come oggi abbiamo il bisogno di interrogarci sul valore che ha la #Pasqua nella nostra esperienza. Il mio migliore augurio affinché tutti noi potremo rinascere.,15,0
2022-04-13 15:02:40+00:00,1514257767669903371,https://twitter.com/Maurizio_Lupi/status/1514257767669903371,"Le preoccupazioni del #centrodestra sono state recepite dal premier Draghi, che peraltro ha ribadito quello che da sempre è la linea del suo governo e cioè mai nessun aumento della pressione fiscale, che anzi è già troppo alta. Credo che si faranno dei buoni passi in avanti. https://t.co/6QwnEYQW8l",8,0
2022-04-11 11:46:48+00:00,1513483704512954370,https://twitter.com/Maurizio_Lupi/status/1513483704512954370,"Tentare un paragone tra il voto francese e la situazione italiana, cercando strumentalmente di comparare alcune aree del centrodestra a Marie Le Pen è profondamente errato, dal punto di vista culturale, storico, economico, sociale e politico. Il #centrodestra è cosa ben diversa.",14,0
2022-04-08 13:49:01+00:00,1512427296317227022,https://twitter.com/Maurizio_Lupi/status/1512427296317227022,"Esprimo la mia solidarietà e il mio sostegno all'amico @CostaAndrea70 per le minacce indegne subite sui social. Intimidazioni vergognose per chi, come lui, ci rappresenta con competenza e onestà occupandosi di sanità durante una pandemia.",21,0
2022-03-29 16:53:25+00:00,1508849823612555273,https://twitter.com/Maurizio_Lupi/status/1508849823612555273,Se i professori no vax non possono insegnare perché tornano a scuola?,19,0
2022-03-25 11:54:04+00:00,1507324935873732614,https://twitter.com/Maurizio_Lupi/status/1507324935873732614,"L’Ambasciatore russo è in Italia da tempo e dovrebbe aver capito che nel nostro Paese la stampa è libera, autonoma e indipendente. Razov sappia che qui, per i giornalisti liberi, una querela dal regime di Mosca è una medaglia da appuntare sul petto.",7,0
2022-03-25 11:54:03+00:00,1507324933990490115,https://twitter.com/Maurizio_Lupi/status/1507324933990490115,"Dopo le intimidazioni ai parlamentari con una lettera del Ministro Lavrov e le minacce al nostro ministro della Difesa ora la Russia denuncia @LaStampa solo perché fa bene il suo mestiere, riportando quanto accade nei teatri di guerra.",6,0
2022-03-24 18:50:58+00:00,1507067467411116035,https://twitter.com/Maurizio_Lupi/status/1507067467411116035,La prossima settimana @noiconlitalia_ porterà al presidente Draghi le proprie idee. La prima proposta che faremo sarà portare il contributo di solidarietà sugli extraprofitti dal 10% al 20% per le aziende energetiche e che si passi dal 10% al 5% di IVA sugli alimenti primari.,7,0
2022-03-24 17:51:56+00:00,1507052608883724297,https://twitter.com/Maurizio_Lupi/status/1507052608883724297,"Bisogna riscoprire le ragioni della diversità all'interno del centrodestra perché le differenze possono essere una ricchezza. Davanti abbiamo delle sfide importanti, non solo le prossime amministrative e non è pensabile che i leader non si incontrino in momenti come questo.",4,0
2022-03-24 17:51:55+00:00,1507052607247949824,https://twitter.com/Maurizio_Lupi/status/1507052607247949824,"Essere moderati nel centrodestra non vuol dire essere moderatamente di centrodestra. Essere moderati nel centrodestra vuol dire lavorare quotidianamente per far riscoprire le ragioni della nostra identità, dei nostri valori e delle diversità all'interno della coalizione.",9,0
2022-03-24 17:01:16+00:00,1507039859411718158,https://twitter.com/Maurizio_Lupi/status/1507039859411718158,"Dobbiamo recuperare le ragioni di un'unità del #centrodestra. Dopo le elezioni del Capo dello Stato ci siamo sciolti come neve al sole, ha detto Salvini. Allora recuperiamo le nostre ragioni, parliamo di temi concreti: discutiamo di fisco, di energia, di tasse. @noiconlitalia_",5,0
2022-03-23 17:04:11+00:00,1506678206195240971,https://twitter.com/Maurizio_Lupi/status/1506678206195240971,"Aiuti all'#Ucraina e sostegno all'economia reale, questo è il nostro contributo concreto per la pace. @noiconlitalia_  propone il raddoppio della tassa sull'extraprofitto (fino a 8 MLD), di aprire al #NucleareGreen e di innalzare la soglia ISEE a 30k euro per accedere ai sostegni",3,0
2022-03-19 14:23:16+00:00,1505188156617994246,https://twitter.com/Maurizio_Lupi/status/1505188156617994246,"Il ministro @guerini_lorenzo, persona equilibrata e di buon senso, si sta adoperando per la pace in #Ucraina nel rispetto dei valori di libertà e democrazia e del diritto internazionale. Gli attacchi da lui subiti sono da respingere con sdegno. A lui la nostra solidarietà.",16,0
2022-03-18 12:21:51+00:00,1504795216271843335,https://twitter.com/Maurizio_Lupi/status/1504795216271843335,"Oggi si fanno tanti convegni sulle #periferie, sul disagio sociale, ma poi cosa si fa concretamente? Che opinione potrà mai avere dello Stato un ragazzo che cresce in territori abbandonati a se stessi? Abbiamo posto queste domande al Ministro dell'Interno:
https://t.co/g1BplgdzPh",4,0
2022-03-16 15:57:32+00:00,1504124716826697728,https://twitter.com/Maurizio_Lupi/status/1504124716826697728,"In Italia dobbiamo iniziare a ragionare strategicamente, smettendola di farci del male da soli: nel breve termine sarà utile diminuire le accise su benzina e gasolio e introdurre il price cap a livello europeo, ma sul lungo periodo abbiamo un unico tabù da sfatare: il #nucleare",14,0
2022-03-15 14:56:10+00:00,1503746886427152391,https://twitter.com/Maurizio_Lupi/status/1503746886427152391,"È assolutamente necessario intervenire per abbassare i prezzi dell'energia, delle materie prime e per differenziare gli approvvigionamenti. Ma quel che ci serve ancor di più è un piano energetico nazionale coraggioso, basato sul #nucleare di nuova generazione e sulle rinnovabili.",13,0
2022-03-10 15:30:28+00:00,1501943577831563267,https://twitter.com/Maurizio_Lupi/status/1501943577831563267,"Solidarietà, assistenza, più fondi alla ricerca per le terapie del dolore e delle cure palliative. In questo modo dovremmo trattare la morte e la sofferenza, non alimentando la cultura dello scarto. Il #FineVita, comunque procurato, non è mai un valore. È sempre una sconfitta.",24,0
2022-03-03 20:51:47+00:00,1499487725514285060,https://twitter.com/Maurizio_Lupi/status/1499487725514285060,"Se si vuole aprire una crisi di governo lo si dichiari senza paventare aumenti di tasse sui quali non sarei per primo d'accordo. Soprattutto non su un testo approvato in cdm. L'aggiornamento catastale è un atto tecnico necessario, a vantaggio delle persone, che sana ingiustizie.",1188,0
2022-03-02 17:38:18+00:00,1499076643654184967,https://twitter.com/Maurizio_Lupi/status/1499076643654184967,"Da parlamentari ci siamo assunti la responsabilità di schierare l’Italia in soccorso dell’aggredito. Da esseri umani l’arma che abbiamo è mobilitare le coscienze contro l’indifferenza. Oggi alla Camera 280 parlamentari in preghiera per la pace con Mons. Parra.
#UkraineRussianWar https://t.co/6vcoLNrDBg",15,0
2022-03-01 17:53:10+00:00,1498717998051475457,https://twitter.com/Maurizio_Lupi/status/1498717998051475457,"Siamo per la pace, per questo di fronte a una aggressione scegliamo di aiutare l'aggredito a difendersi. Siamo per il dialogo, dalla parte di chi costruisce un mondo più giusto e umano. Oggi italiani ed europei hanno il dovere di non voltarsi dall'altra parte  
#UkraineRussiaWar",22,0
2022-02-25 13:03:19+00:00,1497195504475721728,https://twitter.com/Maurizio_Lupi/status/1497195504475721728,"La risposta alla guerra di #Putin dovrà essere forte, senza ambiguità alcuna e di grande coraggio, o non avrà risultati. Le sanzioni sono l’alternativa alla reazione militare, ma dovranno arrivare immediatamente, colpendo con grande profondità. In gioco c’è il futuro della storia",13,0
2022-02-24 09:25:40+00:00,1496778342170779650,https://twitter.com/Maurizio_Lupi/status/1496778342170779650,"Svegliarsi e vedere le immagine della guerra nel cuore dell’Europa è un colpo al cuore e alla nostra responsabilità. Serve unità, coesione, fermezza senza ambiguità da parte di Europa e NATO, senza però mai spegnere l’arma della diplomazia. L’Occidente non abbandoni l'Ucraina. https://t.co/98nK7IT3zl",28,0
2022-02-23 16:52:13+00:00,1496528332866924545,https://twitter.com/Maurizio_Lupi/status/1496528332866924545,"La #TransizioneEcologica è, appunto, una transizione. Quindi deve essere sostenibile e graduale.

Il mio intervento in aula:
https://t.co/QWCoxCXs8S",4,0
2022-02-22 15:52:24+00:00,1496150894106316800,https://twitter.com/Maurizio_Lupi/status/1496150894106316800,"Le sfide strategiche (PNRR) che abbiamo di fronte non possono essere affrontate con tentennamenti e indecisioni nella maggioranza. Abbiamo chiesto a Mario Draghi di restare, a Palazzo Chigi, sosteniamolo. Se serve, potenziamo il coordinamento all'interno della maggioranza.",8,0
2022-02-18 14:08:22+00:00,1494675159143309317,https://twitter.com/Maurizio_Lupi/status/1494675159143309317,"Il dibattito sul #FineVita non può essere uno scontro tra tifoserie. Come legislatore voglio confrontarmi con il metodo dell'ascolto delle ragioni dell'altro. Parliamo di sofferenza, vita, morte (esiste come diritto?) che riguardano persone da guardare con carità e misericordia.",7,0
2022-02-15 15:25:37+00:00,1493607437886267399,https://twitter.com/Maurizio_Lupi/status/1493607437886267399,"Ricordo che pochi giorni fa il Parlamento ha applaudito 55 volte quando #Mattarella ha parlato di riforma urgente della #Giustizia. @noiconlitalia_, assieme alla Lega e ai Radicali, ha raccolto le firme per il referendum. Cosa vuole fare la politica? Rimandare ancora la riforma?",13,0
2022-02-08 10:56:26+00:00,1491002980207927298,https://twitter.com/Maurizio_Lupi/status/1491002980207927298,"Noi con l’Italia lavora per ricompattare l’area di #centrodestra, che ha bisogno ritrovarsi su progetti e proposte condivise e concrete, rafforzando l’area che si ispira ai valori del Ppe. Dobbiamo ripartire dalle associazioni, dai corpi intermedi, dalla società. Non dal palazzo.",19,0
2022-02-07 13:06:18+00:00,1490673273587355649,https://twitter.com/Maurizio_Lupi/status/1490673273587355649,"Il centrodestra riparta dal dialogo con la società e non da accordi di Palazzo.

La mia intervista per Il Giornale: https://t.co/alFLmOvdln",6,0
2022-02-03 15:57:27+00:00,1489266794665844736,https://twitter.com/Maurizio_Lupi/status/1489266794665844736,"Il discorso del presidente della Repubblica Sergio #Mattarella è un esempio di rigore costituzionale, dedizione alle istituzioni, responsabilità civile e sensibilità sociale. Belli i richiami al Parlamento, al ruolo dei partiti e ai corpi intermedi. Un faro per la nostra Italia.",12,0
2022-02-02 11:23:10+00:00,1488835380753354753,https://twitter.com/Maurizio_Lupi/status/1488835380753354753,"Siamo nipoti del proporzionale, ma figli del maggioritario e il criterio che ci guida deve essere la governabilità. Stiamo attenti ad affidarci solo alla legge elettorale per creare nuovi soggetti politici: una forza politica non può nascere dal Palazzo.

https://t.co/isQ6dCWA0L https://t.co/2H7uFLFee2",7,0
2022-01-31 13:16:37+00:00,1488139154156306434,https://twitter.com/Maurizio_Lupi/status/1488139154156306434,"L'elezione di Mattarella è stata la via più facile e disperata per la politica, ne usciamo con le ossa rotte.
Dobbiamo ripartire o nel 2023 rischiamo la paralisi.

La mia intervista sul @Corriere
https://t.co/zNsqTwE1Vg",13,0
2022-01-29 20:03:26+00:00,1487516759594868742,https://twitter.com/Maurizio_Lupi/status/1487516759594868742,"Nonostante una politica debole è stata confermata alla presidenza della Repubblica una persona eccezionale, amata e riconosciuta a livello internazionale. Una fortuna ed una garanzia per il Paese e uno stimolo di doverosa riflessione per tutti noi. Grazie Sergio Mattarella.",32,0
2022-01-29 19:13:53+00:00,1487504288066805769,https://twitter.com/Maurizio_Lupi/status/1487504288066805769,"L'esito di queste elezioni? 
La sconfitta della buona politica.

https://t.co/yLsvLVFtDM",12,0
