Date,ID,URL,Content,Likes,Retweets
2022-01-27 10:55:02+00:00,1486653975030124548,https://twitter.com/Maurizio_Lupi/status/1486653975030124548,"Oggi ricordiamo le vittime degli orrori della Seconda Guerra Mondiale. Con il passare degli anni e l’esaurirsi di testimonianze dirette è sempre più necessario ricordare quanto accaduto nell'epoca più buia della storia europea, affinché non accada mai più. #GiornodellaMemoria2022 https://t.co/g9nEDs3dyp",7,0
2022-01-24 12:48:50+00:00,1485595446663954432,https://twitter.com/Maurizio_Lupi/status/1485595446663954432,#Quirinale2022: @noiconlitalia_ voterà scheda bianca. Da sempre rileviamo che il problema è innanzitutto di metodo: bisogna trovarsi per cercare un nome condiviso senza veti o proposte preventive. L’unità del #centrodestra si manifesti in questa apertura a una soluzione condivisa,5,0
2022-01-21 17:49:50+00:00,1484584034613268489,https://twitter.com/Maurizio_Lupi/status/1484584034613268489,"L’attacco a #BenedettoXVI per le presunte coperture date a quattro sacerdoti pedofili è evidentemente pretestuoso e senza prove. Nel 2022 tanto basta per una campagna diffamatoria nei confronti di Ratzinger, la cui lotta alla piaga della pedofilia è universalmente nota.",27,0
2022-01-19 14:57:27+00:00,1483815875585220614,https://twitter.com/Maurizio_Lupi/status/1483815875585220614,L'elezione del Presidente della Repubblica è il massimo compimento di una democrazia parlamentare come la nostra. Sarebbe un gravissimo se non tutti i 1009 grandi elettori fossero messi nelle condizioni di esercitare il loro diritto e compito costituzionale.,16,0
2022-01-18 13:24:15+00:00,1483430034622853124,https://twitter.com/Maurizio_Lupi/status/1483430034622853124,"Lo dico anche oggi: il reato di traffico di influenze è un reato indefinito e indeterminato, anche se l’indagato si chiama #BeppeGrillo.
Bisogna abolirlo, oggi come ieri.
Noi continuiamo a pensarla così.
E il #Movimento5Stelle?",25,0
2022-01-15 13:12:05+00:00,1482339807640621058,https://twitter.com/Maurizio_Lupi/status/1482339807640621058,"Le ragioni della strategia del #centrodestra per l'elezione del Presidente della Repubblica:

https://t.co/l1b09fnC25",3,0
2022-01-11 09:57:48+00:00,1480841362681606145,https://twitter.com/Maurizio_Lupi/status/1480841362681606145,"#DavidSassoli ha sempre mantenuto lo stile del giornalista nel fare politica, cercando di capire prima di parlare. Lo ricordo al Meeting di Rimini a confrontarsi con tanti giovani con idee diverse dalle sue, sempre pronto a mettersi in gioco. Resterà un modello per la politica. https://t.co/bMCAWN6n3i",26,0
2022-01-10 11:07:17+00:00,1480496462043693056,https://twitter.com/Maurizio_Lupi/status/1480496462043693056,"Questa maggioranza dovrebbe trovare un metodo condiviso per l'elezione del prossimo Presidente della Repubblica, altrimenti non ci si potrà lamentare se, legittimamente, si procederà con un voto a maggioranza. 
La mia intervista al @Corriere di oggi: https://t.co/yaHlEgQEvl",5,0
2021-12-31 21:28:10+00:00,1477028835816361995,https://twitter.com/Maurizio_Lupi/status/1477028835816361995,"Unità istituzionale, unità morale e il nostro futuro affidato ai giovani: ancora una volta il Presidente dell Repubblica Sergio Mattarella ha saputo sintetizzare la forza e i valori dell'Italia. Grazie per essere stato punto di riferimento e simbolo del Paese in questi sette anni",19,0
2021-12-29 13:46:04+00:00,1476187765553442819,https://twitter.com/Maurizio_Lupi/status/1476187765553442819,"Niente quarantena per chi ha 3 dosi di vaccino, calmierare i prezzi delle mascherine Ffp2 e introdurre misure restrittive per i no-vax. Questi i primi interventi da fare per contrastare il diffondersi del covid senza bloccare il Paese. Una minoranza non può fermare la ripartenza.",316,0
2021-12-23 14:15:40+00:00,1474020888509136901,https://twitter.com/Maurizio_Lupi/status/1474020888509136901,"Da @berlusconi, il #centrodestra unito. https://t.co/r2Su9fwYPu",10,0
2021-12-22 14:49:24+00:00,1473666989336014850,https://twitter.com/Maurizio_Lupi/status/1473666989336014850,"Lotta al #Covid e ripresa, l’Italia ha riconquistato la normalità. Non vi è ragione, come ha detto oggi il presidente del Consiglio, per non continuare di fronte alle scadenze del 2022 con la responsabilità che questa maggioranza si è assunta con il sostegno al governo #Draghi.",6,0
2021-12-19 11:48:06+00:00,1472534199697653762,https://twitter.com/Maurizio_Lupi/status/1472534199697653762,"100 anni di università Cattolica con Ursula von der Leyen. Pianeta, innovazione, democrazia: queste le sfide del futuro. https://t.co/b1RzRBQEch",22,0
2021-12-16 16:16:53+00:00,1471514678039830530,https://twitter.com/Maurizio_Lupi/status/1471514678039830530,"Il fondo per gli aiuti alimentari agli indigenti rappresenta un aiuto concreto a chi si trova in difficoltà, valorizzando allo stesso tempo le filiere agroalimentari e del #TerzoSettore, impegnate nella distribuzione. Il Parlamento (tutto) non può permettersi di non rifinanziarlo",7,0
2021-12-13 14:17:08+00:00,1470397378825965574,https://twitter.com/Maurizio_Lupi/status/1470397378825965574,"C'è una differenza tra aiutare a convivere con la sofferenza ed eliminare il sofferente, tra l'accanimento e l'abbandono. La vera libertà è la libertà dal dolore e dalla solitudine, non dalla vita. Il mio giudizio sul #SuicidioAssistito: https://t.co/Wz3fBRyeQt
@ilsussidiario",8,0
2021-12-06 14:54:28+00:00,1467870059548885006,https://twitter.com/Maurizio_Lupi/status/1467870059548885006,"Se oggi possiamo guardare con fiducia al futuro è grazie al Green Pass e al senso di responsabilità dimostrato dagli italiani, che hanno fatto diventare l’Italia un modello. I dati ci confermano una situazione senza paragoni rispetto a un anno fa. Dobbiamo continuare così.",9,0
2021-12-02 20:01:47+00:00,1466497847650623496,https://twitter.com/Maurizio_Lupi/status/1466497847650623496,Le parole di Angela Merkel sulla strategia italiana di contenimento del virus sono un grande riconoscimento internazionale alla responsabilità degli italiani e all’operato del governo. L’Italia è finalmente tornata ad assumere un ruolo di leadership nell’Unione Europea.,12,0
2021-12-01 17:36:22+00:00,1466098863199170566,https://twitter.com/Maurizio_Lupi/status/1466098863199170566,Viva il generale Figliuolo che mette a disposizione 11 laboratori della Difesa per lo screening nelle scuole per evitare il ritorno della #Dad. La scuola in presenza è il minimo per assicurare il diritto allo studio a studenti e famiglie.,8,0
2021-11-30 12:03:57+00:00,1465652821559230472,https://twitter.com/Maurizio_Lupi/status/1465652821559230472,"Investire sulla scuola oggi vuol dire garantire la salute e continuità didattica. Dobbiamo tutelare i nostri studenti, dai più piccoli ai più grandi. @noiconlitalia_ propone il ritorno del medico negli istituti scolastici.  Non possiamo, né dobbiamo, tornare indietro: #MaiPiùDad.",8,0
2021-11-29 15:54:44+00:00,1465348511541698579,https://twitter.com/Maurizio_Lupi/status/1465348511541698579,Le agenzie di intermediazione nel mercato del lavoro sostengono che “si è assunti per le competenze e i titoli posseduti e si è licenziati per le #softskills che non si riesce a dimostrare di possedere”. Che aspettiamo ad aggiornare i programmi scolastici?,5,0
2021-11-25 11:49:18+00:00,1463837195782037504,https://twitter.com/Maurizio_Lupi/status/1463837195782037504,"Semplicemente questo, ogni giorno.
#violenzasulledonne 
#25novembre https://t.co/R7bjpRHpsU",2,0
2021-11-24 10:08:38+00:00,1463449471967272966,https://twitter.com/Maurizio_Lupi/status/1463449471967272966,"La scomparsa di Ennio Doris mi addolora profondamente. Il mondo economico italiano perde un uomo e un imprenditore di assoluto spessore, dotato di rara capacità di innovare e di solida lungimiranza. Oltre al ricordo resterà il suo esempio, un modello da seguire.",16,0
2021-11-22 12:23:59+00:00,1462758757948170252,https://twitter.com/Maurizio_Lupi/status/1462758757948170252,"Basta fake news.
Le cose stanno così. https://t.co/gUhbSQ9hle",139,0
2021-11-18 15:21:33+00:00,1461353891606319110,https://twitter.com/Maurizio_Lupi/status/1461353891606319110,"Dobbiamo continuare a puntare con determinazione sul #GreenPass e sulla campagna vaccinale facendo leva sulla responsabilità e sull'esigenza di libertà degli italiani. Non sulla paura. Mai più lockdown, mai più aziende e scuole chiuse. Il virus è la vera privazione della libertà.",15,0
2021-11-17 20:01:46+00:00,1461062025325522946,https://twitter.com/Maurizio_Lupi/status/1461062025325522946,"Basta mistificazioni della realtà. Quando si manifesta non si può dire quello che si vuole, ignorando tutte le evidenze. Non si possono bloccare servizi essenziali né mettere a rischio gli sforzi di tutti, scordandosi che nel mondo c'è una pandemia in atto.
#TorniamoAFarePolitica https://t.co/7cgpJ8k6OO",27,0
2021-11-14 17:54:07+00:00,1459942737244000267,https://twitter.com/Maurizio_Lupi/status/1459942737244000267,Per le elezioni del sindaco di Palermo Salvini propone le primarie e la Meloni dice che sono benvenute. Per parte nostra siamo d’accordo. @noiconlitalia_,5,0
2021-11-12 13:48:57+00:00,1459156264156553218,https://twitter.com/Maurizio_Lupi/status/1459156264156553218,Bene @matteosalvinimi sulla necessità di aprire al nucleare di nuova generazione in Italia. Lo strumento politico per non rimanere indietro c'è ed è la mozione che Noi con l'Italia ha presentato la scorsa settimana per impegnare il Governo proprio in questa direzione.,20,0
2021-11-11 15:19:49+00:00,1458816741467959300,https://twitter.com/Maurizio_Lupi/status/1458816741467959300,Se vogliamo essere realistici e concreti con l'impegno per zero emissioni entro il 2050 c'è solo una strada disponibile: investire nell'eccellenza della ricerca scientifica italiana e nel #NucleareGreen di IV generazione. Apriamo il dibattito con la mozione di @noiconlitalia_?,9,0
2021-11-10 17:44:57+00:00,1458490878264324103,https://twitter.com/Maurizio_Lupi/status/1458490878264324103,"Bene @renatobrunetta. L'abolizione dell'abuso di ufficio può restituire serenità ai tanti bravi amministratori che ogni giorno si impegnano sui territori, cancellando il rischio di una gogna giudiziaria che troppo spesso si traduce in nulla di fatto. #TorniamoAFarePolitica",17,0
2021-11-04 14:12:15+00:00,1456263023060942848,https://twitter.com/Maurizio_Lupi/status/1456263023060942848,"Ho presentato una mozione che impegni il governo sul #nucleare sicuro. Se vogliamo arrivare a emissioni zero entro il 2050 dobbiamo essere realisti e usare tutte le fonti energetiche che rendono raggiungibile l’obiettivo, senza pregiudizi ideologici. 
#TorniamoaFarePolitica",17,0
2021-10-26 09:52:26+00:00,1452936146464485384,https://twitter.com/Maurizio_Lupi/status/1452936146464485384,"Se aspiriamo come #centrodestra a governare il Paese smettiamola di fare battaglie puramente identitarie che alimentano soltanto i singoli elettorati e torniamo a fare proposte unitarie concrete, facendo sintesi sulla comune visione del futuro dell'Italia.
#libero #AltraItalia https://t.co/r4fqx743WV",20,0
2021-10-21 10:35:57+00:00,1451135159210848257,https://twitter.com/Maurizio_Lupi/status/1451135159210848257,"Su cosa si basava il #centrodestra di @berlusconi ? Unità di valori, diversità di vedute tenute insieme per vincere la sfida di governo e un leader che era pilastro centrale della coalizione, con pragmatismo e concretezza. Intervista a @IlGiornale: https://t.co/xcDjm89sZp https://t.co/nfc0BKIojd",5,0
2021-10-19 10:27:22+00:00,1450408224306475010,https://twitter.com/Maurizio_Lupi/status/1450408224306475010,"Quando si è una squadra si vince o si perde tutti assieme. Il centrodestra ha perso le elezioni e il voto ci ha dimostrato che la coalizione è vincente solo quando incarna una proposta politica di governo, in grado di rispondere ai bisogni concreti dei cittadini. Riflettiamoci.",20,0
2021-10-14 10:23:43+00:00,1448595365289136128,https://twitter.com/Maurizio_Lupi/status/1448595365289136128,"Avanti decisi con il #greenpass, unico strumento per tornare alla normalità e ad una vita sociale. Per quanto riguarda i #tamponi per i lavoratori non vaccinati le imprese se ne facciano carico, ma lo Stato le aiuti aumentando il credito di imposta per le spese sanitarie.",5,0
2021-10-11 11:41:42+00:00,1447527826526195717,https://twitter.com/Maurizio_Lupi/status/1447527826526195717,"Detto che sono inaccettabili le violenze che abbiamo visto (di tipo squadrista e di origine fascista), i #sindacati spostino a Milano la manifestazione prevista per il 16 a Roma se non vogliono essere strumentalizzati. Tutti sanno che domenica 17 ci sarà un ballottaggio...",13,0
2021-10-06 15:21:24+00:00,1445771175431393280,https://twitter.com/Maurizio_Lupi/status/1445771175431393280,"@noiconlitalia_ ha votato a favore del #NADEF. Ottima la crescita del PIL superiore alle aspettative, ma ora dobbiamo renderla strutturale: debito buono, politiche attive per i disoccupati e taglio del costo del lavoro per alzare il #SalarioMinimo con tutte le risorse risparmiate",1,0
2021-10-04 16:49:18+00:00,1445068520539238402,https://twitter.com/Maurizio_Lupi/status/1445068520539238402,"Abbiamo preso una bella scoppola, non abbiamo saputo mettere in campo una proposta di centrodestra in grado di convincere i propri elettori. Preoccupante è anche un’affluenza dei cittadini ridotta al 47 per cento. Vedremo come va ai ballottaggi di Roma, Torino e Trieste.",46,0
2021-09-30 13:15:19+00:00,1443565119808671747,https://twitter.com/Maurizio_Lupi/status/1443565119808671747,"Da sinistra rilanciano il #SalarioMinimo. Io sono d’accordo, è doveroso alzare gli stipendi ai lavoratori. Facciamolo però riducendo prima il costo del lavoro alle aziende o rischieremo solo di metterle in difficoltà. A cosa sarà servito alzare i salari se le imprese chiuderanno?",14,0
2021-09-29 09:00:18+00:00,1443138556839579651,https://twitter.com/Maurizio_Lupi/status/1443138556839579651,"Il sentimento che provo di fronte agli 85 anni di @berlusconi è quello della gratitudine. Come politico, come italiano e…come tifoso del Milan. Sull’onda del sostegno a Solidarnosc avevo imparato un canto polacco, Sto lat, cento anni. Sto lat presidente! Buon compleanno! https://t.co/5rjESuEp9M",14,0
2021-09-28 13:59:40+00:00,1442851507431432210,https://twitter.com/Maurizio_Lupi/status/1442851507431432210,"C'è solo una ricetta per il rilancio dell'economia per aiutare le imprese, le famiglie e per dare un salario dignitoso ai lavoratori: abbassare le tasse e il costo del lavoro. 
La patrimoniale lasciamola ai sogni della sinistra.",17,0
2021-09-24 14:56:12+00:00,1441416180250681345,https://twitter.com/Maurizio_Lupi/status/1441416180250681345,"@BeppeSala ieri le ho chiesto di visitare insieme Baggio, un quartiere come saprà pieno di valori e contraddizioni, per toccare con mano una delle tante realtà che richiedono impegno e attenzione. Oggi formalizzo la proposta: ci vediamo domenica alle ore 15.00 in via Quarti?",1,0
2021-09-24 10:59:31+00:00,1441356616578703363,https://twitter.com/Maurizio_Lupi/status/1441356616578703363,"Oggi il centrodestra è davanti alla più grande occasione per rilanciare una proposta moderata, che storicamente è quella capace di dare risposte concrete alle esigenze dei cittadini, senza slogan o promesse irrealizzabili, e che ha permesso di vincere le elezioni e governare. https://t.co/UYnDuobuXS",9,0
2021-09-19 15:49:58+00:00,1439617770841378820,https://twitter.com/Maurizio_Lupi/status/1439617770841378820,"#Bossi è stato un dirompente innovatore che ha saputo intercettare la voglia di cambiamento partendo dalla Lombardia e dal Nord. Grande mediatore, utilizzava le provocazioni e il suo linguaggio per cambiare le istituzioni. Auguri Umberto, protagonista della storia repubblicana",10,0
2021-09-16 10:57:01+00:00,1438456884575588355,https://twitter.com/Maurizio_Lupi/status/1438456884575588355,"Basta con le polemiche pretestuose sul #GreenPass, strumento straordinario di liberta! Torniamo  a confrontarci sul rilancio dell’economia o di come evitare l’aumento in bolletta del 40% per luce e gas.",96,0
2021-09-14 15:01:20+00:00,1437793595818446865,https://twitter.com/Maurizio_Lupi/status/1437793595818446865,"I ragazzi hanno già pagato duramente i costi delle chiusure scolastiche. Per questo abbiamo presentato un emendamento per fare in modo che le #scuole, salvo situazioni straordinarie di focolai, non chiudano mai. Neanche in zona rossa. https://t.co/f5jSW8qiU5",6,0
2021-09-14 10:48:25+00:00,1437729945808146434,https://twitter.com/Maurizio_Lupi/status/1437729945808146434,"Come ha certificato l’Istat le imprese cercano personale ma non lo trovano. Invece che continuare con le polemiche inutili sul reddito di cittadinanza, perché non lo trasformiamo in un ""reddito di lavoro"" in modo da favorire l’occupazione, dando stipendi dignitosi ai lavoratori?",19,0
2021-09-13 10:11:04+00:00,1437358158373085184,https://twitter.com/Maurizio_Lupi/status/1437358158373085184,"La #scuola oggi è ripartita in presenza, bene, leggeremo domani come è andata. Intanto non fermiamoci solo al dibattito sul covid e torniamo a parlare di edilizia scolastica, nuova didattica, competenza, merito, alternanza scuola-lavoro...insomma, di futuro. #MaipiuDad",8,0
2021-09-10 14:07:46+00:00,1436330563368017930,https://twitter.com/Maurizio_Lupi/status/1436330563368017930,"Sprechiamo energie preziose a discutere invece di usarle per ripartire. Dobbiamo essere responsabili: l'alternativa non è tra #GreenPass o libertà, ma tra Green pass e chiusure. Vogliamo davvero tornare al lockdown? Quello sì che era una privazione della libertà.",28,0
2021-09-03 13:13:03+00:00,1433780075615473676,https://twitter.com/Maurizio_Lupi/status/1433780075615473676,"Considero l’obbligo vaccinale l’extrema ratio, se la via della persuasione e della vaccinazione volontaria dovesse fallire. Queste decisioni vanno prese con metodo pragmatico e non ideologicamente, esattamente come il ‘rischio calcolato’ con cui si decisero le riaperture estive.",18,0
2021-08-26 16:55:00+00:00,1430936828639653888,https://twitter.com/Maurizio_Lupi/status/1430936828639653888,"La via per l’aeroporto era per gli afghani la strada della speranza. Con l'attentato è diventato il luogo della morte e della disperazione. Con le forze Nato, sotto l’egida dell’Onu, dobbiamo impegnarci per garantire a chi sta cercando di lasciare il Paese di poterlo fare. #Kabul https://t.co/mNrLkx4kgw",15,0
2021-08-16 19:06:29+00:00,1427346042194964481,https://twitter.com/Maurizio_Lupi/status/1427346042194964481,"Le conseguenze del ritiro dall’Afghanistan erano una tragedia annunciata. Abbandonare chi ha creduto nei valori della libertà e della dignità, aiutando i nostri militari in questi 20 anni, è un errore per l’Occidente. https://t.co/HcC1QNmake",18,0
2021-08-15 08:32:08+00:00,1426824011120586756,https://twitter.com/Maurizio_Lupi/status/1426824011120586756,"Buona Festa dell'Assunta con il quadro stupendo del Caravaggio: la morte di Maria e l'assunzione in cielo nascondono il germe dell'eternità.
Vi auguro un ferragosto di meritato riposo!

( Caravaggio, La Morte della Vergine, 1604-1606) https://t.co/lma286T42e",22,0
2021-08-05 14:40:30+00:00,1423292836997328903,https://twitter.com/Maurizio_Lupi/status/1423292836997328903,"Il 57% degli #incendi è di origine dolosa. Appiccare incidendi è un reato da vigliacchi. Dare fuoco alla propria terra è un suicidio sociale, è come tagliare il ramo su cui si è seduti.

https://t.co/RsRJhnwRHN",10,0
2021-08-03 19:21:14+00:00,1422638710802325510,https://twitter.com/Maurizio_Lupi/status/1422638710802325510,"La riforma Cartabia rimette al centro del processo penale la nostra Costituzione con i suoi principi: certezza della pena, presunzione di innocenza, giusto processo, funzione rieducativa. Principi concretissimi, di cui avevamo bisogno. Finalmente. 
https://t.co/62QkzlUX6R",11,0
2021-07-29 17:43:04+00:00,1420802064482021376,https://twitter.com/Maurizio_Lupi/status/1420802064482021376,"@noiconlitalia_ propone un piano straordinario per aprire un centro infermieristico in ogni plesso scolastico, dove effettuare tamponi gratuiti, fare vaccini e sostenere coloro che avranno bisogno di assistenza. Mai più didattica a distanza, qualunque sia il dato dei contagi #Dad https://t.co/ybYoMvGY50",1,0
2021-07-23 11:12:04+00:00,1418529340090994690,https://twitter.com/Maurizio_Lupi/status/1418529340090994690,"Impegno per la giustizia, attuazione della Costituzione, la persona sempre al centro della sua responsabilità, difesa delle istituzioni secondi i principi della democrazia parlamentare. Sono questi i motivi che mi rendono grato per la sua persona. Auguri presidente!",10,0
2021-07-22 19:32:52+00:00,1418292982881652738,https://twitter.com/Maurizio_Lupi/status/1418292982881652738,"Il #GreenPass non priva della libertà, quello lo fanno i lockdown, le chiusure e il distanziamento sociale. 
Sbagliato, però, prevederlo in zona bianca per bar e ristoranti.

#TorniamoAFarePolitica

https://t.co/mmc3LzvCLW",17,0
2021-07-21 14:54:40+00:00,1417860583605653504,https://twitter.com/Maurizio_Lupi/status/1417860583605653504,"Il #GreenPass, se usato con intelligenza, può essere uno strumento straordinario: in zona bianca per aumentare le capienze di alcune attività economiche, in zona gialla o superiore, invece, per evitare nuove chiusure. Precauzione sì, prudenza pure, paura no. https://t.co/tjNbi0MCcT",18,0
2021-07-20 16:30:17+00:00,1417522259321921538,https://twitter.com/Maurizio_Lupi/status/1417522259321921538,"La #sostenibilità di pari passo con la qualità e la facilità di fruizione dei servizi:il #green come opportunità, non come costo. Questo è il cambio di passo che ci serve, o vogliamo continuare a riempirci la bocca con l’ambiente senza poi essere seri e concreti nelle politiche? https://t.co/tIXZNxXIrC",3,0
2021-07-16 11:15:07+00:00,1415993391528255488,https://twitter.com/Maurizio_Lupi/status/1415993391528255488,Insieme per prendersi cura di #Milano. Questa è la sfida che il centrodestra lancia per tornare a governare la nostra città uniti con Luca Bernardo. https://t.co/LDX29wwkeZ,14,0
2021-07-15 15:56:31+00:00,1415701822640201729,https://twitter.com/Maurizio_Lupi/status/1415701822640201729,"Il #SostegniBis tutelerà molte situazioni di difficoltà economica, anche quelle che erano state dimenticate dal governo Conte. Un cambio di passo dalla cura delle ferite del #Covid alla ripresa dell’economia e della società. 
https://t.co/FlswQbg8Ai",4,0
2021-07-14 16:13:37+00:00,1415343738994532355,https://twitter.com/Maurizio_Lupi/status/1415343738994532355,"Pensare al #GreenPass come mezzo per partecipare ai grandi eventi ha senso ma prevederlo per entrare nei ristoranti o nei bar è solo una stupidaggine. Dobbiamo imparare a convivere con il #Covid.
Precauzione si, prudenza si, paura no.

https://t.co/1iLcaO7xlv",20,0
2021-07-11 22:02:13+00:00,1414344303455973382,https://twitter.com/Maurizio_Lupi/status/1414344303455973382,Un solo grido: campioni d’Europa! https://t.co/2f64kP18DU,14,0
2021-06-22 11:03:06+00:00,1407293062313873411,https://twitter.com/Maurizio_Lupi/status/1407293062313873411,"La nota del #Vaticano conferma che il #ddlZan finisce per violare le libertà religiose, educative e di manifestazione del pensiero. Cambiamolo: bisogna avere il coraggio di confrontarsi seriamente in parlamento, non rincorrere leggi fatte solo per sventolare bandiere.",55,0
2021-06-21 10:31:33+00:00,1406922730990145540,https://twitter.com/Maurizio_Lupi/status/1406922730990145540,"C'è un'Italia da ricostruire e anche la politica deve saper rimettersi in gioco, anche quella di #centrodestra. Lavorare insieme per un partito unico, sul modello del Partito Repubblicano, ispirato al Partito Popolare Europeo può essere la strada giusta.",21,0
2021-06-11 13:22:55+00:00,1403341980105687043,https://twitter.com/Maurizio_Lupi/status/1403341980105687043,"Con #Michetti e #Matone la coalizione di centrodestra compatta si candida a governare la città, non solo a vincere le elezioni. Libereremo la capitale dall'incompetenza della Raggi e faremo tornare #Roma la degna capitale dell’Italia, dell’arte e della cristianità. https://t.co/bOTBEaTA0y",16,0
2021-06-10 16:05:48+00:00,1403020582736773131,https://twitter.com/Maurizio_Lupi/status/1403020582736773131,"Noi con l'Italia lavora da sempre per l’unità del centrodestra. Per questo la federazione proposta da #Salvini è un'ipotesi di lavoro interessante, soprattutto se basata su idee e programmi comuni e su un percorso che tenga conto dell’identità di ognuno.

https://t.co/AxSJxh5xnv",10,0
2021-06-06 11:29:42+00:00,1401501550015623170,https://twitter.com/Maurizio_Lupi/status/1401501550015623170,L’aggressione ai cattolici in processione a #Parigi ad opera di supposti antifascisti è un episodio gravissimo. A quei fratelli nella fede va la mia solidarietà e spero non solo la mia. Non aggiungiamo anche la violenza del silenzio a chi è stato aggredito a causa della sua fede.,62,0
2021-06-03 16:14:50+00:00,1400486143108472834,https://twitter.com/Maurizio_Lupi/status/1400486143108472834,"Dobbiamo riformare la #Giustizia, oggi abbiamo tutte le condizioni per farlo: un ministro di grande autorevolezza, un Parlamento che finalmente ha preso coscienza della necessità, un più maturo atteggiamento del M5S e l’utile iniziativa referendaria di Lega e Radicali. Facciamolo",22,0
2021-06-02 18:49:50+00:00,1400162760185548801,https://twitter.com/Maurizio_Lupi/status/1400162760185548801,"“Siamo ad un tornante decisivo nel nostro cammino. Questo è il tempo di costruire il futuro”. Come ha esortato il Presidente #Mattarella ora la politica ha il dovere di dare i mezzi per costruire questo futuro assieme, rimettendo al centro la forza della Repubblica: gli Italiani",15,0
