sentiment_mapping,processed_tweet
1,tipo twitterparlamento politica potenza espressione politica costituzione comunicazione cultura oggetto matrimonio cittadinanza attiva diritti cittadini relazione stato individuo economia paese vive iscrizione registro elettorale nazionale rue registro telematico consente registrazione telematica elezioni presso lufficio elettorale nazionale italiani allestero
0,opinione positiva sento affermare dibattito stato buono mai capito bene significato concetti male faccenda ragioni atteggiamento sentenza finale commento post fotocopia persona modo diffidare genitori stato eliminato critiche commenti molto
2,cosa particolare personaggio sempre affascinato parole fatto storia dellitalia nome può essere accantonato via problemi salute rimasta incinta lho sempre considerata donna insopportabile malata frustrante nata figli maschi
0,posizione pertinente visto alcuna scena momento fatto solo ricerca google altri utenti scritto base discussione linea generale considera russia democratica approvato emendamenti testo decreto costituzione compreso costituzionale democrazia occidentale statunitense diventando sempre democratica essa appartiene maggior parte leggi
1,riassunto principali avvenimenti accaduti 2015 iran liran stato primo paese mondo dichiarare propria neutralità merito questione iraniana governo poi annunciato emendamenti diritti umani incluso allaborto donne gravidanza validi dopo lentrata vigore dellobbligo divieto procreazione medica luoghi pubblici
2,due parole importanti versi potremmo chiamarla politica così sento sento dire esperienza personale può essere molto interessante semplice opinione pubblica significato stato chiaro allora vuol dire letto articolo solo penso cose leggo giro causa lavoro giornalista posso fare altro consigliare legge
2,termine viene utilizzato indicare specifica parola lingua italiana semplicemente tema tratta parole spesso solo scuola educazione così via scritto intrusivo scritto intruminopopulismo strategia defaultit politica socialisti comunisti italiani socialismo
4,titolo progetto nome marco riferimento parola persona molto importante mondo vive vita modo libero indipendente lavoro consente fare lavoro qualsiasi altra cosa particolarmente orgoglioso dellimpegno collaboratori seleziona categoria cultura spettacoli famiglia bandiera americana 478
2,leffetto elezioni partiti apparati politici sempre stati poco chiari distorti rispettato lobiettivo partito mai raggiunto maggioranza livello personale mai potuto esercitare potere mentre masse popolari forte opposizione allavvento partiti tradizionali costrette accettare riforme strumenti democrazia diretta indiretta senza
1,vedi post twitter testo risposta richard vedi sotto dati anagrafici particolare capito trattava indirizzo email
0,soggetto politica amministrazione direttiva img categoria amministrazione dirigente istruttore tecnicoamministrativo attività amministrativa materia sicurezza lavoro igiene alimentare autorità nazionale anticorruzione fallimento imprese risolvere diario bordo aziende veloci intervista presidente dellance fabio greg
1,verità partito odia frase nulla dolce poi ragione accusa essere peggiore partiti poi deciso fare solo fatto volta sbaglio lasciato andare stesso modo quel punto capito ora partiti politici tradizionali
2,notifica pressione 419 disturbi parte sintomi comuni includono voci facebook voci web potere dibattito pubblico solo social media reti sociali può vedere situazione momento risulta molto difficile utenti navigano online utilizzano dispositivi mobili smartphone tablet infatti possibile navigare
2,identità religiosa conservazione culturale sviluppati progettati essere usati base luso quotidiano politica internet stati creati uso personale familiare tipi prodotti diffusi mondo occidentale scopo promuovere diffusione cultura cristiana alcuni paesi necessario utilizzare prodotti consiglia vivamente usare marchi fabbrica largomento sito messaggio può
0,opinion the day 10022016 35482 views lultimo numero mese stato primo ordine cronologico critica letterariait febbraio 2016 proposito dellautore ultime pagine state pubblicate sito web opinione vero oggi
1,autore daniele gaglianone sito ufficiale scuola libertà scrivere poesia scrivere storia può essere divertente difficile realizzare personalmente sempre limbarazzo scelta primo anno mai pensato romanzo genere ora complici tempi difficili ultimi anni riuscito finalmente appassionarmi scrittura libro
2,parola usata senso figurato indicare parte discorso occupa dellargomento lingua utilizzata qui francese usa simbolo persona religione termine fenomeno stato utilizzato parla correntemente forma verbale detta proprio fonetica esso consiste nome forse nellinsieme termini legati modo viene pronunciata parole fusione
2,legge lintegrazione cura direzione generale diritti umani cooperazione sviluppo persone straniere trattate stesso modo paesi parte gruppo leggi tema svantaggi state sostituite altri regolamenti convenzione europea diritti umani particolare legge 179 2015 abroga comma stata modificata legge
2,rapporto individuo gruppo individuo rapporto individui allinterno famiglia lindividuo insieme costituito serie componenti interagiscono maniera stabile fra esempi relazioni trofeo fidal veneto san vito capo associazione italiana sommelier puglia home news trofeo fidal sicilia altavilla milicia
2,numero battute 108 1324 elementi correlati popolo primo atto ufficiale nuovo governo matteo renzi stato formare coalizione forze nuove posto vecchi partiti sostanza nuova formazione chiama migliori discorso importante prima parte potrebbe avere maggiore impatto governare riguarda
4,sintassi crisalide genere dizionario etimologico italianoromanico italian edition volume english edition libro primo tassello progetto lautore già affrontato questione dellimmigrazione forma tradizionale campo causa implicazioni sociali etiche coinvolto litalia punto vista culturale sociale solo strettamente personale maggior
1,norma dice parola battaglia pronunciata termine usato riferirsi qualcosa astratto neutro parola usata esempio può essere utilizzato riferimento questione politica deve specificare però mentre lespressione usata definire democrazia diretta italia detta democrazia civilizzazione nazione intendersi accezione termine
2,citazione settembre 2016 1534 ultima risposta mesi fiorenzo sartori principi diritto tributario massimo biase ita invio discussione presidente draghi mentre discusso riforma delliva fisco diritti
0,rileggendo post nulla male tratti questione politica testo realtà semplice idea politica cose importanti tema interessa scritto commento qualcuno voluto scrivere qualcosa sbagliato semplicemente largomento troppo difficile capire così via quindi dovuto usare immagine originale essere quasi critico confronti
2,destra livello politicamente corretto razzismo alcun conflitto idee può essere molto forte molto debole tuttavia idee forti ciò cercando dire partito democratico democrazia allora possibile raggiungere posizione alta esempio stato lodio antidemocratico governo particolare quando fatto punto vista
0,livello istruzione i5s 160 cittadini dovrebbero essere informati ciò evitare deve persone propense giudicare politica maggioranza voto laltro qualcosa dire politici devono sapere cosa fare caso contrario conseguenze originariamente scritto alma toni nota discorso dibattito pubblico risolve
4,risposta preoccupazioni dellamministrazione usa particolare riguardo sostegno alleconomia beni pubblici segnalo larticolo apparso sito new york times firma seth fogelman analizza quadro economico statunitense 2016 previsioni ottimistiche quel momento
3,naturalmente tratta parola specifica politici tratta semplicemente strumento può essere utilizzato modo meno efficiente esempio lelaborazione politica nazionale regole specifiche gestire preferenze politiche nazionali tuttavia molto importante conoscere termini comprenderne aspetti pratici prima procedere utilizzo strategia dovrebbe funzionare sola maggioranza elettori prevede
0,sondaggio punti riforma delloccupazione politiche flessibilità mondo lavoro possono essere cambiate addirittura vendute settore privato può rilanciare leconomia capacità attrarre nuovi investimenti quindi accordi ristrutturazione debito spesso vincolanti altro punto cruciale rapporto fra reddito personale soldi lavoratori benessere
1,2019 nome parola derivativa effetti carriera politica svolse germania periodo rivoluzione socialista 1938 1945 caratterizzata partecipazione vita pubblica partito comunista tedesco ddr linizio fase cambiò profondamente scenario politico europeo sviluppò due fronti propaganda rovesciamento
2,    backgroundimagepng     src documentgetelementbyidown_htmlappendsave image
0,quadro contenuti argomenti principali fonte diritti autore riprendi opinione sito ogni argomento bisogno moderazione commenti verranno valutati team editoriale fine offrire migliori valutazioni disponibili forum garantendo sempre qualità informazioni dando possibilità lettori fatto richiesta esprimere proprio parere ogni caso qualsiasi commento dovesse essere stato espresso usando
2,partiti politici espressione partitello eccellenza stessa cosa certa esperienza politica leader metodo tratta stile diverso partito serio può essere maggioranza elettori patto avere propri candidati proprie idee solo supportano governanosarebbe proprio lappartenenza
2,mai votato donna rimasto allibito leggere dichiarazioni voti parlamento così buoni piaceva ruolo parte dato famiglia partito democratico lho visto molto bene distinta partito senso possibilità essere presente quando trattava governo partiti politici italia ricordo ancora voto
2,numero lettere indicate persone compiuto anno età registrazione articolo chiesto lettore daccordo larticolo originale dato mancanza dati intenzione scrivere lettera aperta lettori preoccupate daremo suggerimenti base situazione attuale riguarda articoli precedenti avanti
2,segnalazione voce anziani generazione voce nuove generazioni scrive canti riprende laudio puntata oggi img 0657894371 audio intervista claudio foti massimo amato limportanza dellascolto fare cultura intervista
2,bisogno nuova cultura solidarietà parlare pubblico ecco proposte partito democratico futuro paese italia limportanza tema vita persone stata centro dellincontro oggi parlamentari enzo bianco corso quali lanciato proposta formazione cittadino italiano leuropa dibattito portato allapprovazione alcune proposte
0,argomenti partiti politici politica italia europa paesi primo piano critica partito parte partiti tradizionali socialisti stata forte importante ultimi anni tuttavia oggi lelettorato trova situazione molto complessa precedente gruppi populismi iniziato mostrare critica sociale democrazia liberale titolo critica partito comun
0,originariamente apparso twitter 20139 574 giorni toni braido stato votato utenti lopportunità votare presidenza regione piemonte nome già noto allepoca fatti 2018 deciso far valere ragioni merito candidatura senato dellex presidente consiglio matteo renzi torino
1,stato votato parlamento 2017 nuovo piano dazione ripresa economica paese disegno proponeva unica soluzione possibile termini sociali economici prevedeva leliminazione totale delliva cassa integrazione agevolazioni fiscali fonte legge n5698 aziende fino milioni fatturato lintroduzione voucher lavoro occas
0,distintività messaggio situazione piace molto lopinione espressa articolo fatto persona curiosa appassionata politica mai parlato abbastanza lungo poterti dare risposta esaustiva definitiva questioni riguardanti vita persone esempio tema immigrazione solo cominciato modo meno convinto sola
2,1982 560564 dialoghi politici parole dordine linguaggio sempre labile luomo ribella parola esiste fondo dibattito valori costituzione italiana attraversato secoli storia italia stati padri fondatori mai riguarda litalia
0,giorgio malfa partecipato trasmissione celentanoit tema famiglia italia stato lideatore progetto nutritoires scritto stampa occupa filosofia politica 2014 anno dellanno zero riusciti scrivere nulla mai capito pubblicato serie articoli
0,capitato cosa imparato esperienza vita insegnato giudicare essere umile contrario credere possibilità crescere realizzare proprio sogno base propria visione personale cose altri proposito famiglia presento unaltra persona speciale sofia toniolo giornalista scrittrice italiana trasferita
1,testo lingua originale titolo canzone pink floyd pubblicata 1976 2015 band pubblicato standing the storm rappresenta lomaggio beatles band chiama the band pink floyd stati insieme 1980 1993 scritto molte canzoni diverse occasioni
2,larticolo risposte positiva valide lettera aperta gruppo sel candidato sindaco roma capitale dimesso seguito protesta parte stampa locale scelta renzi correre ripari forze dellordine far rispettare norme carcere migranti gruppo partito democraticoncdrcs rifondazione comunista deciso
2,lingua italiana italian italiano italiano tedesco german spagnolo hindi hindi statistiche 28705 volte lanno ranked indianapolis 4694 risultati commento compilato dati risultati sondaggio quindi stati creati risultato risposte utenti link
0,risposta aperta testo lettera paolo sorrentino 1975 presidente francese emmanuel macron crisi missili siria foto stata pubblicata discorso civilizzatore
0,materiale poliedrico senza categoria disabili legge 104 reddito cittadinanza sussidio universale lavoratori stranieri cittadini italiani riassunto libro difficoltà dellintegrazione sperimentato anni precedenti vediamo rapporti lavoro cultura lavoratore italia tenuto presentare lautocertificazione periodo crisi economica stati costretti
2,significato termini 1582349 termine politica riferisce quel linguaggio parlamento forma latina prende decisioni politiche generali breve periodo state prese governo maggioranza parlamentare composta membri congresso eletti camera deputati iniziativa stesso senato disposizioni legislative dellassemblea nazionale qualifiche camera emanate corso
2,danza popolare doppio parte canto gallo sbernardo flauto dolce dallaltra danza signora canto cantetto passa canzone senza cori difficile trovare esprima stesso tipo musica risponda altre categorie meritoe poi limpressione voce tempi
1,testo linguaggio propaganda politica democrazia diretta basa sulluso parola parla concetto potere forma diversa democrazia diretta rispetto partiti politici tradizionali sostanza solo strumento definire propria posizione usare altri mezzi comunicazione lemoticon parole usate discorso pubblico vita pubblica trasmissioni televisive utilizzate
2,contabilità bilancio economia finanziaria finanza personale punti salario minimo legale ovvero soglia superare ogni lavoratore dipendente fiscale inps fiscon082013 art tfrs retribuzione massima 57000 partire primo anno servizio maturato regime speciale diritti sindacali
4,dati personali 53071 facile usare facile installare veloce contiene possibilità aggiungere note file necessario essere amministratori windows fare molto semplice utilizza computer standard 64bit 68bit specific 64bit 64bit puoi trovare driver
2,genera unimmagine può essere chiave lesistenza parte corpo ruolo importante dovrebbe mai cambiare senso frase riesci trovare giusto sembra essere ancora troppo qualcosa perdita depressione bisogno aiuto psicologico tratta persona cara perso genitori causa problemi sociali
4,piano dazione modello cura leader nome cognome squadra squadra squadra composta membri donne uomo fattore accordo regole dellorganizzazione solo avere informazioni livello rapporti vari componenti squadre posizione allinterno eventi vengono organizzati vissuti durante incontri fondamentale
2,sociale criminale terrorista livello comunicazione raggiunto precedente post dopo avervi parlato persone votato riguarda litalia trovo parlare molto bene esperienza blogger quando stato giro cercare lavoro anni prima volta vidi ragazza italiana aspettare ansia commenti ragazzo
4,contropiano politica stile stile società politica bisogno gente viva modo intelligente creativo necessariamente motivo modo funziona democrazia dovrebbe essere inclusivo conflitto sociale leducazione allistruzione cultura vita pubblica può aiutare comprendere bisogni individuali prospettive future richiede cittadini fare uso maggiore mezzi necessari successo personale
2,segni particolari libertà solidarietà dimensioni foto h71 numero pagine 5946823 media dimensione dellimmagine 252x252 pixels peso file immagine file size pixel 191713 download images from this page
2,versione stampabile 15609 scritto essere chiari piacciono animali effetti cosa piace molto altre cose combattessero modo migliore vivere parla specie legge giungla sociale quindi daccordo riguardo fatto rapporti stato economia importanti estremamente
2,mai stato così difficile raggiungere base comune trarre voti elettori politica volta unopinione chiara cosa votare meno partito riferimento pensione può essere guida andare avanti costruire nuova fase vita politica italiana origine nome deriva fatto altri partiti scelto slogan leader cioè gente molto
2,aggiornamenti
2,"suggerimento creazione 17022015 18494 letture informativa memoria 21032015 10076 letture 
   così nulla ogni tanto chiedo cosa fare pensare politica"
2,dimensione 305 sito web download torna cima video qui sotto rivisitazione
0,politica risposta domanda cosa devo dire stesso risposta voglio fare ciò posso felice contento vita politica piacerebbe vivere casa circondata persone così diverse essere umani amici quando tratta cose molto grandi difficile capire gente meravigliosa persone
1,mentre altri partiti schierati prima linea governo presentato proposta riforma costituzione italiana soluzione tema due partiti deciso intervenire leader udc stato poi criticato dallopposizione fatto sapere contrario volontà popolare notare parole matteo renzi berlusconi maurizio landini
0,scrivere critica movimento questione stato solo slogan cioè semplice espressione protesta contenuto nulla fare rappresentazione realtà fatto stesso essa falsa piuttosto lidea gruppo potere trova leader read more parola democrazia deriva latino demanitus ovvero meccanismo azione lespressione comune
2,costituzione costituzione repubblica italiana costituzione corpo legislativo stato italiano costituzione istituzioni internazionali partito nazione italiano pil nato roma 1932 iniziativa alcuni componenti due associazioni nazionali italiane cultura religiosa aic italia lassociazione istituita nome movimento comunisti italiani costituì nellottobre 1945 iniziativa
2,simbolo partito democratico pdl costituzionalismo nepotismi elezioni politiche nazionali referendum costituzionale 2013 occhi gente elezioni cosa seria visto maggioranza forze parlamento unelezione rappresentanti parlamento fratellino partito meglio coalizione votato luninominale due volte settimana
1,276 commenti lautore detto possibile dare risposta secca domanda renzi quindi prossima settimana inizierò avere sospetto italiani ancora politica estera spero temo argomento troppo dibattuto linguaggio media mainstream commento larticolo sembra quindi essere definitivo caso
4,richiesta pubblicazione commento 1047935628957551 vendite sommario definizione dizionario inglese tecnico testo proforma contatto diretto indiretto software consenso icone sistema informativo informazioni posizione informazioni internet comunicazione istituzionale privacy policy politica cookie termini condizioni
2,simbolo fascismo nazismo fascismo guerra liberazione aggiungi lista risultati ottenuti tag diabete vaccinazione covid19 quindi attuale causato danni permanenti corpo umano cellule tessuti dellorganismo sintomi comuni linfiammazione febbre dolori articolari colpito persone anzi
0,autore giorgio ferrero autore fonte corriere sera ottobre 2006 milano categoria articoli dedicati sovranità nazionale prontezza ottenere vpn innovao ottenere vpn vuoi fare domanda internet explorer chrome firefox mai provato utilizzare rete privata virtuale accedere siti web interessano online
0,1024965378 ricevuto risposta richiesta comitato discriminazioni stato possibile ricevere testo definitivo attesta presenza valori relativi voti persone coinvolte questioni dinteresse generale livello nazionale alcuni aspetti potrebbe essere dovuto fatto testo finale viene presentato testo dellaccordo chiaro testo
2,autore marco frittella 15082017 risposta breve rispondo pure questione verbo poichè capito differenza politica lega nord meloni sembra ragionamento basi due punti distinti forza dellalleanza strategica forze politiche italiane
1,rapporto sullavanzamento partito ore tridente gigi riva direttore bidimedia fotografia francesco carlo luomo altri video politica estera italiana gugliemo marcone leuropa elezioni parte storia migranti programma gianfranco funzione pubblica
2,denominazione governo pdl introduzione ispirato noto personaggio televisivo due protagonisti dellultima edizione lunità lavoro intitolava voce popolo figura ripresa televisione italiana settimanale repubblica 1964 trasmissione fuori tempo diretta alberto sordi soggetto
2,ordine alfabetico versione stampabile ordine alfabetico corriere asl milano 1948 corriereit gazzetta ufficiale edizione settembre 2003 diritti riservati privacy policy cookie policy social links cosa newsletter rss newsletter progettata soddisfare esigenze clienti desiderano rimanere aggiornati
0,iperbole testo giudizio largomento trattato corte costituzionale relazione fatto sentenza impugnata dichiarato giurisdizione esclusiva stato italiano sullimpugnazione dellordinanza ingiustificatamente resa via durgenza governo berlusconi relazione articolo 591 consente affatto revisione competenze processuali atti amministrativi tratta dunque riconoscere diritto soggettivo
2,altre informazioni fondatori stati eletti parlamento presidente repubblica capo stato modo storia sposta passato creare valori riferimento persone paese lobiettivo principale creare nuova generazione cittadini consapevoli proprie capacità propri doveri dazione allinterno istituzioni luniversità cosa pensa dellitalia problema importante risolvere
2,tema tema politica gossip centro dibattiti politici corso alcuni partiti pdl vogliono crisi governo senza affrontare problemi gente altri invece vogliono istituzioni sorde reali difficoltà cittadini contesto tratta temi linformazione riguarda televisione pubblica privata prescindere qualità dellofferta servizi televisivi definizione
0,discorso papa santa sede 2018 storia chiesa cattolica stata costellata numerosi errori particolare riguarda listituzione sinodo vescovi conferenza episcopale italiana protraeva 1957 1964 periodo chiesa cattolica volte espresso sostegno alcuni esponenti dottrina sociale cattolica tal proposito vedano
2,aggregazione messaggi vincolanti sensibili temi politici economici possibile ottenere informazioni sullelettorato partiti modo poterne trarre dovute conseguenze salvo casi eccezionali possono essere imprevedibili lintento messaggio far emergere sentimento cittadini verso politica affinché rendano disponibili partecipare vita collettività insieme messaggi quindi considerati
4,nota testo stato pubblicato startupitaliait lindirizzo web ufficiale startupitaliaorg piattaforma creata dallexministro difesa italiana sostituito vecchi motori ricerca wikipedia riguarda informazioni raccolte blog aggiornate momento esclusivamente scopi informativi culturali particolare cercato raccogliere alcune informazioni generali riguardanti attività competenze
0,"  
 breve"
2,modalità svolgimento voto popolare diretta online voti validi divo forte banda ultrà marco giallini alberto bagnai presidente delleredità prima intervista risale fine novembre 2014 dichiarato sondaggi stati corretti lega muovendo sola
3,parola indica capacità soggetto comprendere modo chiaro significato propria vita eventi compie facile usare persone sposate sposati generale poiché lintervallo rapporto duraturo restanti due mesi stesso può essere applicato situazione personale coniugi sociale concetto
2,trova sintonia mondo politica caso cosa importante lattenzione principale elezioni politiche processo può portare maggiore popolarità partiti politici paese esempio forza italia cittadini italiani votato sosterranno idee temi tasse ambiente giustizia sociale diritti civili libertà civili etica pubblica eccetera
2,leggendo articoli ritrovato dover affrontare situazione conoscevo trovati situazione stato difficile prendere provvedimenti immediati soprattutto alcuni aspetti molto gravi può risultare drammatico estremamente complesso gestire caso specifico dati dellattività servizi sociali persone coinvolte dall1 gennaio 2020 materia contrasto violenza sessuale l87 adolescenti
0,scritto lidia cella segui dalletà contemporanea diritti umani diventano realtà ottobre 2017 incontra questione migranti stata centro dellattenzione stampa causa interessi economici energetici insanguinato mondo intero solo italia durante decenni passati prima pagina quotidiani italiani
2,riprendendo prestito alcuni film stessa generazione idee popolari riferiscono concezione politica popolo definizione molto semplice idee politiche proposte penso progetto governativo alcun fondamento religioso etico solo valori politici forti positivi ideali volta compreso limportanza ideologie politiche governo popoli bisogno potere
0,termine indica unazione politica condotta scopo ottenere consenso popolare attraverso luso mezzi propri democrazia linsieme scelte individuali collettive favore cittadini base scelta scelte possono essere condivise entrambe parti necessariamente entrambe fondo lettera scritta sempre stata ritenuta documento fondamentale sinistra radicale
