sentiment_mapping,processed_tweet
0,sostenitori aristocratici politologi progettisti rete facebook critica sociale critica sociale punto dincontro politica società civile mondo lavoro delleconomia editorialisti persone scrivono caso questioni politiche semplicemente commentano cose social network dibattito potere social media importanza
2,riforma sistemi tributari gennaio governo prodi dimesso conseguenze dimissioni leader centrodestra senato dato via libera definitivo allapprovazione proposta legge noleggio lungo termine senza conducente agenzie finanziarie roccaraso bisogno ammettere ottantotto rata spingerai sogni realizzabili adatto finanziamenti prossimità dellauto
0,quadro riferimento governo opposizione spd politica esteratramite senatore pdl maurizio martina sovraccoperta 102 pronti nuova stagione lotte segretario cgil annunciato lintenzione creare nuove forme lotta settore dellenergia dare vita attività promuovano mobilità sostenibile giorgio dehò rivoluzione
0,ogni individuo unico ogni persona unica ciascuno proprie peculiarità individuali propria cultura proprio credo religioso sociale propri tratti distintivi ugualmente importanti lindividuo concetto identità collettiva sviluppando mondo occidentale così anglosassone europeo occidentale livello culturale vari modi pensare allidentità individuale rappresentazione
2,cosa parola politica qualè potere linguaggio cosa serve comunicazione politica internet esiste vera democrazia cioè stato dellinformazione democratico può votare democrazia diretta qualcuno votato meno lopposizione storia due facce storia
1,articolo dopo aver parlato ideologie progressiste esamineremo contenuti significato termine idee trova titolo discussione scrivendo nellarticolo maggior parte lavori tipo politico esempio scritto lavoro problema dellinformazione seguito parola ideismo articoli scientifici quindi idee state usate serie
1,popolo dio popolo famiglia ditalia 2013 aggiornato 7042019 admin pubblicato politica italiana taggato cambiamento ddl cirinnà ddl costituzionale legge stabilità riforma delluniversità pubblica riforma istituzioni scolastiche senato senato repubblica sindacato giornalisti italiani scuola pubblica vitalizi
2,controfase avvertimento riunita tentativo promoter coerenza programma rivolta opinionista partito pancho politano democratica sospeso motivi giudiziari benvenuto very important things about yourself team offre lista servizi collegamento adatta bisogni
2,peso 54637 parola identità prime quattro parole lingua italiana trova usi slavistici indicare lidentità soggetti gruppi persone idoli cosiddetti idoli cartapesta detti idolatri simbolo dellidolatria oggetti simili tshirt vari colori necessariamente appartenenti sesso maschile
0,critica tema lavoro altro paese stato eletto popolo istituzioni europee dovere morale difenderlo concetto libertà dopinione può essere mai usato questione politica caso potrebbe pensare leuropa buon posto vivere democrazia europea niente fare nessun governo alcun potere decisionale vita sulleconomia regno
1,rivoluzione cultura italiana ovvero contrario democrazia liberale attuale esempio progetto legge elettorale alternativa due cose affascina particolarmente prevede premio nobel 1968 scritto chiaramente codice procedura penale italiano alcuni casi testo può essere recepito addirittura deve arrivare adozione causa dubbi fatto esso
2,navigazione articoli precedente successivo discussioni recenti lesperibilità farmaci salute mentale riflessione critica ricerca italiana ipermedia libertà medici società liquida proposito rapporto delloms europa solo settore medico colpite malattie mentali
4,seguici facebook sito visitando stato visitato 53071 utenti mentre contenuto dellannuncio stato visto meno ricerca parola chiave dichiarazione politica bacheca annunci siti notizie seguito sito siti web amministrazioni pubbliche gestiti direttamente titolare sito politica cookie applica seguente
1,critica chiave tratta criticare esprimere proprio punto vista ciò altri detto dicono tentativo dellessere umano dare propria risposta ogni cosa dice tratta modo gente pensa cose importanti stati fatti persone daccordo stessa opinione bullismo discriminazione
1,vedi 14022021 ultimo aggiornamento numero 37859 giorni campagna mediatica lemergenza coronavirus subito profonda trasformazione stato diffuso seguente messaggio contenuto sito web dellagenzia europea medicinali ema
0,numero messaggi inviato 12069 utenti tema sondaggio sondaggio inviato l85 italiani crede possibilità partiti possano entrare parlamento senza avere maggioranza assoluta l87 dubiti riforma costituzionale fatto elettori movimento cinque stelle disposti votare leggi momento motivo
2,parte dente meno caso altri rappresenta ruolo politici valore lequivalenza voce statuto classi premi può dividere sesso donna pubblicato fiamma 1057 nessun commento link post etichette banchetti nonsent
1,categoria potete trovare rubriche approfondimento interviste fatto molto diverso ciò legge social media videointerviste politici italiani internazionali rubriche dettagliate rispetto contenuti permettono conoscere meglio politica italiana personaggi pubblici privati presenti web idee arredare camera letto blog italiano news migliori idee arredamento
2,due partiti così stato detto rizzo misto intervista rilasciata sole ore stati sfiducia costituzione motivo può dire ciò vero entrambi schieramenti stessa cosa problema però proprio linguaggio discorso particolare regole dettate partito stesso spiegare questione democrazia diretta mezzi comunicazione sostegno
2,seleziona categoria politica destra 201819 segue risposta domanda caso risposto probabilmente daccordo sondaggi meno favorevoli simile misura sicurezza nazionale limmigrazione clandestina vedi qui piace genere argomentazione allora articolo potrebbe essere considerato modo diverso qualsiasi altra
2,possibilità utilizzare social network lingua inglese comunicare pubblico propria posizione cambiata esempio facebook può essere utilizzato servizio messaggistica istantanea inviare messaggi privati semplicemente strumento promuovere limmagine aziendale seguito riportate principali funzioni social media marketing occupa politecnico milano social media marketing social media possono rappresentare spazio aperto dare visibilità
2,suggerimento unidea concetto storia partito democratico tratta semplice storia può essere scritta maniera distinta ogni gruppo politico volte termine partito indica linsieme parole vengono usate partiti allinterno stessa coalizione dellintero partito stesso esempio nomi utilizzati seguenti congregazione
4,licenza partire 094 critiche1583 volte concetto nondisparità valori società basata diversità culturale religiosa economica termine diversità riferito comunità entità sociale impegna promuovere conoscenza reciproca membri stessa comunità rispetto altri proprie opinioni pubbliche esso significato fare
2,livello istruzione seguito prima elementare abilitazione professione sanitaria territoriale diploma professionale infermieristica medicina generale pensi meglio laurea magistrale sappi inserito graduatoria università stato caso percorso universitario fonte
2,genere destra necessariamente sinistra genericamente senso tecnico larticolo ddl introduce lobbligo vaccinale sanitari caregiver malati autosufficienti basa concetto senza salute assume responsabilità cioè soggetto obbligato ricevere prestazione sanitaria conseguenza diretta propria vita diritto voto deve essere costituzionale allart
0,dossier 3457 segnalazione numero punto migliaia protesta riforma sanitaria sanità pubblica solo italiana meritava meno volte titolo post governo italiani realtà così imbattuta notizia fatto piacere soprattutto parla vicino importanti novità
2,scelta partiti fattore esiste riforma tributaria partito appartenenza partito liberale italiano 19062015 1347 adsodemarco86out riportiamo alcuni commenti post originale pubblicati facebook parla riforma welfare parte permetto domanda
0,litalia repubblica democratica fondata matrimonio uomo donna sola eccezione chiesa cattolica base principi può essere legiferata diritto naturale pubblicato panzichère 17092005 vorrei ricordare amici italiani oggi cose belle state fatte figli pare
0,sintetizzare politica renderla democratica unetica democrazia diretta fare proposta prima necessario passare dallidealismo persuasione punto forte costruzione dellidentità nazionale cadere schema imposto altri partiti peggiore casi potere partito persone gruppi dirigenti daccordo base allora fatelo
1,argento partito maio sinistra sempre forte propensione fare discorsi poi rivelano solite battute ridere avversari grado creare problemi berlusconi stato lunico candidato sicuro presidenza repubblica 104 mag 1548 presidente repubblica sergio mattarella scelto silvio berlusconi guidare schier
2,marco respinti filippide 20150704 2346 altro scrivere parola chiave testo parola chiave soggetto può essere utilizzata diversi modi caso tratta parole possono andare parole meno correlate ciò intendiamo dire senso generale parola chiave dovrebbe riflettere attenzione
2,origine parola storia sotto history italian history ancient times and place italy new time dettagliato antico testo latino medievale esempio parola storia sorta traduzione letteraria dellantica lingua etrusca fuori sfera umana svolgeva prima mondo poi punto vista dio linguaggio sempre caratteri forti
0,acunzo questione democrazia diretta cioè consente allutente privato cittadino decidere liberamente modalità farlo scegliere diventando sempre centrale vita paese parola democrazia alcuni utilizzata movimento stelle oggi molto usata democrazie moderne caso specifico democrazie costituite classi dirigenti italia stato addirittura ipotizzato
1,parola viene fuori linguaggio utilizzato indicare protesta lintromissione minoranze politiche significato ben preciso sindaco voto concetto base termine maggior parte partiti politici però grado esprimere propria idea politica tema partecipazione popolare decisioni amministrative scopo principale imporre proprie scelte popolo attraverso metodi dellopposizione tratta persone
0,linchiostrazione favore dellautonomia stata principale forma promozione principio rappresentanza esempio può fare tipo partiti politici italia ancora molto attivi propaganda elettorale partiti politici sempre forte caratterizzazione politica economica natura essi esercitano nessuna due funzioni solo lautodeterminazione dirigenti lautoreferenzialità inoltre partiti
0,bilanciamento rapporti stato cittadini può essere meno forte riguarda rappresentanti italiani parlamento problemi classe media sempre sociali economici società civile lambiente ideale governare leggi stato soltanto singoli partiti politici vedi articoli sotto interessi passività personali interessi materiali relazioni interpersonali relazionali relazioni professionali
2,traduzione italiana inglese questione risorse naturali questione molto seria livello geografico economico tratta tema sostenibilità ambientale dellitalia futuro nazioni unite lorgano decide sopravvivenza paesi via sviluppo stati uniti damerica addirittura stato solo paesi industrializzati mondo paese
0,dati linguaggio testo lingua italiano inglese versione italiana viene tradotta direttamente dallinglese fraduzione francese quindi comprensibile litaliano vuole leggere traduzione segue necessario rivolgersi lingua originale francese altre forme despressione ispirata eventi storici dialoghi incentrati
0,sovranismo populismo parola usata indicare tendenza destra sinistra nazionalismo allincapacità popolo decidere tratta quindi forma politica potere controllare masse popolari attraverso linfluenza partiti politici sullopinione pubblica stata inventata sinistra poi diffusa mondo ideologia ricevuto molti premi importanti durante anni insegnamento
2,abbastanza persone politico problema principale politica parlamento buona squadra politici riunisce quando bisogno qualche cosa puoi far paese sviluppi velocemente altri paesi solo termini economici può essere molto difficile pensare uneconomia media molto probabile gente sempre voluto avere idee politiche meno uomini
2,scenari apprendimento cittadinanza novembre 2018 ore 9301500 16301700 politica studenti scuole superiori italiani cosa esiste dice ministro dellistruzione marco bussetti occasione consiglio deuropa scuola pubblica scuole luoghi formazione cittadini
2,stato concepito partito populista radicale anticomunismo liberale ecologista lidentità destra italiana certa rilevanza storica materia fascismo dittatura razza può affermare termine fascismo utilizzato sinistra estrema tempo nazifascismo germania nazista parola fascismo insieme allespressione antigermanica usata nellambito
0,critica sociale politica morale punto chiave apre discorso sordi lidentità europea sinistra radicale italiana punto centrale dibattito italia questione dellidentità persone solo definizione astratta cristiana pare origine nata proprio parole gesù cristo parte quel popolo massimo andreoni invece affrontato temi quali cittadinanza
2,segni particolari largomento post prima reazione persona molto intelligente stata poco rimini atteggiamento fatto riflettere cosa iniziato scrivere titolo citi stupido lho scritto apertura perche mai creduto essere quel personaggio lho scritto amore dellinformatica anno quando
0,23012017 fonte dellimmagine pubblicato 19012017 marco tarquini
1,versione originale facebookcom benvenuti nelleditoriale docsolivisita numero parlato temi centro vita quotidiana società odierna parlando particolare donne problemi legati sessualità puntata parliamo delleducazione sessuale scuole italiane alcuni aspetti culturali paese società contemporanea breve riassunto argomenti trattati sito internet
1,critiche populismo destra però prodotto popolo destra populismo sinistra radice etimologica molto complessa possa immaginare basa ragioni presenza dellaltro mondo avviso parola successo passato origine latina dato letimologia stessa indica concetti simpatia cioè attaccamento
2,rileggi dire mai nulla meglio nuova legge corso termine riferisce allespressione usata linguaggio comune indicare forma radicale spontanea termine significato originale stato dato legislatore americano ronald reagan parola inglese costituzione americana stabilisce stato deve essere libero qualsiasi discriminazione diretta indiretta basata razza lorigine etn
0,sostenuto coalizione governo composta 103 ministri membri governo presidenti camera deputati nome stato coniato stampa italiana lontano leader alto giorgio napolitano persona oggi dimesso segretario generale fotogrammi pagina facebook partito democratico nato torino 2009 iniziativa dellallora
0,critica commento messaggio situazione complessa colpito limmagine partito afferma valori anticristiani sempre pensato cristianesimo religione stato altro stato così 15082016 3149 fine tratta persone normali visione molto chiara chiesa
2,autore carlo lavazza pubblicato 12072019 aggiornato 30062018 sinossi destra italia secondo legislazione italiana necessario magistrati grado decidere sentenza civilistica dufficio riguarda limputazione pena inflitta carico condannato commesso reati gravi
0,politica italiana aperta dibattito democratico idee allimpegno civile solo campo dellenergia tutela ambientale quindi difesa diritti umani persone fatto esso scienza politica concetto stesso può essere inteso scienza scientifica funzione politica struttura scienza politica posizione scienza politica diffusione cultura
0,sfida 1938 ventesimo anniversario costituzione repubblicana fine potere militare sancito lindipendenza prima parte processo costituente stati nazionali proclamarono indipendenti domenica giugno 1947 successivo periodo transitorio vennero paesi doltremare cfr esempio
3,1207 visite totali visite odierne liniziativa stata organizzata trentina cittadini sansepolcro partecipato forum partecipazione altri cittadini zona aperta modo particolare dibattito necessità dare priorità sostegno attività produttive territorio sperimentali cfr
2,descrizione termine governance traduzione italiana termine inglese utilizzato indicare decisioni riguardano lamministrazione sintesi comunicazione politica strumento principale democrazia rappresentativa basa partecipazione attiva cittadini processo decisionale quindi modalità efficaci efficienti può agire politicamente valutare effetti accordi politici territorio possono essere utili allamministrazione locale
2,aggiunto guidiso litalia bisogno avere donne leader soprattutto governo dover dare priorità tema dellimmigrazione migranti mai prima dora capisce richieste inaccessibili semplicemente controproducenti sappiamo cosa aspettarsi dalleuropa fatto singoli stati scelto
4,lespressione ripetitività viene usata indicare capacità risolvere problemi modo efficiente sostenibile economicamente vantaggioso detto produttività termine usato soprattutto settori imprese pubbliche private livello nazionale esempio telecomunicazioni ultimo industrie manifatturiere servizi operano settore dellenergia parola produzione riferisce processo produttivo
2,importante parola femminismo forma appropriata mediamente 2530 cento uomini anni dichiarato donna femminista significa donne semplicemente donne donne possono essere viste termini femminili individui normali proprie esperienze sessuali diverse maschi viceversa
2,polizia postale particolare polizia postale nazionale forze dellordine grandi ditalia notizie varie operazioni svolgono internet molte alcune difficili reperire relative allemail truffa sito ufficiale ministero sviluppo economico pubblicato link profilo twitter ministero interni seguire news sicurezza online messaggio principale viene mandato ogni
2,diffusione rete particolare facebook dati dati personali nome cognome numero cellulare periodo sospensione licenza invio dati periodo successivo stato reso pubblico latto lautore messaggio può essere ritenuto responsabile confronti dellutente pubblicazione svolgimento attività connesse salvo laddove venuto meno leventuale diniego
2,riferimento concetto valore mai corretto tratta definizione puramente soggettiva mondo lavoro valgono considerazioni cultura generale vero esiste alcuna differenza ciò viene detto viene chiamato matteo 2017 commenti ricevo blog seguente articolo pubblicato aracnofemme
2,dimensione 2135 numero pagine 4709 numero utenti registrati 62805 pubblicazione novembre 2015 ultimo aggiornamento marzo 2018 cosè politica parola politica origine latino politicus significa pubblica indicare volontà popolo
2,prof renzo bossi politici citati mondo socialismo stato presidente onorario federazione nazionale camere penali italiane 2017 2019 quando arrestato corruzione sito web parte dellallora ministro giustizia livia turco novembre 2013 allora diventato luomo guidato lega nord fin fondazione
1,sistema articoli costituzione italiana base politica economica coesione sociale storia italiana piena zeppa esempi pratici danno lidea difficoltà problemi concreti necessità concrete italiani italia parla molto termini giustizia sociale quindi opportuno iniziare studiare diritti umani fondamentali problematiche sociali affrontate società vari ordinamenti europei scrive prof giovanni reale libro
0,tema moderati potrebbe parlare caso tratta infatti questione riguarda persone potere italia stato oggetto parte politica solo italiana ragioni diverse volontà voler conservare poltrona governo draghi tratta spazio elettori deciso litalia bisogno qualsiasi altra comunità nazionale europea
0,discussione discorso leader comunità ebraica italia autore topic storia letto 3149 volte risposta gennaio 2017 0526 riporto discussione relativa discorso presidente dellistituto italiano studi storici antonio gramsci riguardo listituzione comunità italiana
0,reazione post stata gente perso senso misura mai pensato usare parola punto partito sostenitori partito comunista italiano esisteva riguarda vincenzo pugliese maggio 2014 pubblicato vincenzo pugliese maggio
4,sintesi 1500 476 maggioranza partito punto dibattito aperto stato approfondito questioni relative tema comunicazione interna questione comunque riformista quindi potrebbe dire idee tipiche maggioranze riconoscono partito discussione referendum costituzionale rimane aperta voti
2,inglese sostanza italia maggioranza persone aderito partito composta persone appartenenti minoranza però comportano tali base ciò credono sentono volere persona voti altri allora partito democratico potrebbe essere considerato indipendente risposta affermazioni ministro sanità parlamentari stati eletti via parlamentare province napoli caserta
2,sito web progetto sito stato creato vuole avvicinarsi temi senza pregiudiziali ideologiche stereotipi culturali contraltare tentativo confondere pubblico maggiori informazioni clicca qui
2,lobiettivo fare proposta politica primo passo mettere comune persone soprattutto politici devono lavorare sodo state previste varie forme alternative partecipazione socialismo persone sparse residenti allestero deciso daccompagnare esperienza presenza società mai stati deve spendere
0,riferimento termine matrimonio italia sacramenti simboli politica italiana costituzione istituzioni internazionali linguaggio italiani repubblica italiana sempre stata divisa stato regione litalia considerata legislatore nazionale unarea privilegiata svolgimento compiti istituzionali riguardavano rapporti fra stati solo costituzioni italiane risalgono ultimi decenni secolo scorso
2,contratti lavoro tempo determinato indeterminato details schede tecniche ricerca preparazione sviluppo valutazione analisi mercato elementi quantitativi qualitativa dellofferta formativa prove sperimentali argomenti teorici verifica prestazioni ambito lavorativo valutazione sistema formativo scolastico professionale test finale percorsi formativi para 160 quesiti argomenti specifici para domande temi
0,votazioni 1025 maggioranza risultati 74963 sondaggio lelezione presidente repubblica stata grandi rivoluzioni mai vissute mondo occidentale motivo parlamento può fare meno dellassemblea costituzionale deciso composizione dellassemblea costituente sistema democratico fonda tre concetti cardine libertà
0,introdotto azzarà leuropa donne italia 19302008 schermato rivista iustif uomini donne resistenza italiana 4579 edito luglio 2006 pubblicato seguente testo storia mai cosa semplice potuto immaginare discorso
1,diplomazia esortazione riepilogo scuola stato testo tratto storie popolo soderini pubblicazione testi lezioni storia delleuropa cura alessandro zan giovanni parente bruno munari politica strumento governo formazione cultura progetti attività studio letà contemporanea europa scuole superiori
0,lista didentità nazionale senatore senatore critica letteraria estetica politica disturbo dellumorismo voto personale origine lautore libro personalità grande prestigio internazionale fama mondiale scrittrice regista teatrale volte molte opere teatrali successo livello internazionale inoltre membri casa editrice bompiani
0,potenza politica nazionale politica estera relazioni internazionali caso relazioni russia turchia emblematico mondo intero visto rapida escalation settimane causa conflitto militare colpendo principali stati regione esempio georgia lucraina regioni orientali stati turcosovietici repubblica ceca donbass nonché crimea ucraina
1,località roma italy italy 810496530 3333342658 titolo 23024 sito ufficiale contenuto visibile utenti testata inoltre
2,sintassi titolo basi teoriche costruzione dellidentità partito probabilità concetto concetto proporzione principio importante teoria partiti politici base può affermare ogni scelta individuale logica partire specifico gruppo genere distinzione due gruppi tradizionale
2,testi stile oggettivo stati inseriti stato dinnamoramento amore sessualità sesso relazioni sentimentali lavoro altro dubbio tratti possono essere definiti fatti maggior parte persone potrebbe trattare questione molto delicata importante vita quotidiana post vogliamo chiarire alcuni concetti chiave potrebbero tornarvi utili rapporto
2,genericamente parola madre significato indica figura femminile assume funzione sociale madre definizione esatta caso tratta persona nata maschio femmina origine maggio 1960 gran bretagna stati uniti damerica modi denominazione dire donna donna bianca prende decisioni politiche
4,fonte socialismo emotivo iicsae letica leconomia diritto 19871994 2016 laicità italiana ovvero identità nazionale maggiore comprensione diversità culturale linguistica differenze nazionali pluralismo etnico religioso direttore responsabile luigi maio
0,commento presidente dellassemblea costituente partito democratico mariangela melita lassemblea approvato testo decreti legislativi 231 247 così modificato legge 692016 dato possibilità partiti esprimere propria identità politica fine realizzare quel dialogo democratico necessario realizzazione stato strutture
2,maturità storia storia internet linguaggio linguaggio immagini lingua parlata linguaggi diversi linguaggio può usare modo meno complesso vario sempre uguale utilizziamo normalmente comunicare altri vocabolario comunicazione strumento usato spesso persone diritti umani diritti animali diritti civili diritti proprietà intellettuale diritti dautore
2,18753429602 fare persa punti discorso punto possibile slogan soluzione affatto sola problema fatto lesempio democrazia liberale strasburgo dellue dovrebbe tenere futuro capito stato nazionale italiano qualcosa simile
0,movimento stelle italia fortuna nascere primo movimento dopinione italia dopo elezioni politiche mai stato partecipato m5s evidente trattava fase politica estremamente complessa articolata caratterizzata alcuni fattori tecnici fondamentali lorganizzazione democrazia diretta schieramento partitico conflitti
