sentiment_mapping,processed_tweet
2,sostanziale linea generale necessariamente espressione potere atto autoconvinzione critica misura possibile popolo possa essere pronto riconoscere ciò giusto fare pensiero religioso può assumere tratti diversi personalità principio ognuno opinioni propria opinione pensa comportamento ogni situazione trova coinvolto
2,già detto tratta pratica strategia terrorismo stampo sovietico sistema sanzioni occidentali stato messo prova diversi mesi prima minaccia russa stata presa seriamente rinviabile leuropa reagito bene crisi ora paese bisogno prospettiva diversaiscriviti the blog voci 105 blog archive
0,normativa riferimento legge 640 dicembre 2008 disciplina rapporti privati cittadini italiani enti pubblici legge quadro diritto dautore larticolo decretolegge febbraio 2006 modificato lart comma legge 640 diritto dautore
2,personaggio pubblico grande azienda servizi finanziari londra gran bretagna dipendenti stipendiati politici daffari stati ingannati propaganda online social media capo presidente camera comuni vicepresidente lex vicepresidente bill clinton ministro interni james mattis lavoratore fidelity investments ltd costruttore principale
2,voto nota seconda casi possibile usare esprimere propria opinione può dire voto espressione diretta volontà popolare merito elezioni politiche maggioranza aventi diritto voto regionali partito unico nazionale limportante consenso dellesistenza reale cose votare alcuni partiti politici prevista lelezione diretta presidente repubblica
1,riforma fiscale sola grande rivoluzione iniziata qualche decennio stata maggiori innovazioni tecnologiche economiche secolo modo diverso alcuni aspetti importante molto discusso riguarda levoluzione tecnologica visto sistemi informatici evolversi sempre poteva aspettare linnovazione tecnologica cambiando regole riguarda moneta unica infatti nuove forme pagamento elettronico
2,email inst puoi scegliere categoria interesse usando campo apposito puoi aggiungere categorie ottenere informazioni aggiuntive ciò offrire base impostazioni browser puoi decidere aggiungerle predefinite menu principale altre preferenze quando soddisfatto dati personali richiesti clicca pulsante completare lordine vuoi modificare dati personali durante compilazione modulo processo
0,responsabilità politica informazione politica critica sociale ideologia cultura autore rivoluzione verde einaudi autori benoit björn andersson martin reinert jeanmarie strauss mitterand 1960 diritti civili sinneri storia rivoluzione francese jfreud
2,parole chiave posizione politica potere parole chiave riferiscono situazione emergenza politica necessario agire ottenere potere esecutivo legislativo definizione può essere esaustiva deve essere condivisa coloro opinioni politiche diverse ogni parola efficacia maggioranza casi quindi bisogna fare attenzione scelta governo turno genere meglio evitare luso lingua italiana
4,vota partito coalizione modo coerente necessario avere politica destra sinistra essere efficaci lotta populisti nulla preoccuparsi quindi continuare fare ciò detto punto centrale movimento stelle vinto elezioni 2018 stata lunica volta stato eletto solo
2,riforma sinistra solo parole livello mediatico lidea fondo democrazia diventata trasforma qualcosa diverso ciò già esiste forma governo dovrebbe essere lunica cosa conta interessi individuali problema valori tradizionali rendere processo trasparente rispetto grandi poteri dominato
1,riforma processo penale riforma procedimenti penali reati politici serie governo stati uniti deuropa bosniaherzagazija leggi intercettazioni telefoniche titolo soggetto stato stato diritto interno costituzione istituzioni diritto pubblico stato costituzionale descrizione costituzione italiana fondata sullarticolo 309
3,10825 durata minuti secondi pagine formato pdf traduzione italiana popolo italiano diviso due parte meno ristretta nessuna voce politica frase potrebbe aggiungere seguente messaggio risulta lespressione popolo italiano diviso sintesi popolo italiano cerca posizione politica senza prendere
2,definizione possibile parlare modo partito democratico grillo discorso stato alquanto lungo potrebbe essere necessario approfondire nasce sponda lega nord lega nord prime formazioni politiche dato vita storia stata democratici sinistra formazione orientò verso lelettorato moderato partito socialista guidato
1,riporto parte domanda iniziale presidente repubblica nome persona piuttosto ambiziosa ovvio stato stesso presidente consiglio ministri chiamare giornalisti prendere laereo privato andare roma aeroporto certe cose sempre fatto comodo però scritto detto vero potuto scrivere voleva dire qui
4,20201130 sostegno partiti risposta favore delleuropa stati uniti dettano lagenda futuro periodo compreso fine guerra ucraina primi mesi prossimo anno fiscale particolare lamministrazione biden pensando allintroduzione diritto comune cittadini stati membri dellunione europea potranno esercitare restrizioni territorio
2,temi trattati post aggiungere unimmagine profilo twitter esempio ecc ecc nome dellutente sopra twitter limmagine deve essere visibile utenti base stato attuale utilizzo contenuto può contenere errori grafici informazioni aggiuntive devono essere visualizzate immagine immagini messaggi vengono
2,scusate capito scritta litalia scritta inglese sommario punto vista politica estera dellue partito stato creato donald rumsfeld 2019 vinto presidenza gruppo parlamento europeo commissione europea sondaggi dicono partito ottenuto circa milioni voti andato elezioni tedesche
2,testo disponibile parola composta lettere trova myblog bloglovin forum utilizzano prima volta annualmente internet archive vedi scheda personaggio sezioneasean ricerca originale google politica oppure economia cultura piace politica iscriviti totooncom benvenuto blog
4,sostanzialmente partito democratico elettori mondo membri partito votato stati uniti repubblicani particolare vinto cina 2014 978 stati sconfitti causa disuguaglianza nord sudest asiatico forza governo basa leader stato eletto gruppi etnici orientali
2,sinossi forse sanno persona sempre stata valori democrazia rappresentativa molti casi mezzo secolo quasi 100 anni storia passato stati base stessa partito campo istituzioni democratiche lidentità nazionale italiana deve essere rispecchiata società civile proposito problemi roma prima volta incontrato
0,virale politica già detto altre occasioni cerca sempre pensare storia esiste trova essere incapace andare oltre proprie convinzioni niente fare devono dare priorità propri pensieri proprio pensiero stato dellarte vita civile istituzionale italia così giorno
1,discorso presidente repubblica autorità parlamentari altri ministri introduzione questione dellimpunità reato clandestino stato sottoposto provvedimenti giudiziari processuali articolo 291 bis procuratore capo affermato decisione magistratura italiana legge testo provvedimento può essere adottata entro due anni data commissione dappello dato
1,traduzione segnalatore inglese pur caratteristiche importanti lingua inglese frasi politici generalmente utilizzate sinonimi terminologia politica tuttavia necessario sapere accezione esoterica giorno doggi ecco breve spiegazione termine esempi significato noto governanti dovrebbero rispettare standard internazionali atto unico 2016 parlamento
0,scelta sinistra radicale critica sinistra informativa 268 scelta destra radicale rivoluzione politica luogo politica società culture mondo antico commento 105478 messaggio inserito cesenzalucana data dicembre 2019 sottotitolo persone rendono
4,buddy list serie articoli tema elettorale politico mette guida partiti politici termine partito deriva fatto programmi elettorali vengono scritti commissione parlamentare riforme lultimo articolo dossier contiene alcuni argomenti caldi futuro dellitalia prossime elezioni politiche riforme costituzionali limmigrazione altre questioni importanti riguardano politica estera nazionale
4,cultura generale educazione politica italia scuole parlamento italiano ancora molto importanti problema confronta spesso distanza storica esiste alcuna informazione ciò leducazione giovani deve essere importante alcuna opinione pubblica reale necessità formare propri figli attraverso scuola può avere conseguenze negative famiglie società complesso momento propaganda elettorale sembra
0,interrogati sullargomento tratterebbe solo questione slogan personaggi politici seconda dellopinione bensì sportmovimento strumento arrivare risultati esempio dibattito salvini stato portato avanti pochi esponenti partito governo renzi calenda lega fatto altrettanto quindi partiti dopposizione generale
1,voto 455 lintervista stata realizzata giuseppe strangio corso dellassemblea generale iscritti cittadini cittadini tenutasi presso sala convegni palazzo ducale venezia lintervento introdotta presidente forum pai luigi marinelli aperto riflessione situazione italiana tema riforme costituzionali riguardo segnala contributo roberto
2,testo stato pubblicato rivista società numero 103 giugno 2009 giornale tiratura 546 850 oltre doppio normale mentre versione cartacea pubblicata nelledizione novembre scorso strumenti stampa nuovo articolo questione intercettazioni telefoniche silvio
0,pressione parametro fornisce lanalisi testo citazioni due autori entrambi certa affinità livello voti numerabili inst iris aggiungere valore traduzioni stato complesso traduzione soprattutto complessità struttura usato versione italiana stati usati sottotitoli modo molto efficace rispetto
2,significato contagioso inglese definizione inglese parole global warming diventate legali mondo parola piace niente quando parla globalizzazione comunque quando pensa temi solo limbarazzo scelta termini utilizzati terminologia ovvero legati parola
2,motivo dittatore termine sempre senso luomo persone considerate base comportamento condotta individuale bisogno essere etichettate società vittime violenza capacità sentirsi onesti allinterno contesto sociale culturale dellindividuo modo politico moderno comporta vuole rivelare
1,traduzione dario franceschini popular 100it bloodym blog politica italiana parte clicca qui biopolitica dintorniaerei dario franceschini seconda guerra mondiale finita aerei vanno usati trasporto pianeta terra allora situazione critica ultimi
0,scrivere qualcosa negativo spesso fonte confusione cosa importante scrive post linguaggio legge commenti scrivere modo neutro volte può far sembrare cose facili leggere informazione voto commenti segnalo interessante articolo marco taruscio vita politica rubrica fatto quotidiano dedicata tema
0,ordine alfabetico nomi propri tratti istituti italiani lingua italiana italian language association istituzioni straniere riconosciute ministero esteri italiano particolare nome repubblica italiana presidente repubblica italiano senso lato litaliano lingua ufficiale utilizza comunicazioni ufficiali cognome diffuso mondo distinzione persone fisiche numeri civici fra cognomi italiani
0,scelta dellappartenenza sociale popolo italiano comunità scopo scopo cittadinanza italiana necessariamente coincidente patria comunque linea generale interesse pubblico interesse comune ricerca verità interessi pubblici interessi comuni progetti europei interesse privato interessi individuali interesse collettivo interessi sociali interessi collettivi
2,commento berlusconi monti questione altro questione politica risposta sembra abbastanza chiara suggerita certo punto vista opinione draghi fatto bene mettere mano spesa sanitaria evitare tagli servizi sociali tasse stata fatta così problema vero cittadini italiani
2,twitter glamorg originalità lautore scrittore lautore serie persona scritto romanzo maggior parte libri stati pubblicati diversi editoriali diversi lavoro nessuno stato pubblicato italia anni 2016 pubblicazione
4,temi m5s libertà dinformazione valori ispirano movimento stelle mediazione politica mediazioni elettorali fonte comunicato stampa bilancio 20172018 gruppo parlamentare cinquestelle approvato proposta legge sanzioni penali intercettazioni telefoniche emendamenti riforma intercettazioni
4,indice lingua inglese inglese lista completa definizioni direttore state aggiunte pagina puoi usare filtro risultati ricerca selezione rapida sinistra destra ultime novità punto vista dellunione europea particolare relative lotta covid19 diffondendo sempre rapidamente stati membri vediamo passi principali seguire
0,fonte dellimmagine twitter costituzione europea 20172019 costituzione strasburgo lse diritti umani diritti umani diritto privacy diritto alloblio diritto penale dopinione diritto internazionale conflitti internazionali diritto umanitario cooperazione polizia giustizia civile internazionale lavoro lingue straniere libertà parola libertà religiosa legge applicabile vita politica sanitaria politica estera protezione proprietà intellettuale
0,argomenti social networking social network social network sistema valori relazionali social networking esposizione problema comunicazione sociale senso dellabuso ambito sociologico proporzione individuo individuo valore viene prima acquisito attraverso percezione relazioni sociali allinterno gruppo lindividuo riconosce nellargomento lavoro incent
0,possibile ministro salvini mosso tempo affrontare questione sicurezza stato stesso capo governo dire fonti istituzionali linvio armi nellarea dellucraina avvenuto pieno rispetto libertà individuali diritti fondamentali così maurizio sacconi presidente dellistituto superiore sanità iss risposto alcuni interroganti vicenda relativa allapprovata legge scambio
4,programma riferimento ipsos complessità esecutivo definizione partito democrazia diretta stato fondato giovanni poggi formato 1967 antonio saccone figlio francesco totti membro partito popolare italiano fondatore altri partiti successo idee politiche state utilizzate gente comune varietà situazioni
0,genera possibile tweet politico seguente quesito diretta mai sentito modo così tanto violento schema usato salvini lattentato colpito germania ora tweet può ripetere quel punto dovremo dire conseguenze aggiornamento maggio 2022 tempo russia tentando eliminare migranti
1,struttura bandiera nome grusso michele password vignetta citazione grusso settembre 2006 1457 qualcuno già fatto lidea questama fare dica capo
0,astratto sincerità serietà onestà lingua italiano dimensioni dellimmagine pixel 1728x964 numero messaggi 3905 profilo privato pseudonimo tipo messaggio generale introduzione parole descrivere persona scelto nome utente scrivere qui sopra perchè molto
2,intervista alessio lubin fondatore dellassociazione anazionale genitori diritti figli minori aigd racconta lavoro ricerca campo altre cose solo famiglia nuove generazioni autore libro ruolo donne società italiana stato relatore numerosi convegni scientifici temi genere bianca cominciato lavorare
1,valori cosa seria condizione possibile necessario parlare vita persone modo esplicito nulla volte tratta concetti astratti lamore stesso essere importante vita prima mondo intero dovrebbe chiedersi realmente cosa vivere veramente potremmo diventare mai qualche persona fatto meglio
3,iscrizione tribunale milano data 06122005 direttore responsabile mauro vitali piva 97834850154 contenuto stato pubblicato sito web voce siti seguito site presente informativa resa sensi dellart dlgs 196
0,violenza propaganda luso linguaggio pubblicitario contrario allintimidazione interessante etichette cultura politica fatti opinioni libero paolo rastelli settembre 2013 fino punto saprei davvero iniziare libro intitolava sorta piccolo manuale dimp
0,problema cose così cattolico esempio penso libertà religiosa cattolica certe forme culto credo libertini movimento diritti civili gay penso allidealismo ogni tipo pensiero filosofico qualsiasi religione base religioni circondano fino dogma male assoluto penso ancora cultura sopravvivenza
2,scrivi messaggio inviare commento possibile salvare voci forum senza autorizzazione sezione risposta viene visualizzata quando tenta rispondere domanda precedente grazie categoria elencati seguenti argomenti politica democrazia economia internet media tecnologia diritto internazionale può essere visualizzato qui disabilitato javascript poter postare commenti assicurati
2,fonte
2,costituzione italiana art 130 stabilisce repubblica riconosce diritti inviolabili delluomo diritto vita allintegrità fisica psichica impone governo italiano lobbligo pieni poteri rimuovere ostacoli giuridici limitano addirittura impediscono svolgimento potere stesso carta diritti fondamentali nazione dichiara infatti ogni individuo pari dignità sociale base dover
0,livello governo controllo profilo segnalo vota visita importa piace necessario stato danimo vuoi senza pensare cosa visitando desideri essere aggiornato attivo argomento segui termini servizio ogni utente lobbligo legale usare diritti qualsiasi momento sito web
1,puoi inviare tweet lautore mail segui post twitter facebook vedere commenti twitter leggere mail euracanna siriaglobalist maggio 2021 lista minacce siria
0,primo post secondo post politica arrende arrocca solo cosa chiara questione morale alcun senso quando presidente consiglio deve rispondere modo adeguato partito può essere corretto allora solo magistratura ordinaria
1,nota funzione moderata quasi esprimere punto vista forma concetto astratto conseguenza inettitudine fatto qualità essere espresso meglio stato già espresso proprio partito quindi può essere inteso contenuto alto rispetto formale lobiettivo primario dare dignità discorso comunicazione politica limita
2,inglese pubblicato lauricella 175428 commenti etichette comunicati economia europa italia opinione politica religione società unione europea terrorismo usa bello vita festa lautonomia territorio anteprimaprofessionistiit home corsi formazione professionale libri film
2,fonte dicembre 2015 ddl 336 legge bilancio 2016 cosa cambia senato approvato
0,significato esiste definizione universitaria molti pensare persona mai stata degna propria immagine termine sentimentale stato coniato martin luther king risposta famoso discorso modo potere limitato confini delloccidente democratico dunque libertà individuale società perso ogni capacità comprensione allorché persone tendono essere considerate inferiori
3,ignotizia 2013 casa donne aggiornerò discussione qualche giorno cornice normativa consente fare stessa cosa argomenti diversi comunque simili elencati sito camera deputati fatto diritti molti pochi essere considerati allinterno sfera privata poi altro aspetto
2,lopinione pubblica italiana divisa tre categorie opinioni politiche state chiamate giuste sbagliate lopposizione politica maggioranza ristretta sinistra partiti politici tradizionali pdci lincrocio regole prima divisione poteri destra opposizione politica centrosinistra destra possono essere divisi popolare parola democrazia riferisce democrazia parlamentare
0,23012017 185946 tratta dibattito mai condiviso tema rapporto liberalismo socialismo viviamo periodo vivendo unepoca storia delloccidente stato sicuramente duri morire dopo caduta muro berlino cosiddetti socialisti comun
4,descrizione pagina trovi link traduzione parola chiave inglese altre lingue puo scrivere sito fare richiedente link immagini pagina 1325 406798 facebook scrivere messaggio testo pagina ufficiale sito
1,costituisce tema riforma delliva regime maggior tutela contribuenti emettono obbligazioni termine intende tributo speciale detto credito dimposta generale quota parte variabile base disposizioni vigenti nellambito beni strumentali oggetto acquisti parte stato beni durevoli servizi accessori lacquirente finale tipo
1,sintesi progetto prevede ogni cittadino possa presentare propria opinione allinterno parlamento occasione lavori costituente tale attività verrà svolta redazione repubblica occupa dellunità ditalia fino giugno 2019 termine ultimo inviare proprie opinioni proposte potranno essere inviate via mail infoit oppure tramite apposito form online sito rep
2,mostra codice caratteri firma partito democratico discussione generale tema lavori corso questioni riguardano partiti politici interessante vedere situazione evoluta tempo cercare trovare soluzione varie criticità presenti periodo storico rimane argomento molto importante ancora affrontato luce ultimi avvenimenti esempio lidea
1,verso voto italia elezioni politiche cerca fare meno prima volta sentito termine venuto solito penso sostenitori seconda repubblica votato destra lelettore scelto sinistra fatto centrosinistra stati delusi opinione personale perchè credo contrario esempio elettori usato
2,ancora fase attuativa lavorando legge equa persone testo riforma stato presentato senato gruppo partito democratico camera deputati 2018 poi ripreso commissione affari costituzionali marzo scorso tratta legge prevede lintroduzione dellequo compenso deputati senatori appartenenti gruppi politici italiani ora solo
4,rischio economico debito pubblico dissesto idrogeologico definizione stata adottata corte conti prima volta 2016 visto iter istruttorio grado fornire risposta esaustiva problema tratta dunque caso isolato approccio alternativo allapproccio adottato dallunione europea lemergenza covid19 singoli stati membri
4,forma sostegno contenuti politici senso ampio causa struttura sociale implicazioni legali lobiettivo principale blog fornire utenti informazioni ciò cercando bisogno aiuto ottenere messaggio semplicemente vuoi essere informato cose sapere prima pubblicare qualcosa post posto giusto nome cognomi cultura interessa nulla
0,cosa pensare essere chiari giornalista moda persona piace fino qui bene forse comodo fare lantipatico voglio tratta persone serie idee progetti politici diversi rischio maggiore corre qualità personali migliori ragazzi esempio fondo italiani sentono superiori
0,1453 sinossi pochi giorni morte avvenuta marzo 1978 fratelli bandi sante trovano prima volta affrontare elezioni politiche gruppo lunga storia partiti politici percorso stato caratterizzato scontro diretto sinistra momento dellelezione deputati camera lista civica berlusconi mentre partito democratico composto
2,fronte necessità testo essere compresi deciso attribuire ciascuno soggetti funzione far emergere contenuti parole chiave essi inserite propria proposta editoriale tratta particolare scelta consapevole lobiettivo rendere consapevoli persone dellimportanza tale tipo comunicazione utenti possono quindi esprimere proprio parere attraverso linguaggio personale unimmagine diversa rispetto ogni altra cosa pubblicata social network
2,letteratura politica società civile psicologia incontri sociali lesperienza dialogo individuo comunità levoluzione cultura massa italia cultura identità società civile aspetti giuridici relazioni intersoggettive formazione scolastica docenti scuola primaria secondaria allinterno dellue casa sempre stata prima abitazione racconta così protagonista alberto angela
4,identità territoriale diversità cultura cultura letto articolo diversi modi stato utile 4502678 piace larticolo 1943 1990 intervista rino giacalone relazioni politica immigrazione punto vista italiani solo testo scritto alcuni personaggi partecipato vita culturale regione campania
2,tema partiti politici devono far fronte radicale trasformazione dibattito tema quindi aperto può parlare solo dellaspetto tecnico semplicemente contenuto questione rivoluzione social network luogo quando modernizzazione modalità duso strumenti comunicazione tradizionali pensare mondo digitale opportunità fare concorrenza mercati digitali elementi spinto
2,missionario partito potere mai dire leader possono essere divisi svuota scena politica parte capo coalizione membri esempio avversari politici cosiddetti punti forti uniti partiti tradizionali maggioranza casi raccolto accuse presidente quando dice nulla nascondere lopposizione governo caso
0,posizione proprio stabile abbastanza rumorosa molto rumoroso segno rappresenta minaccia sicurezza nazionale solo potere causa uso improprio forza può portare conflitti aggressioni settebello ferrari 20182019 pagina 754 motormagazine ferrari racing team italia speciale
2,soggetto soluzione optional option_datetime titolo generico lordinamento opzioni binarie 2019 viene utilizzato automatico altre piattaforme voli zagabriabologna 58476 virail cerca voli convenienti tbilisi verso bologna 30139 virail trovi cerco
2,17062019 lhashtag russianow stato usato modo sproporzionato mezzo propaganda russa pare grande maggioranza popolazione russa interessata tema grillo napoli litalia votato referendum cinquestelle seguito referendum popolare uscita parlamento italiano quesito referendario
0,nome dellautore destra destra termine identifica partiti politici affatto casuale senso comune termini infatti parola politica deriva latino politica parola viene usata riferirsi qualcosa rilevante intendere strumento potere forza sociale specifica leconomia pratica linguaggio corrente intende dire ciò produce cambiamento nellorganizzazione
2,punto questione linsegnante capacità apprendere insegnante competenze importa mestiere svolga lavori computer base alletà lunico modo raggiungere tale scopo diventare bravi scuola giorno instimato necessariamente forma scritta commenti pubblicato marco grisolia pagina ufficiale sito ufficiale dellist
1,concordo fatto prima parte questione stata largomento principale testo molto chiaro capito può definire discussione politica senso stretto stato primo parlare qualcuno progettonon sapevo nulla toni vero risposto messaggio giorni giornalista perciò dico difficile scrivere caso
2,discussione socialismo democratico italia partiti politica rapporto stato cittadini storia capitalismo italiano risorgimento fascismo italiano litalia postfascismo anni resistenza nelleuropa dellest leggi razziali costituzione italiana questione morale paese mondo occidentale 19452013 concetto partit
