sentiment_mapping,processed_tweet
4,distinto volte legge dice cose possono fare problema fargli capire qualcosa allora due strade segue serie frasi tono esuberante passare secondo piano significato prime tre frasi perentorie tutte interessanti riguardano temi importanti rapporto giustizia penale giudici pace diritto
1,partiti politici novità elemento continua evoluzione particolare cosiddetto socialismo vedi sotto stato temi controversi ultimi anni potrebbe dire ancora oggi persone pensano legittimità garantita apparenze democrazie occidentali berlinguer considerato molto critico confronti democrazia partito comunista vinto però referendum 1986 grazie rifiuto
4,potenza rispetto lambiente capacità lavoro ambienti difficili raggiungere caratteristiche dellitalia viviamo oggi paese realtà difficile impossibilee punto cosa fare paesi mondo sicurezza paese bene deve essere molto attenti cose inoltre maggior parte dati bilancio forze armate positivi
2,possibile parlare politica senso stretto lue pagina corrente può considerare base elettorale governo deve essere strumento realizzazione motivo deciso cancellare partiti politici europei contesto parlamento europeo problema stato già affrontato 2013 durante scandalo fondi allinterno dellue seguito commissione europea decise
0,significato termine partito sostantivo inglese partito indicare parte politica rappresentata serie partiti politici significato comune deriva fatto esiste definizione ufficiale tali partiti tuttavia comunque utile sapere trovano riferimenti letterari storicopolitici storici sociologici definizione nomi partiti molto varia comprende schieramenti politici
4,tema valori famiglia lavoro competenze chiave ambito familiare disabilità temi vanno affrontati modo corretto motivo importante trovare giusto equilibrio differenti aspetti dellidentità sociale famigliare essere grado comunicare efficacemente scelte professionali altri membri famiglia concetti base comprendere affrontare problemi relativi famiglia possono essere riassunti così vorrei sapere
2,sinossi prima edizione libro stata pietra miliare storia italiana rivoluzionato linguaggio parole attraverso lettere dellalfabeto stato importanti testi letti durante lesame critico letteratura storica italiana ultimi anni volume vengono riportati risultati preliminari alcuni lavori tratti ricerca testo presente messaggio intitola aggiornare lingua italiana
2,controversia stato 20181945 litalia repubblica parlamentare governo nazione appresta votare costituzione repubblica democratica fondata principio primato parlamento maggioranza opposizione legge fondamentale stato lassemblea viene costituita essere esercitata solo uomo eletto popolo momento stesso lassemblea decide
2,opinione pubblica 1017 pubblicazione testo breve discorso commento contenuto stato pubblicato blog haiku magazine inviato pensieri autore pablo
0,due persone distinte amore propria città natale parlato pubblico critiche negative sindaco luigi magistris state spesso interpretate parte dellopinione pubblica soprattutto parte attivisti centri sociali discorso luca governo stato seguito movimento civico insieme mafie definito rapporto politica società civile causa alcuni articoli presunti finanziamenti illec
0,interviste commenti altri progetti nuovo programma partito democratico bersani pdl esiste lunico promotore nuova proposta politica pdl deciso dare vita partito democratico vera democrazia sito politica nazionale grande opera fare senza partiti controversie damore sfida
2,lesempio persona può essere considerato potente comunque necessario maggioranza cittadini italiani votare democrazia deve nascere italia caso europa america meglio discorso presidente americano premessa opinioni personali considerarsi valide qualsiasi cittadino italiano sempre pensato argomenti importanti parole quindi qui credo lavoro
2,contenuti correlati politica immigrazione italia leconomia italiana sistema paese delleuropa governo stati uniti damerica nuovi mercati lavoro cura fmi strumenti giuridici protezione lavoratori immigrati mondo sfide poste legge 180 cittadinanza stato sociale ungheria grecia malta belgio paesi bassi
1,modifica termine risolto commento relativo post originale calce allarticolo prega notare articoli disponibili lingua italiana fisco 150 euro famiglia così pagano tributi vvox fisco 150 euro famiglia così pagano tributi governo draghi
0,critica post proposito guerra gran fan harry potter religione storia hogwarts vogliano figlioli tratta certo commento offensivo censurabile modo evoluta parere parole scritto riguardo adatte discussione politica affrontato piccolo gruppo
0,lanalisi argomento molto difficile credo gente preoccupi bisogno ulteriori informazioni twitter facebook altre piattaforme social usa lhashtag ottimismo 240 caratteri grassetto tag sottotitoli clear bill rights nota bene lequivalenza cognome
2,sito web fonte dellimmagine immagine evidenza nuovo governo vuole fare meglio possibile popolazione solo minoranza storia lega nord cambia nulla rispetto passato
1,concetto riassunto parola riforme espresso modo molto semplice termine utilizzato coloro cercano promuovere riforma istituzioni finanziarie politiche pubbliche leggi speciali materia fiscale finanziaria lobiettivo principale maggior parte commentatori trovare soluzioni rendere banche accessibili pertanto riforma stata adottata consiglio stati uniti damerica marzo
0,incontri politici elettorali destra sinistra democrazia governo nazione italia processo democratico europa gestione partiti comunità politica istituzionale storia alternativa porta giorno doggi elezioni politiche diventate importanti solo partiti linformazione cittadini discorso pubblico strumento indispensabile democrazia diretta allinterno istituzioni
2,coerenza obbiettivo coerenza fiducia fattori governano lattuale situazione vista elezioni europee politica tempi stata sempre incentrata sullasse 20150314 1809360000001 popolari ipotizzanti opi comportamento parlamentari ipotesi
0,tema principale post lautore rivolge politici votato almeno mai fatto questione principio costituzionale elettori votano prima volta quando nato generale vota deve sapere cosa votare cosa ingamesinteticaconfigurazionemodifica
0,prima parte post rivolta tema articolo propone riflessione ampia temi importanti paese riguarda particolare daccordo dire mafia strada stata tortuosa seconda frase significativa lunica possibile proprio rappresenta ciò stato fatto livello nazionale quindi chiedersi ancora fase
2,parola tempo dio uomini serviti esseri umani diventare figli padre fatto mai nati modo padre fatti nascere incontridibattiti diritti persona 2018 occasione dellanniversario anni promulgazione leggi razziali giornata mondiale lantisemitismo celebr
0,unità partito democratico italiano sinistra italiana riflessioni rete politica lavoro diritti donne lavoro sviluppo sostenibile ambiente energia casa giovani immigrati migranti radio radicale diretta aprile ore 1405 1930 controinformazione testata indipendente libera libertaria intervista giorgio parodi volete
2,potenza voto sostenuto campagna elettorale candidato governatore provincia modena proposto candidatura sindaco pdl arrivato 398 mentre forza italia attesta all15 crescita invece lastensionismo parità seggi andati candidati liste civiche ottenuto voti rispetto forze politiche tradizionali udc lega nord coalizione
0,interessa discorso altro posizione merito programma sempre detto scritto critica politica riguarda largomento parla post cfr nuovo post cura roberto fassone 140
1,sentimentoritorno voglia matta guerra lasciava terra mai coraggio guardare indietro così difficile capire laccadere guerra siria arrivato mosca quasi anni vedere cosa dietro quel conflitto mondiale occidente europa stato bello ritrovarsi davanti palazzo sovietisti stadio bellissimo
2,significato concetto populismo ovvero modello sinistra radicale base movimenti radicali termine libertà infatti riferisce concezione generale società società persone possono essere libere qualsiasi obbligo stato denaro sindacati potere istituzioni politiche lidealismo stato utilizzato prima volta teoria sociale
2,autore topic autore luca toni letto domanda breve piacciono cose appassionano persone interessate ciò riguarda vita coppia ovvio tempo trascorso insieme maggiormente influenze genere maschile tratta storia damore allora emozioni donne possono essere influenzate altre
2,discorso soluzione politica problema elettori così disastrati crisi democrazia diretta chiama appunto poterne fare meno paura voto popolare voti grazie democrazie moderne maggioranza elettori votano modo molto democratico dellopposizione alcun partito democratico essere stato eletto elezioni politiche parlamentari però partiti politici
1,intoccabili autore lidia zuncheddu giornalista italiana nata milano 1978 occupata ricerca storica quotidiano giornale italia allestero pubblicato einaudi monografia capitale libro desordio rivoluzione francese dopo leminente lotta capitalismo alleati europei 2003
0,letto larticolo blog beppe grillo mette discussione blog stato risposto anonimo 23enne fatto domanda argomento detto livello risposte blogger risponde solo iscritto cioè penso persona mai parlato qualcuno straniero anzi direi maggior parte persone dice apertamente
3,struttura testo introduzione questione intercettazioni reati genere indagini difensive limportanza pronuncia sentenza chiara esaustiva rispetto valutazione dellopinione pubblica diritto processuale penale ruolo organi giustizia processo civile conclusioni conclusive nuove modalità comunicazione prospettive lesame riforma alcune indicazioni operative
2,commento post riferimento vuoi democrazia vuoi mai capito cosa intendi chiama espresso argomento avere voti parlamento modo sbagliato fare propaganda politica candidati stati nominati alcuni partiti politici poi votato buona ragione
3,strumenti dibattiti politici discorsi partito discorsi parlamentari mostra 2016 film stato prodotto netflix puoi vedere trailer qui sotto capire trama film puoi trovare tutte clip categoria cinema lato positivo qui trova lista completa film youtube stati trasmessi servizio televisivo nazionale via cavo può guardare video
2,brano canzone scritto speranza poterne scrivere casa musica forza dellamore figli leducazione coetanei stile capacità trasmettere meglio emozioni continua critica musicale 03122015 iniziamo oggi ascoltare pezzo under the skin
2,iscriviti ricevere newsletter redazione riserva diritto modificare qualsiasi momento contenuti provveduto pubblicazione verifica linformativa privacy completa seguente link grazie nome email testosterone bodybuilding accettazione privacy letto linformativa privacy accetto
4,frase colpito tratta sole ore titolo seguente giorno grado leggere romanzo livello cuore parola giorno stata coniata scrittrice jane austen quando appena diciannove anni espressione usata meno stesso contesto dice molto epoca seconda metà anni trenta veda film
2,denominazione falsi rivendicazione caso conflitto significato nome darte locuzione sentenza vede immagini relative sistema termini cancellazione riconversione termine utilizzato indicare controversia trattata esperti legali consulenti rischiava produrre conseguenze penali
1,riformatelismo pubblicazione 280416 categoria 1973 numero visite 510 versione stampabile nome utente riscontro favore riforma costituzionale senato italiano località bologna corso matteotti via santa maria assunta 106a etichette costituzione italiana
2,descrizione nome democratica deriva cognome fondatore democrazia cristiana serie caratteristiche ancora state estrapolate dalloriginale idee politiche demagogia chiave democratiche fondano sorta politica dellodio basata presupposto popolo sottomesso volontà popolare senza essere mai dominato interessi particolari persone lideologia
4,obiettivi breve periodo sviluppo economico osservando quadro generale laumento popolazione italia 64289 consumi stati complessivamente elevati donne rispetto uomini durante cinque anni antecedenti ingresso mondo lavoro quando registrato solo piccola percentuale nuovi occupati pari circa milioni persone
0,nome email compilare campo oggetto sito soggetto interessato vertente servizio protezione dati personali google trends mostra dettagli segnala lultimo messaggio bassosocial content login page testuale modifica collegamentiattualità post twitter tweet articoli correlati comunicazione
1,tema dibattito pubblico temi deve essere portato termine può essere rimandato maggioranza affrettando trovare soluzione permetta far problemi vengano risolti fronte mondo lavoro crisi economica internazionale causato morte maggior parte persone bisogna avere chiaro quali regole rispettare materia tutela lavoratori vale
2,ideologia politicapolitica educativareligiosa nome scientifico cosa tratta 100 titolo forum rendere propria vita umana prossimo reasoning politica 2762013 english utilizziamo cookie terze
1,capitolo partiti politica esseri umani storia democrazia modo ragione parlamentari iniziato parlare temi interesse comune paese usato termini politico sociale solito parole pronunciate persone mai profonda
2,testo nessun commento marco totti nato roma 1936 iniziato attività professionale licei roma seguito formazione accademica conseguì nelluniversità tor vergata allora corso occupato diritto privato economia processuale penale presso luniversità studi roma sapienza poi proseguito studi giuridici post
1,sistema elettorale assemblea consiglio comunale consiglio camera deputati gruppo stato chiesa cattolica italia parlamento europeo commissione parlamentare bei giochi casinò online gratis casino online italiani listabili online bei giochi casinò online gratis giocare casino online versione gratuita personalmente limiti divertimento deve quando gioca blackjack online
0,autore marco respinti docente universitario autore francesco sordini ordinario diritto penale delleconomia presso facoltà giurisprudenza sapienza università roma pubblicato riflessioni sullinterpretazione diritto costituzionale 2016 problema coppie gay italia problema può risolvere cambiando leggi italiane franco angeli pagina principale
4,naturalmente articolo può essere interpretato critica partito democratico approccio pacchetto voti partito coalizione esperienza personale risultato lotta politica interna allinterno pdm popolari liberali dellavvento politiche liberiste mondo lavoro piacerebbe quindi avere lopportunità commentare post blog pagine facebook
2,coinvolgere limportanza tema sostenibilità ambientale economica energetica obiettivo sostenere generazione sempre attenta tutela dellambiente diritti umani livello istruzione giovani soggetti maggiormente coinvolti sfera sociale culturale oltre essere soggetti portatori valori quali libertà individuale solidarietà percorso formativo campo focalizza temi ambientali continua
0,livello politico totale definizione termine populismo riferisce lotta partito democratico maggioranza popolazione genere laffermazione partitino parte cittadini conseguenza viene utilizzato indicare strategia comunicativa finalizzata promuovere contenuti politici economici amministrazioni locali nonché miglioramento status quo rispetto dellattuale stato cose
1,post stato letto 136 volte 20042018 ore 0759 commento segue niente positivo mai sentito alcun interesse confronti politica movimento cittadini paese soprattutto elezioni politiche convinta trattasse solo questione legata allimmagine personaggi pare però sbagliato credo democrazia rappresentativa
2,chiama cosa piace politica italiana politica estera italiana limmigrazione generale politiche dellaccoglienza etc etc categorie notizie altre voci dbt pdl m5s renzi pidd italia valori movimento cinque stelle btcusd euribm etf euribor bnt
2,volete essere politici potete scrivere infoit
2,autorei clementino nuti marco tarquinio angelo vitali giovanni covacich anno 20192020 concerne riforma imposte indirette 2018 detrazione irpef interessi passivi accessori riferimento voce relativa locazioni prevista lapplicazione dellires redditi lavoro dipendente
2,altro tema molto interessante interessa riforma processo penale questione stata affrontata maniera approfondita dottrina italiana parlerà partire luglio attraverso articoli 639 comma lettera seguenti codice procedura civile aspetti processuali luce riforme introdotte corso delliter legislativo larticolo 782bis codice proced
1,autore paolo zampetti tiscali editore kodansha 2013 pag 435 pag 683794 peso grammi collana einaudi editore feltrinelli prezzo cartaceo 400 data pubblicazione nov 2016 isbn 9788872374160
0,categoria trovi bei temi attualità aiuteranno pensare modo nuovo storia dellitalia qui troverai molti consigli idee principali costruire casa nuovo stato danimo articolo puoi trovare alcuni contenuti informazioni dovresti essere aggiornato quotidianamente voglia imparare qualcosa soli vuoi saperne idea prima iniziare scrivere qui blog ecco alcuni suggerimenti disc
1,diplomazia governo politici silvio berlusconi stato primo capo coalizione secondo ministro tesoro posizione personale parlamento riguarda politici poi scelto lopposizione parlamentare parlamento prima volta berlusconi eletto premier 1980 quando divenne presidente repubblica leader fatto scelta politica
2,vuole avvicinare tipo reato segnaliamo legge 230 settembre scorso vieta luso parola squalificante reati gravi quali furto spaccio lart 615bis prevede caso dolo grave pena lieve può essere meno lunga caso stato commesso fatto gravemente colposo
4,nessuna buona volontà limpegno partito riferimento allora buona probabilità qualcuno ascolterà possibile andare potere senza avere capacità conoscenza comprendere realtà vivi posso essere completamente daccordo fatto problema manifesta solo quando vive situazione genere puoi essere certo necessario capire cosa accadendo livello
3,distinguere senso modello caso difficile caratteristica distingue altri linguaggi molto diffusi usati litaliano lingua madre parlato scrittura questione modo parlare viene vista mezzo interscambio reciproco fra due lingue diverse può discutere argomenti diversi stessa lingua oppure cerca usare termini
0,nota testo stato pubblicato intero ulteriori dettagli effettuare cancellazione contenuto visitare blog file originale deve essere messo disposizione dellutente ricevuto poterlo recuperare eliminare proprio dispositivo link
2,testo disponibile formato pdf stampabile scaricato smartphone tablet maggiori dettagli contenuto consigliamo leggere guida lettore seguente link alternativa consulta documento ufficiale cliccando qui ogni volta comunità cerca farsi sentire piattaforma sempre qualcuno avvicina fare nulla farlo gente ancora pensando realtà nessuno neanche messaggio
1,simula unimpressione rivoluzione governo leffetto teoria popolo utopie può ottenere parte dallaltra quindi concetti base vengono applicati aspetti dellidealismo tuttavia tipo pensiero molte differenze persone concetto governo potrebbe essere riassunto tre categorie principali govern
4,necessario blog conflitto politica utilizza stesso permalink pagina deve essere aperta caso contrario verrà chiusa appena possibile commenti moderati automaticamente possono quindi essere letti condivisi condivisione post facebook vietata prega notare foto pubblicate twitter prese rete mentre pubblicate facebook appartengono fonti pubbliche immagini video
4,2015 litalia paese bassa percentuale disuguaglianza paesi europei dell85 persone ndr rispetto resto deuropa litalia paese colloca posizione politica favore cittadini grado conseguire maggiori tassi occupazione ricchezza popolazione italiana vive complesso sottosviluppo motivo sempre meno
4,sin primo giorno permanenza libia continuato lavorare paese presenza serie persone provenienti mondo diventata lesperienza quotidiana vita persone scelto rimanere territorio libico motivi lavoro svago principali differenze vari paesi cultura abitudini alimentari religione conflitto attuale mostrato solo poche migliaia persone state coinvolte movimento resistenza
2,elevato voto complessivo 502 88471 voti vuole parlare profondità tema diritti civili può dire tema giorno verità certo opinioni elettori però avviene paese parla molto razza sfera pubblica percentuali ancora nette rispetto
4,pubblicato redazione cultura società economia agosto 2019 itpresentazione rivoluzione partito democratico maggio 2017 unepoca crisi democrazia italiana perso ruolo centrale lotta paese mentre litalia stata attraversata profonda instabilità istituzionale economica accenna fermarsi
0,percorso link futuro sinistra altro categoria nuovi sistemi elettorali senato partiti lettura governo monti lattività dellassociazione sviluppa attraverso serie incontri associazioni aderenti progetto storia vissuta primo incontro dicembre ore 2030 presso sala conferenze dellhotel perla milano
2,nome conosce significato termine libero viene usato lingua inglese estensione parola riferisce alloppressione prigionia libertà linguaggio comune intende persona sola appartiene stato membro dellunione europea cognomi sesso genere etnia religione fede cultura generale cittadinanza opinione pubblica età stato civile opinioni politiche
0,durata totale registrazione ore massimo minuti numero massimo caratteri accettati 156 indirizzo email profilo personale
2,dati 6452018 anno riferimento 2019 3567671859 segnatura 9829 frase riferisce situazione lavoro mondo attuale crisi economica globale disoccupazione alta causa disoccupazione italia leconomia italiana crescendo realtà fatti aiuta problema immigrati
2,discutendo video maggio 2017 affermato legge copyright stata approvata stato esplicito espresso male forum ufficiale lega nord mariano solombrino scritto cosa trattava caso ministro cuperlo raccolta firme bossi sostegno delleurodeputata leghista
0,voce partiti argomenti discutono tratta politica politichese problema modo politici affrontano elezioni bisogno voto scegliere persona giusta messaggio sembra essere importante colpito molto meno situazione attuale fatto elettori possono esprimere preferenza ampia scelto partito
0,linguaggio stato sempre base dinamiche politiche coinvolto mondo partito ciascuno espresso sentito propria opinione pochi stati grado esprimere pienamente limportanza dellargomento parere esiste definizione ufficiale riguarda genere articoli forma importante parola democrazia democrazia realtà tratta sorta dettaglio volontà popolare determina
1,discorso simile ministro finanze mai nascosto opinioni politiche tema sostegno governo draghi effetti mandato stato così diplomazia arrivare persino posizione leadership persone coinvolte temi importanti democrazia italiana leggi sostenibilità litalia 2019 può essere green ecco alcuni punti nuova
2,prima volta movimento stelle affronta tematiche importanti scuola giustizia ultimi anni lattuale leadership politica saputo dimostrare sempre nuova linfa partiti politici momento storico parla tanto partito grillini soprattutto lega nord solo renzi continua video storia infinita lodo alfano
0,sistema voto tristemente simile paesi ocse persona può votare italia anni pochi sistemi voto permette avere carta didentità tessera sanitaria nazionale ogni cittadino europeo possiede due carte identità diverse entrambe uguali differenza tre versioni stessa lultima versione sistema diversi
2,intervento stato preceduto presentazione libro fine muri riflessione crisi democrazia italiana edito jaca book 2016 volume propone inoltre chiave sociologica psicologica politica comprendere comportamento persone attraverso meccanismi determinano scelte politiche individui allinterno dellorganizzazione autori scritto recensione testo trovate sito ufficiale jaca book
4,resistenza crimini dettati legge criminalità organizzata controllo frontiere confine sempre labile mentre web sgretolando modo irreversibile creando pochi ostacoli sistema diritti umani ormai sembra aver perso parte importante importanza panorama globale relazioni umane linformazione web cambiato radicalmente vite tecnologia moderna permette fare ciò
3,figura presidente repubblica oggetto discussione pubblica tratta semplice questione forma ruolo processo legislativo mandato presidenza viene assegnato camera deputati funzione principale consiste raccolta firme sottoporre referendum confermativi organi collegiali possono essere consultati verificare lammissibilità proposte risulta dallarticolazione quorum necessario senato
1,popolazione nascita sesso piva 10652870013 copyright 2020 fondazione istituto italiano storia resistenza delletà contemporanea pavia privacy policy cookie policy web design migliori annunci venditasiti webcom discussione migliori siti incontri internet pagina migliori
2,definizione età condizioni nome email crediti immagine emozione generale intimità umorismo passione allegria cordialità senso comunità amore amicizia impegno civile rispetto reciproco semplicità educazione gentilezza tolleranza affetto disponibilità dialogo empatia comprensione
2,riflessioni personali argomenti nikita 605 sostanzialmente politica gestita modo serio cosa molto importante prendere considerazione quando vuole avere fare questioni politiche ben sappiamo politici uguali quindi facile dare risposte cose serie comunque semplici poter arrivare compromesso due persone così spesso ritroviamo situazioni
2,21072019 testo pagina stato tradotto automaticamente quindi bisogno alcuna guida leggerlo saperne titolo clicca qui testo messaggio segue parte dellautore blog domani sera proposito questione legalizzazione diritti materia contratti proposta due aziende trasmettere partite iva nuovo codice appalti
2,parole chiave motivate movimento stelle movimento cinque stelle referendum legge bossifini conseguenze sullimmigrazione disinformazione massa politica dellattuale governo pronta compromesso poteri stato democratici messo atto 270314 0809 151 ciao
